id,comment_id,video_id,commenter_name,commenter_id,comment_displayed,comment_original,likes,published_date,updated_date,total_replies,replyto
4441,UgzfwtaW0Gh1FB67dg14AaABAg,jlGuBqQPxF8,"Silent Zoner",UCPDTi56zxu5zSbaYkr1sj2w,"90% of Americans don’t even no they are in a war with Russia who has passed them as a super power and 95% of uk citizens have no idea how fkd we are if Russia retaliates even with a minimalist strike. Uk has 0 active bomb shelters and no early warning system. America is fkd if Russia cooperate with China and stop  supplying oil/ fuel all the Great War machines in the world don’t do shit if you got no fuel and Russia has the fuel lol sooo bye bye uk/USA and well the French ain’t even a consideration lol","90% of Americans don’t even no they are in a war with Russia who has passed them as a super power and 95% of uk citizens have no idea how fkd we are if Russia retaliates even with a minimalist strike. Uk has 0 active bomb shelters and no early warning system. America is fkd if Russia cooperate with China and stop  supplying oil/ fuel all the Great War machines in the world don’t do shit if you got no fuel and Russia has the fuel lol sooo bye bye uk/USA and well the French ain’t even a consideration lol",1,"2018-04-15 03:51:31","2018-04-15 03:51:31",3,null
4442,UgzfwtaW0Gh1FB67dg14AaABAg.8f2PqX_2riL8f4-kSaqXb2,jlGuBqQPxF8,"Giggle Lizard",UCZPqgUQVm8MigoztWl2p_eA,"How do you no they have no fuel wow youre so frustrating","How do you no they have no fuel wow youre so frustrating",0,"2018-04-15 18:41:59","2018-04-15 18:41:59",0,UgzfwtaW0Gh1FB67dg14AaABAg
4443,UgzfwtaW0Gh1FB67dg14AaABAg.8f2PqX_2riL8f4-KGLoPQL,jlGuBqQPxF8,"Giggle Lizard",UCZPqgUQVm8MigoztWl2p_eA,"Love how you all this info you should sell it to russia you will be rich like you no what they have hahaha dont you just love speculative people there the most stupid people we live amongst","Love how you all this info you should sell it to russia you will be rich like you no what they have hahaha dont you just love speculative people there the most stupid people we live amongst",0,"2018-04-15 18:38:16","2018-04-15 18:38:16",0,UgzfwtaW0Gh1FB67dg14AaABAg
4444,UgzfwtaW0Gh1FB67dg14AaABAg.8f2PqX_2riL8f2ZS70gYve,jlGuBqQPxF8,"Silent Zoner",UCPDTi56zxu5zSbaYkr1sj2w,"SACATTACK716AK420 and just how are those snipers to get there? Walk or swim.. remember no fuel","SACATTACK716AK420 and just how are those snipers to get there? Walk or swim.. remember no fuel",0,"2018-04-15 05:15:26","2018-04-15 05:15:26",0,UgzfwtaW0Gh1FB67dg14AaABAg
4445,UgzfwtaW0Gh1FB67dg14AaABAg.8f2PqX_2riL8f2Yz7CXxIa,jlGuBqQPxF8,SACATTACK716AK420,UCktI2kQ-0frprsRLrE2Aosw,"Silent Zoner well we have snipers 1 bullet would blow Putins head clean off he loves being in the public so hope he dont act tough cuz I wouldnt want a seal team of snipers hunting him","Silent Zoner well we have snipers 1 bullet would blow Putins head clean off he loves being in the public so hope he dont act tough cuz I wouldnt want a seal team of snipers hunting him",0,"2018-04-15 05:11:20","2018-04-15 05:11:20",0,UgzfwtaW0Gh1FB67dg14AaABAg
4446,UgwsTlOl5hUfq3gZAb54AaABAg,jlGuBqQPxF8,"El Ray",UCDrl2TH2XBveZNQyBgW2csg,"The wise know. The west wants to destroy you cause you are getting too strong and you will have no choice but to push the button first to survive.","The wise know. The west wants to destroy you cause you are getting too strong and you will have no choice but to push the button first to survive.",0,"2018-04-15 03:31:21","2018-04-15 03:31:21",0,null
4447,UgzEiw45bfQTRAaOyYF4AaABAg,jlGuBqQPxF8,"Jumperman 1",UCBXoWycZzf23yZx1tXQQ2tA,"And believe me, Russia fears US as well.....","And believe me, Russia fears US as well.....",2,"2018-04-15 03:30:06","2018-04-15 03:30:06",0,null
4448,UgwSBbQBTiKws98Ckqp4AaABAg,jlGuBqQPxF8,"John Michalek",UCuML7yij0X6sExbmibOrusg,"Is Europe worth defending. It is full of evil socialist scum with a back bone of Muslim scum. Why do you keep dragging up yesterdays gay monkey.","Is Europe worth defending. It is full of evil socialist scum with a back bone of Muslim scum. Why do you keep dragging up yesterdays gay monkey.",0,"2018-04-15 03:29:40","2018-04-15 03:29:40",0,null
4449,UgyUnOkZCutMCHKG-A14AaABAg,jlGuBqQPxF8,Fester7960,UCiyAaVWFxsZC6Iok5IfMfDg,"Theres not going to be WW3...not yet anyhow.

How can you know? Ask yourself, if you were Putin, would you set off WW3 over Syria? A backwards, third world banana republic? No, and why? 

Because Putin knows, and everyone knows, that a war between the U.S. and Russia is unwinnable. Everybody dies.","Theres not going to be WW3...not yet anyhow.

How can you know? Ask yourself, if you were Putin, would you set off WW3 over Syria? A backwards, third world banana republic? No, and why? 

Because Putin knows, and everyone knows, that a war between the U.S. and Russia is unwinnable. Everybody dies.",2,"2018-04-15 03:29:39","2018-04-15 03:29:39",0,null
4450,UgxUa2EMHoP1AORPAtF4AaABAg,jlGuBqQPxF8,"Violet Ho",UCBWJ1LqyrikABsTAJH4jFUA,"Hope Puttin think about not to start ww3 too early, no one like war, Trump is playing the war game with his computer too much that he did not know what is the importance of peace, some Americans do not like war and ask him to stop, this tells Puttin why after throwing bombs, they all left, hope Puttin speak more in English and let more Americans know war is no good, only peace is good to everyone","Hope Puttin think about not to start ww3 too early, no one like war, Trump is playing the war game with his computer too much that he did not know what is the importance of peace, some Americans do not like war and ask him to stop, this tells Puttin why after throwing bombs, they all left, hope Puttin speak more in English and let more Americans know war is no good, only peace is good to everyone",0,"2018-04-15 03:15:38","2018-04-15 03:15:38",0,null
4451,UgwVOr0qEIkXFd6uM-t4AaABAg,jlGuBqQPxF8,Warmechx,UCyoK2l2varCBPSjxqBnl9bw,"People actually follow this fear porn channel lmao ???","People actually follow this fear porn channel lmao ???",0,"2018-04-15 03:09:29","2018-04-15 03:09:29",0,null
4452,UgygS4KMbGZsCqkWNmd4AaABAg,jlGuBqQPxF8,"สยาม Siam",UCRg4630YfYRFmjzXboY-tnA,"USA Win WW3 with love real people world","USA Win WW3 with love real people world",0,"2018-04-15 03:06:05","2018-04-15 03:06:05",0,null
4453,Ugy3G6UlaGg-cqc2Hp54AaABAg,jlGuBqQPxF8,"Jose Duran",UCiRupx1rv48WYYYtYsqzwWA,"The west have a very small army compared to Russia, lets remember that the west is a democracy, and Russia is not.","The west have a very small army compared to Russia, lets remember that the west is a democracy, and Russia is not.",0,"2018-04-15 02:59:45","2018-04-15 02:59:45",0,null
4454,Ugz1AKNhTzKa0QJceQp4AaABAg,jlGuBqQPxF8,"Jose Duran",UCiRupx1rv48WYYYtYsqzwWA,"Russia is the aggressor here, the baltic countries fear a militaristic Russia. The end of the world. .","Russia is the aggressor here, the baltic countries fear a militaristic Russia. The end of the world. .",0,"2018-04-15 02:57:58","2018-04-15 02:57:58",0,null
4455,UgyqF3UYX-mbTEWZVtZ4AaABAg,jlGuBqQPxF8,"Jose Duran",UCiRupx1rv48WYYYtYsqzwWA,"WW3 will pass only if Russia starts it. The submarines around the world will obliterate Russia, nobody will win this.","WW3 will pass only if Russia starts it. The submarines around the world will obliterate Russia, nobody will win this.",0,"2018-04-15 02:55:38","2018-04-15 02:55:38",0,null
4456,UgzUVDoZ6k4GNkgWeIt4AaABAg,jlGuBqQPxF8,"michaeladam caira",UC_w6rnJebFMNKwadAU1KC1g,"Putin needs to stfu","Putin needs to stfu",0,"2018-04-15 02:49:46","2018-04-15 02:49:46",0,null
4457,UgyrlMNHQPccMxyNcet4AaABAg,jlGuBqQPxF8,"Jack SYNN",UCrdj7bEft8rsoQTtLJZcp8w,"small volcano explored on Bali , caused heavy snow in.north USA, weather was gone to minus 60, 
If USA fighting to everyone to protect shit_in syria as I am a big gentleman, USA people will  get nightmare,","small volcano explored on Bali , caused heavy snow in.north USA, weather was gone to minus 60, 
If USA fighting to everyone to protect shit_in syria as I am a big gentleman, USA people will  get nightmare,",0,"2018-04-15 02:48:37","2018-04-15 02:48:37",0,null
4458,UgxiJGEUrFRVhKDgUW94AaABAg,jlGuBqQPxF8,"no hassle",UCTIhFLkCAI7GCWkSmn7Jp8A,"Why are you scaremongering you worthless pile of shit. When did Putin warn this? Does he want the end of the world?","Why are you scaremongering you worthless pile of shit. When did Putin warn this? Does he want the end of the world?",0,"2018-04-15 02:45:48","2018-04-15 02:45:48",0,null
4459,Ugz9JDGbYeh1-Xt1b6d4AaABAg,jlGuBqQPxF8,"Jack SYNN",UCrdj7bEft8rsoQTtLJZcp8w,"trump wants more money of oil EXPORT before enter to electric vehicle ERA_
American will pay more tax, and suffered from nuclear war, 10 million people in.New York city and metropolitan will die on the same second, 20 million people around New York and New Jersey will be wounded from this single mass weapon struck. for Manhattan zone will be wiped out of world Mao. 
American president loves war, innocent American must be responsible of what mad dog trump doing,","trump wants more money of oil EXPORT before enter to electric vehicle ERA_
American will pay more tax, and suffered from nuclear war, 10 million people in.New York city and metropolitan will die on the same second, 20 million people around New York and New Jersey will be wounded from this single mass weapon struck. for Manhattan zone will be wiped out of world Mao. 
American president loves war, innocent American must be responsible of what mad dog trump doing,",0,"2018-04-15 02:44:21","2018-04-15 02:44:21",0,null
4460,UgyKZ2bIUl6zeTSqH5l4AaABAg,jlGuBqQPxF8,"Lorenco Sinop",UCN4vheCFHmpANLWG-ic2CIg,"Got enoph ads bro?","Got enoph ads bro?",0,"2018-04-15 02:42:49","2018-04-15 02:42:49",0,null
4461,UgxuDqkck3GG1-IrxBx4AaABAg,jlGuBqQPxF8,"Mike Sheridan",UCIzuqa7HY6sdEZ4r7DWMFrg,Bullshit,Bullshit,0,"2018-04-15 02:41:50","2018-04-15 02:41:50",0,null
4462,UgxQQYj7os-VjL4-hn54AaABAg,jlGuBqQPxF8,"Titanium neck",UCiBHyOmzodCP94vrOygsySg,"Fuck putin clean your ass Esau Fuck","Fuck putin clean your ass Esau Fuck",0,"2018-04-15 02:37:39","2018-04-15 02:37:39",0,null
4463,UgwtGVBQe4OnuQ7P3Xl4AaABAg,jlGuBqQPxF8,"nikko 83",UCmSsF6YGvRBPCEvwv_3tkZw,"thumb down","thumb down",0,"2018-04-15 02:32:23","2018-04-15 02:32:23",0,null
4464,Ugwv8HOAsDzhfyYYDTV4AaABAg,jlGuBqQPxF8,"nikko 83",UCmSsF6YGvRBPCEvwv_3tkZw,"dumb video ever.. like a kid","dumb video ever.. like a kid",0,"2018-04-15 02:31:24","2018-04-15 02:31:24",0,null
4465,UgzO9yy78qfMsFGTf6B4AaABAg,jlGuBqQPxF8,"patrick mchenry",UCIw5bdRzSRksK8nItqrDR-w,"US and NATO  aggression relentless toward the Russian border without diplomacy. This is very dangerous. I dont know how Russia will respond, but its clear the West is moving quickly to contain any possibility of Russia  fighting outside its border to protect its homeland.","US and NATO  aggression relentless toward the Russian border without diplomacy. This is very dangerous. I dont know how Russia will respond, but its clear the West is moving quickly to contain any possibility of Russia  fighting outside its border to protect its homeland.",0,"2018-04-15 02:31:05","2018-04-15 02:31:05",0,null
4466,Ugxjq8CiCmCSqMEjC0l4AaABAg,jlGuBqQPxF8,"Loreen Degenstein",UCJxZv6dM8r4OEDNU7VD1_ow,"NATO and the UN have been paid off by the Global Cabal.","NATO and the UN have been paid off by the Global Cabal.",0,"2018-04-15 02:28:44","2018-04-15 02:28:44",0,null
4467,UgwPfCVK6IrgQzfDIN94AaABAg,jlGuBqQPxF8,"Pat Steele",UCenHTOsqVln7AnP0J6T1o8Q,"The Lord said Fear not for I am with thee. These people work on fear. Preach the good news that JESUS CHRIST is our Lord and Saviour so whom else should we fear only the Lord Jesus for he has more power than anything in this universe. Be happy that Jesus Christ is our only way to truth and freedom.","The Lord said Fear not for I am with thee. These people work on fear. Preach the good news that JESUS CHRIST is our Lord and Saviour so whom else should we fear only the Lord Jesus for he has more power than anything in this universe. Be happy that Jesus Christ is our only way to truth and freedom.",1,"2018-04-15 02:26:37","2018-04-15 02:26:37",0,null
4468,UgwDzSRuqrGhuQITar54AaABAg,jlGuBqQPxF8,"Loreen Degenstein",UCJxZv6dM8r4OEDNU7VD1_ow,"America is the country that hides all the secret/black op weapons!  Thats why Russia is pissed off!  They arent bad guys and the Global Cabal has their deep state military in America!  Both Russia and China know this.","America is the country that hides all the secret/black op weapons!  Thats why Russia is pissed off!  They arent bad guys and the Global Cabal has their deep state military in America!  Both Russia and China know this.",0,"2018-04-15 02:22:32","2018-04-15 02:24:00",0,null
4469,UgxSKalXgWbCkpivodB4AaABAg,jlGuBqQPxF8,"Chris Reuben",UCK_hOc4AvrlBFNMeuljhBEA,"FUCK WW3 AND FUCK THE NWO ? ? ? ? ? ? ?","FUCK WW3 AND FUCK THE NWO ? ? ? ? ? ? ?",0,"2018-04-15 02:19:38","2018-04-15 02:19:38",0,null
4470,Ugzso1BkMMH3nk1KOt94AaABAg,jlGuBqQPxF8,"Loreen Degenstein",UCJxZv6dM8r4OEDNU7VD1_ow,"RUSSIA IS NOT THE ENEMY!!  The real enemy is the Global Cabal Deep State consisting of the Rothschilds and Cronies (Soros), the Vatican and the British Crown.  Russia and Assad are being targeted by the Global Cabal as the enemy.  WAKE UP!!","RUSSIA IS NOT THE ENEMY!!  The real enemy is the Global Cabal Deep State consisting of the Rothschilds and Cronies (Soros), the Vatican and the British Crown.  Russia and Assad are being targeted by the Global Cabal as the enemy.  WAKE UP!!",0,"2018-04-15 02:18:45","2018-04-15 02:18:45",0,null
4471,Ugz-DkAxpUmFZmjF8Qh4AaABAg,jlGuBqQPxF8,"Ben Hutchins",UC8YmG_Wni71MUxxrs1wCzgA,"Why dont you very VERY sick people stop your lies and bullshit all this has been set up all that militar equipment moved on trains all them caskets been found and the wallmart stores was all for this ......get ready folks look after your loved ones good luck!!!!!","Why dont you very VERY sick people stop your lies and bullshit all this has been set up all that militar equipment moved on trains all them caskets been found and the wallmart stores was all for this ......get ready folks look after your loved ones good luck!!!!!",0,"2018-04-15 02:17:03","2018-04-15 02:17:03",0,null
4472,UgztXV4dof803t2wciV4AaABAg,jlGuBqQPxF8,"Adolf sHitler",UCbBjrQaCMajV4i_UCuGD3Qw,"When making WW3 videos always remember to put over over 16 adds into a 20 minute video that way you can maximize youre profits.","When making WW3 videos always remember to put over over 16 adds into a 20 minute video that way you can maximize youre profits.",0,"2018-04-15 02:14:18","2018-04-15 02:14:18",0,null
4473,UgwGZIrH5Ui5tBgkgCZ4AaABAg,jlGuBqQPxF8,"John Kunkle",UCZ5M-YQ6YvISNRpVzHtudoA,"I appreciate your comments. They are valid. However, lets put things in historical perspective. Eastern Europe was occupied by the Soviets for fifty years after The Great Patriotic War. Do you think such people forget such things? Of course not. So it is natural for those countries that the Soviets occupied to want to defend themselves. Admittedly the US generated a coup in Ukraine, which the Russians responded by occupying the Russian speaking portions of Ukraine. The same argument was made by Hitler when he took over Austrian and the Sudetenland in the Czech Republic. There are Russian speaking people in the Baltic Countries and Eastern Europe. Is Russia going to use the same argument to liberate them? So the consequence is that these countries are preparing against a Russian invasion. Russia says they are building defenses on their border. These countries are saying, No, we are building defenses on OUR borders. Dont forget it wasnt that long ago that the Russians shot down the plane full of the Polish government officials. People dont forget these things. So the actions of Russia in Ukraine and their support for rogue regimes like Syria, Iran, Yemen, Hezbollah, et cetera doesnt make them look like they are friends to the rest of the world. In short, Russia is suffering for the consequences of the current and previous actions. They have been the wolves not the lambs so they should stop acting like victims. Likewise, China declaring that 3/4 ths of the South China Sea is like the United States claiming sovereignty in the Pacific Ocean to Hawaii. Its a ridiculous argument designed only to flex their own power. Then the Chinese buy oil from Iran, sign a pack with Pakistan, which only aggravates India. India very well may be the future of Asia in the future. The Chinese have a debt to income ratio of 3 to 1l they have built a bunch of cities of 10 million people where nobody lives; there population is aging; and they have a shortage of women due to their one child policy. Of course, these two countries are trying to knock the US off their perch. But what they dont see is that the rest of the world is not comfortable with the actions of Russia and China -- effectively governments run by dictators. So whose side do you think the rest of the countries of the world will side with?","I appreciate your comments. They are valid. However, lets put things in historical perspective. Eastern Europe was occupied by the Soviets for fifty years after The Great Patriotic War. Do you think such people forget such things? Of course not. So it is natural for those countries that the Soviets occupied to want to defend themselves. Admittedly the US generated a coup in Ukraine, which the Russians responded by occupying the Russian speaking portions of Ukraine. The same argument was made by Hitler when he took over Austrian and the Sudetenland in the Czech Republic. There are Russian speaking people in the Baltic Countries and Eastern Europe. Is Russia going to use the same argument to liberate them? So the consequence is that these countries are preparing against a Russian invasion. Russia says they are building defenses on their border. These countries are saying, No, we are building defenses on OUR borders. Dont forget it wasnt that long ago that the Russians shot down the plane full of the Polish government officials. People dont forget these things. So the actions of Russia in Ukraine and their support for rogue regimes like Syria, Iran, Yemen, Hezbollah, et cetera doesnt make them look like they are friends to the rest of the world. In short, Russia is suffering for the consequences of the current and previous actions. They have been the wolves not the lambs so they should stop acting like victims. Likewise, China declaring that 3/4 ths of the South China Sea is like the United States claiming sovereignty in the Pacific Ocean to Hawaii. Its a ridiculous argument designed only to flex their own power. Then the Chinese buy oil from Iran, sign a pack with Pakistan, which only aggravates India. India very well may be the future of Asia in the future. The Chinese have a debt to income ratio of 3 to 1l they have built a bunch of cities of 10 million people where nobody lives; there population is aging; and they have a shortage of women due to their one child policy. Of course, these two countries are trying to knock the US off their perch. But what they dont see is that the rest of the world is not comfortable with the actions of Russia and China -- effectively governments run by dictators. So whose side do you think the rest of the countries of the world will side with?",0,"2018-04-15 02:13:02","2018-04-15 02:13:02",0,null
4474,Ugwyp40h9do1ewyedAd4AaABAg,jlGuBqQPxF8,"Slip Å Slit",UC8kPJtBnNbcrQTPOW5afnkA,"That voice is fucking annoying","That voice is fucking annoying",0,"2018-04-15 02:05:41","2018-04-15 02:05:41",0,null
4475,UgwDcFGJzW6oo2oE8S54AaABAg,jlGuBqQPxF8,"Jorge Eduardo Rodriguez Manrique",UC73Ie8sVswaP4zM3LhVXNUg,"Tomahawks to invade weak Countries only. Not to invade Russia or China. USA is strong with the weak and weak with the strong","Tomahawks to invade weak Countries only. Not to invade Russia or China. USA is strong with the weak and weak with the strong",0,"2018-04-15 02:04:49","2018-04-15 02:04:49",0,null
4476,UgwxcCxijg4QsAM5fkd4AaABAg,jlGuBqQPxF8,"Niq Adniey",UCvcKwjh_1qAPze4nBC1mWjg,"Fuck off NATO PIG","Fuck off NATO PIG",0,"2018-04-15 02:02:22","2018-04-15 02:02:22",0,null
4477,UgxObSivBtWQfA5myfp4AaABAg,jlGuBqQPxF8,"Tom Dockery",UCS5ipqsxhC0M08BuJh3IBZw,"Putin is the same as is China and North Korea:Big talk,no action!","Putin is the same as is China and North Korea:Big talk,no action!",0,"2018-04-15 01:58:44","2018-04-15 01:58:44",0,null
4478,Ugxtd_XAP5DTpREFV1J4AaABAg,jlGuBqQPxF8,"Anita Luca",UCqh5A_OjROXyXbS20DjU2fg,"Russias not retaliating.  No country wants a war bc of the hit to the economy. War is not affordable and Russias economy is weak to begin with.","Russias not retaliating.  No country wants a war bc of the hit to the economy. War is not affordable and Russias economy is weak to begin with.",0,"2018-04-15 01:58:15","2018-04-15 01:58:15",0,null
4479,UgwzhSSC1lc5gM0pjJx4AaABAg,jlGuBqQPxF8,"S Money",UCGmU-bLiH22oCCL3z1P3znw,"? hey Fuck you Putin and your old ass army, Ill rain fire like never seen before.
Your friend Donald ??","? hey Fuck you Putin and your old ass army, Ill rain fire like never seen before.
Your friend Donald ??",0,"2018-04-15 01:54:33","2018-04-15 01:54:33",0,null
4480,Ugw109IJiaUAsy-FrXR4AaABAg,jlGuBqQPxF8,"Lou DeKrisse",UC8veSYKFnJxXaSftxtBqfZA,"Russia is like a big barking dog. All bark, little bite. Does Russia, whom I do respect as a great nation , really want a war that will ruin their already struggling economy. A costly war where they are totally unmatched militarily by the U.S.A and its Western Allies. And will evaporate any respect the rest of the world has for Russia?
If they are insane enough to go nuclear, then they sign their own death warrant as a nation, not to mention potentially fucking the environment of the rest of the world!","Russia is like a big barking dog. All bark, little bite. Does Russia, whom I do respect as a great nation , really want a war that will ruin their already struggling economy. A costly war where they are totally unmatched militarily by the U.S.A and its Western Allies. And will evaporate any respect the rest of the world has for Russia?
If they are insane enough to go nuclear, then they sign their own death warrant as a nation, not to mention potentially fucking the environment of the rest of the world!",0,"2018-04-15 01:54:14","2018-04-15 01:57:04",0,null
4481,UgxM2s0a6AEfMRGo_MF4AaABAg,jlGuBqQPxF8,"m. mann",UCZviAsTm5uudJpyipP0NTIg,"The end of the world is near","The end of the world is near",0,"2018-04-15 01:50:33","2018-04-15 01:50:33",0,null
4482,UgwqOulPGFVu0YIpmD94AaABAg,jlGuBqQPxF8,"Victor Ferrera",UCOSs11ssS8QJavexnomM0NA,"fake news,,,,, why not sent ussr donald trump lol.......nato,,,,,","fake news,,,,, why not sent ussr donald trump lol.......nato,,,,,",0,"2018-04-15 01:49:09","2018-04-15 01:49:09",0,null
4483,UgxklgUtK7cz1blqlQV4AaABAg,jlGuBqQPxF8,"Blackpowder Productions",UC3tSj-irpazf0yu9YLknDhA,"Who cares humans deserve what is coming , can’t get along after all these years , let’s just say stupid in the very least .","Who cares humans deserve what is coming , can’t get along after all these years , let’s just say stupid in the very least .",0,"2018-04-15 01:48:27","2018-04-15 01:48:27",0,null
4484,UgxgF2l6OFWEgzuOGFV4AaABAg,jlGuBqQPxF8,"Serene Marine",UCk74jIAAxqlb8j_AKJ_ZSKg,"Bullshit prepetuated by the same 2 ppl who tainted our American system of Democracy. Trump and Putin. Theyre both representing the same interests. Two Billionaires laughing about their contrived bullshit behind our backs","Bullshit prepetuated by the same 2 ppl who tainted our American system of Democracy. Trump and Putin. Theyre both representing the same interests. Two Billionaires laughing about their contrived bullshit behind our backs",0,"2018-04-15 01:47:30","2018-04-15 01:47:30",0,null
4485,UgwTM7CcGDRgj_BgYK54AaABAg,jlGuBqQPxF8,"L. Torrence",UC4YVQkLDepmx7oQ0HBkZMJw,"Stop it. This channel should be ashamed of this warmongering reporting.","Stop it. This channel should be ashamed of this warmongering reporting.",0,"2018-04-15 01:45:50","2018-04-15 01:45:50",0,null
4486,Ugw-vJWeOpvrE7J1i5V4AaABAg,jlGuBqQPxF8,"sardar sardar",UCq1H8V4rAJ133cY6Ou2dEqg,"Russian  and American  are bluffing with Muslims  both are responsible for the distrust ion  of Muslims countries testing theres weapons and killing civilians","Russian  and American  are bluffing with Muslims  both are responsible for the distrust ion  of Muslims countries testing theres weapons and killing civilians",0,"2018-04-15 01:44:41","2018-04-15 01:44:41",0,null
