id,comment_id,video_id,commenter_name,commenter_id,comment_displayed,comment_original,likes,published_date,updated_date,total_replies,replyto
4379,UgyQIzCr2z6KYF46sYd4AaABAg,jlGuBqQPxF8,"Renee Hannan",UCjTFbNgQBdZ0w2Oay8lzpNQ,"Puttin you BETTER cool your arm pits broo I have some nice armenhammer for ya on sale $1 special oh yeah those dollar stores PUTTIN CHILL PLZZ YOUR NOT NO MIGHTY ANYTHINGGGG","Puttin you BETTER cool your arm pits broo I have some nice armenhammer for ya on sale $1 special oh yeah those dollar stores PUTTIN CHILL PLZZ YOUR NOT NO MIGHTY ANYTHINGGGG",0,"2018-04-15 22:11:05","2018-04-15 22:11:05",0,null
4380,UgyIOa6B-8Z8ogitqVF4AaABAg,jlGuBqQPxF8,"Breaking News TV Russian Accent",UCMCu6siE6psoEHjRuR2_hJg,"I cannot believe that my 2 years old videos are still getting so many views on other channels","I cannot believe that my 2 years old videos are still getting so many views on other channels",1,"2018-04-15 21:15:08","2018-04-15 21:15:08",0,null
4381,UgxED5mjlH1O0LkaSxl4AaABAg,jlGuBqQPxF8,"Undisputed Records",UC0gShOch34bP9WAREVjLE8g,#Makaveli,#Makaveli,0,"2018-04-15 20:43:36","2018-04-15 20:43:36",0,null
4382,Ugw_97E_MQeU6tn745t4AaABAg,jlGuBqQPxF8,blahblah,UCP1xXgl3FBRmtZVIyI4WM0A,"We commoners will never have a say with regards to what the high lords do. All we can do is keep our souls as ready as possible and carry on with our lives until its our time.","We commoners will never have a say with regards to what the high lords do. All we can do is keep our souls as ready as possible and carry on with our lives until its our time.",0,"2018-04-15 20:18:29","2018-04-15 20:18:29",0,null
4383,UgwMLLVIcbv9WbcRDVV4AaABAg,jlGuBqQPxF8,"Romek Dubczek",UCQ1qxfhesd23pSu-xX3ULww,"oh no, the guy with the strange accent","oh no, the guy with the strange accent",0,"2018-04-15 19:41:52","2018-04-15 19:41:52",0,null
4384,UgzI2WiNOq1_tIBnwm54AaABAg,jlGuBqQPxF8,"Ellondel Sinoy",UCLBIIAjXk55FFNpMwV-fhVA,"I think f ww3 will start America will lose ..and that the time of Antichrist to rise if America be will fall.","I think f ww3 will start America will lose ..and that the time of Antichrist to rise if America be will fall.",0,"2018-04-15 19:00:52","2018-04-15 19:00:52",0,null
4385,Ugzn2NVlZ5viNNUIZON4AaABAg,jlGuBqQPxF8,"Bubba Giles",UCNFvQJsuNPqF1WWObs3Xe3w,"FK Russia and the horse they rode in on.they were responsible for destroying those chemicals.","FK Russia and the horse they rode in on.they were responsible for destroying those chemicals.",0,"2018-04-15 18:51:13","2018-04-15 18:51:13",0,null
4386,Ugyr_y8prTqWc98IYWt4AaABAg,jlGuBqQPxF8,"terry shead",UC8pWFffLwzXK0DFt-diOGxA,"These idiots are psychopaths, they all want to die, bring it on you sick idiots.","These idiots are psychopaths, they all want to die, bring it on you sick idiots.",0,"2018-04-15 18:30:10","2018-04-15 18:30:10",0,null
4387,UgwWIw4OGPuYChA-36B4AaABAg,jlGuBqQPxF8,Wooooooooooooooooooo,UCNItBPgg0809SooVXxYP-Ng,"how many adds???? Disgusting I thought youd take this more seriously.....","how many adds???? Disgusting I thought youd take this more seriously.....",0,"2018-04-15 18:18:38","2018-04-15 18:18:38",0,null
4388,UgyJmdHeGx8K2-yIdR14AaABAg,jlGuBqQPxF8,"Jackie Blue",UCJQvLlvLV-KNlHIpnA_4FJw,"This is what Trump supporters put in office https://www.theatlantic.com/politics/archive/2017/01/donald-trump-scandals/474726/","This is what Trump supporters put in office https://www.theatlantic.com/politics/archive/2017/01/donald-trump-scandals/474726/",0,"2018-04-15 18:00:13","2018-04-15 18:00:13",0,null
4389,UgzxVNS0R-6QfAGloV14AaABAg,jlGuBqQPxF8,"j wardroper",UCIZTmxDjNp-UHAS7bBRQAkA,"putin its all about you ! rip off","putin its all about you ! rip off",0,"2018-04-15 17:53:25","2018-04-15 17:53:25",0,null
4390,UgzMem-7loH2HYnlzRR4AaABAg,jlGuBqQPxF8,"Jonas A",UCEBJSelU09gWGv7HyOoTunQ,"Blah blah. A bunch ot bullshit.","Blah blah. A bunch ot bullshit.",0,"2018-04-15 17:41:21","2018-04-15 17:41:21",0,null
4391,Ugz_9afduPv_Ta2gxhZ4AaABAg,jlGuBqQPxF8,506jimbob,UCovdse7VbGb9sF6gwqkshDw,"Its so exciting....","Its so exciting....",0,"2018-04-15 17:38:21","2018-04-15 17:38:21",0,null
4392,Ugxz7jlPCOaHMNbYhax4AaABAg,jlGuBqQPxF8,"Truth Better Than Fiction",UCuR9YE_ODYR_jERoVvylumg,"Bullshit News, worse than CNN","Bullshit News, worse than CNN",0,"2018-04-15 17:32:18","2018-04-15 17:32:18",0,null
4393,UgzJKIDowDM-QdnD-Rp4AaABAg,jlGuBqQPxF8,"Ilikeminecraft Allday",UCWtbDD7mHLLnTvkv70-db2Q,"When you look up for ww3 vids and the comments are about Jesus-.-","When you look up for ww3 vids and the comments are about Jesus-.-",0,"2018-04-15 17:31:54","2018-04-15 17:31:54",0,null
4394,Ugx4Ro56VMBDti7bPP94AaABAg,jlGuBqQPxF8,"C Gall",UC_1913Lfc_HvkpOauHfaFCw,"rt is owned by alt-left-anti-American-commies.","rt is owned by alt-left-anti-American-commies.",1,"2018-04-15 17:25:29","2018-04-15 17:25:29",0,null
4395,UgxqTZSPCU73f4iBnCp4AaABAg,jlGuBqQPxF8,"Michael Stanton",UCbkUN6LV803X5sSPu56ljcQ,"Putin would be hiding in a hole in 5 min. Russia is weak, they cant compete. If they had a greater military power, they would have used it against us already, like they have to anyone weaker.","Putin would be hiding in a hole in 5 min. Russia is weak, they cant compete. If they had a greater military power, they would have used it against us already, like they have to anyone weaker.",0,"2018-04-15 16:57:03","2018-04-15 16:57:03",0,null
4396,UgwJtvHNqIbOB2Y8WPF4AaABAg,jlGuBqQPxF8,1815Offixial,UCP8ZwY2oYpsGNAoWnLRZKiQ,"Its only going to make the war in Syria worse... Not ww3... The Syrian war is technically a global conflict","Its only going to make the war in Syria worse... Not ww3... The Syrian war is technically a global conflict",0,"2018-04-15 16:52:12","2018-04-15 16:52:12",0,null
4397,Ugxjoa0VRcmUjppe4g14AaABAg,jlGuBqQPxF8,"Angry white male",UCePcdZqQWebO2tC39Rd6XpA,"Hopefully the makers of these videos gets bombed first fucking fake news fear mongers","Hopefully the makers of these videos gets bombed first fucking fake news fear mongers",0,"2018-04-15 16:47:08","2018-04-15 16:47:08",0,null
4398,UgxI6vBCwtH-v8DL2G14AaABAg,jlGuBqQPxF8,"blue boy",UCtMIE7cdGW5N9m4AsLjf-ow,"Someone in Russia is blowing smoke up Putins arse, they cannot 
WIN ANY  war with the USA, the best they can hope for is MAD ?","Someone in Russia is blowing smoke up Putins arse, they cannot 
WIN ANY  war with the USA, the best they can hope for is MAD ?",0,"2018-04-15 16:12:55","2018-04-15 16:12:55",0,null
4399,UgzcMShepyvQK-mdvlF4AaABAg,jlGuBqQPxF8,"watch this",UC3vJ1yk1Izzxen40fa9BQ6Q,"Most of this footage is from the 90s","Most of this footage is from the 90s",0,"2018-04-15 15:57:02","2018-04-15 15:57:02",0,null
4400,UgypwmXtPk9kFb5Hng94AaABAg,jlGuBqQPxF8,"Ady P",UCfMUKPbdzFgFnabcV19asaA,"Here we have another fucktard trying to become a youtube hero by parastically feeding off news events and drawing people in to their own brand of fear porn

yawn.","Here we have another fucktard trying to become a youtube hero by parastically feeding off news events and drawing people in to their own brand of fear porn

yawn.",0,"2018-04-15 15:53:03","2018-04-15 15:53:03",0,null
4401,UgxtMLQp-ceFBNiIhYJ4AaABAg,jlGuBqQPxF8,"R0blox GLitch",UCogfk2TtAqD-FaX1QszxQxA,"Im filling my bucket list already","Im filling my bucket list already",0,"2018-04-15 15:48:28","2018-04-15 15:48:28",0,null
4402,Ugwvn6p2DozzBIfNHWl4AaABAg,jlGuBqQPxF8,"toilet paper",UC-oR8C5byzT-ayebnDdzz9Q,"Dont worry people its fake news","Dont worry people its fake news",0,"2018-04-15 15:47:47","2018-04-15 15:47:47",0,null
4403,Ugy84A8Zahcw2JpWaJd4AaABAg,jlGuBqQPxF8,"Bishal Thapa",UCTVGwyFsD1KbVh4bmrPDPnQ,"america world hero always","america world hero always",0,"2018-04-15 15:43:48","2018-04-15 15:43:48",0,null
4404,UgzYQ9jNOcvI2sngR2Z4AaABAg,jlGuBqQPxF8,"Mush Room",UCWgQgw4XwKGqdt7gZzQqIAg,"What a pile of crap. Putin never said WW3 is unavoidable.","What a pile of crap. Putin never said WW3 is unavoidable.",0,"2018-04-15 15:43:44","2018-04-15 15:43:44",0,null
4405,UgwmhJfi9QZ57MGPlkt4AaABAg,jlGuBqQPxF8,"Ivory Billed",UCuSJgCJWJgxYZ4rApoEL3Xg,"President Putin: We need your help here in America! Please nuke Washington DC, New York City, and Los Angeles. Then America might survive.","President Putin: We need your help here in America! Please nuke Washington DC, New York City, and Los Angeles. Then America might survive.",1,"2018-04-15 15:35:31","2018-04-15 15:35:31",0,null
4406,UgxFMtJqjedXGxxH3XJ4AaABAg,jlGuBqQPxF8,"Lets stop HIGH EXPECTATIONS from small individuals",UC8jzRaXxu6tjMYfVwGJjYPQ,"If you have any people stationed near Syria you will know that this shit is real.I knew Friday night and it was all over the net Saturday.","If you have any people stationed near Syria you will know that this shit is real.I knew Friday night and it was all over the net Saturday.",1,"2018-04-15 15:23:18","2018-04-15 15:23:18",0,null
4407,Ugz0UxmEDNEesJr1Rl94AaABAg,jlGuBqQPxF8,"Mario Severdija",UCBUFtBNrlc6TiRWJ5SzZ2WQ,"FUCK America.. hope it burns to the grounds","FUCK America.. hope it burns to the grounds",2,"2018-04-15 15:21:52","2018-04-15 15:21:52",0,null
4408,Ugw8RUesvJN-Kd3dfa94AaABAg,jlGuBqQPxF8,"Page Randolph",UCCh5Qsc-xU-8B3ZrJ6-Nftw,"When the greed and ego, of mankind, which has runined humanity and the Earth, when it has expended itself, which we about have, and this war, hate, evil in ruling places, hey, BLOW IT, WE who KNOW and love him, we shall soar like Eagles, home, AND THIS TEMP HELL CALLED EARTH WILL BE REDONE ,,REMADE,,and evil will not be allowed in,,,,,,,anymore,AMEN,","When the greed and ego, of mankind, which has runined humanity and the Earth, when it has expended itself, which we about have, and this war, hate, evil in ruling places, hey, BLOW IT, WE who KNOW and love him, we shall soar like Eagles, home, AND THIS TEMP HELL CALLED EARTH WILL BE REDONE ,,REMADE,,and evil will not be allowed in,,,,,,,anymore,AMEN,",0,"2018-04-15 15:16:11","2018-04-15 15:16:11",0,null
4409,Ugximr1iqK7jzHqMc_p4AaABAg,jlGuBqQPxF8,"David Goode",UCUWt8_m_XFw0RYJaaKu2HNQ,"But not nuclear war which is what you are inferring","But not nuclear war which is what you are inferring",0,"2018-04-15 13:28:58","2018-04-15 13:28:58",0,null
4410,UgzIjv0n574hZhZZUgV4AaABAg,jlGuBqQPxF8,woodyfive0,UCuggG0kZDqa2XyuR0nGN5Ww,"They all know that no one wins. Enough of this bullshit already, your head is up your ass","They all know that no one wins. Enough of this bullshit already, your head is up your ass",0,"2018-04-15 13:22:13","2018-04-15 13:22:13",0,null
4411,UgziYzEC-mtcpaPwzEJ4AaABAg,jlGuBqQPxF8,SaJaDi,UCZ1D9ajCVkqDu7Z2VHisI3Q,"Simple... America/Nato wants Russian resources and lands.. therefor.. provoke them until they snap and declare war. That way Russia is the bad one and America and their allies gain all.","Simple... America/Nato wants Russian resources and lands.. therefor.. provoke them until they snap and declare war. That way Russia is the bad one and America and their allies gain all.",1,"2018-04-15 12:37:27","2018-04-15 12:37:27",0,null
4412,UgxwFcQvJi3pCOYkFnh4AaABAg,jlGuBqQPxF8,"YVETTE JACKSON",UCBkBEKf_gXFtKaaVYAdgROg,"Listen...how dumb are yall to keep announcing on national tv what America plans on doing! Why would you tell it? You are announcing to the public what are pm and are.  So you are giving the enemy a heads up on our plans! Have you ever heard of the element of surprise! You know...a surprise attack! Thats what its supposed to be...a surprise....please tell your colleagues...its rediculous!","Listen...how dumb are yall to keep announcing on national tv what America plans on doing! Why would you tell it? You are announcing to the public what are pm and are.  So you are giving the enemy a heads up on our plans! Have you ever heard of the element of surprise! You know...a surprise attack! Thats what its supposed to be...a surprise....please tell your colleagues...its rediculous!",0,"2018-04-15 11:46:10","2018-04-15 11:46:10",0,null
4413,Ugy9hNEiUdwfPenAA454AaABAg,jlGuBqQPxF8,"danielle rocheleau",UCuQ493WZD-1WfXXplT8KkPQ,"anyone who start a war ! shall sleep with satan........believe me it will be worst","anyone who start a war ! shall sleep with satan........believe me it will be worst",0,"2018-04-15 11:26:21","2018-04-15 11:26:21",0,null
4414,UgzJs9qQnlZ-FnuwS3F4AaABAg,jlGuBqQPxF8,"Sylvia Pierce",UCkOr-REoECgT-lVS4wCUzaQ,"Why in the world is OBAMA in this video as President?  Stopped right there. OLD NEWS?","Why in the world is OBAMA in this video as President?  Stopped right there. OLD NEWS?",0,"2018-04-15 11:25:05","2018-04-15 11:25:05",0,null
4415,UgxS2kL3eq3XrCFh2xV4AaABAg,jlGuBqQPxF8,"Alexander Simon",UCPcKoRn1RnwLAiisKQX6w5w,"100percent 100percent blah blah blah talk talk talk talk WHERE ARE THE MISSILES FLYING OVER MY HEAD HUH? I LIVE IN EUROPE AND I SEE NOTHING!","100percent 100percent blah blah blah talk talk talk talk WHERE ARE THE MISSILES FLYING OVER MY HEAD HUH? I LIVE IN EUROPE AND I SEE NOTHING!",0,"2018-04-15 11:18:21","2018-04-15 11:18:21",0,null
4416,Ugz42r8vISlYjRCzknt4AaABAg,jlGuBqQPxF8,"Alexander Simon",UCPcKoRn1RnwLAiisKQX6w5w,"Blah blah bla blah bla NOTHING EVER HAPPENS! Only talking as usual.......blah blah blah","Blah blah bla blah bla NOTHING EVER HAPPENS! Only talking as usual.......blah blah blah",0,"2018-04-15 11:14:47","2018-04-15 11:14:47",0,null
