id,comment_id,video_id,commenter_name,commenter_id,comment_displayed,comment_original,likes,published_date,updated_date,total_replies,replyto
4541,Ugw9DZWyY5dJviFGXut4AaABAg,jlGuBqQPxF8,lgb,UCf7I4LcXKW8SjP3Hv2BR83w,"Nato should not surround russia, no more than russia should not arm up the border of any other country.","Nato should not surround russia, no more than russia should not arm up the border of any other country.",0,"2018-04-15 00:30:35","2018-04-15 00:30:35",0,null
4542,UgxgokyWpV63Hdv40Hl4AaABAg,jlGuBqQPxF8,"Гиёс Субонов",UCIJO9XHeTt2MxI8YIBeoBZQ,"America is destroying the world under the mask of democracy?  America lives happily due to unhappiness of others! Thats all.","America is destroying the world under the mask of democracy?  America lives happily due to unhappiness of others! Thats all.",4,"2018-04-15 00:29:46","2018-04-15 00:29:46",3,null
4543,UgxgokyWpV63Hdv40Hl4AaABAg.8f22koUOiIL8f330jAvyeR,jlGuBqQPxF8,"Sean Everhart",UCqPldOpstVW6Afl2rx0sW1w,"Well get the fuck out and leave. If it’s so bad and you hate it that much hahahaha you bunch of bitches.... I love this country always have and always will, I thank God everyday for blessing me with the life I have here in this wonderful place! God bless America!","Well get the fuck out and leave. If it’s so bad and you hate it that much hahahaha you bunch of bitches.... I love this country always have and always will, I thank God everyday for blessing me with the life I have here in this wonderful place! God bless America!",0,"2018-04-15 09:51:19","2018-04-15 09:51:19",0,UgxgokyWpV63Hdv40Hl4AaABAg
4544,UgxgokyWpV63Hdv40Hl4AaABAg.8f22koUOiIL8f2EBUVSEsu,jlGuBqQPxF8,"Mel G",UCIaORnaN9qGEQWKIUxH6svg,"Гиёс Субонов Im in the US sorry.. but not happy.. we are being poisoned. Air food water. Vaccines.. lied to .invaded. abused  used and killed.. if you want details just ask.","Гиёс Субонов Im in the US sorry.. but not happy.. we are being poisoned. Air food water. Vaccines.. lied to .invaded. abused  used and killed.. if you want details just ask.",1,"2018-04-15 02:09:40","2018-04-15 02:09:40",0,UgxgokyWpV63Hdv40Hl4AaABAg
4545,UgxgokyWpV63Hdv40Hl4AaABAg.8f22koUOiIL8f27YL0O8Wn,jlGuBqQPxF8,"Jeff Samora",UC06O4DxIAlRvTZaI_3ES--A,"So true!
Very toxic, my friend.","So true!
Very toxic, my friend.",1,"2018-04-15 01:11:37","2018-04-15 01:11:37",0,UgxgokyWpV63Hdv40Hl4AaABAg
4546,Ugx--5tDsmWjUa9eadV4AaABAg,jlGuBqQPxF8,"Barry Trestain",UCzHdP8vWPEd0RJVIbpf0gUQ,"What a load of bollocks.","What a load of bollocks.",0,"2018-04-15 00:27:36","2018-04-15 00:27:36",0,null
4547,UgyuVy6emCM1FJWtezR4AaABAg,jlGuBqQPxF8,"Michael Clarke",UC5pWTI5wLPfNq_vGbKdMNMA,"What the heck is this.......old stuff re dated","What the heck is this.......old stuff re dated",0,"2018-04-15 00:25:51","2018-04-15 00:25:51",0,null
4548,Ugx5jD9rwd9ShJXFMvh4AaABAg,jlGuBqQPxF8,"Pentcho Rouynekov",UCNuzfU1D18QWX46q7RGn72w,"A lesson.","A lesson.",1,"2018-04-15 00:25:25","2018-04-15 00:25:25",0,null
4549,Ugyu4Zuaenbv9EOTxTl4AaABAg,jlGuBqQPxF8,"Noureddine Arfan",UC-87URTo24NlnJfKRt0bVRw,"Russia has made a huge political mistake by not responding to the coalition attack on Syrian territory. It looks like their navy and soldiers ran away on the hills like little rabbits fearing their asses of being blown up.
Now Russia will be bullied by the US and so on the daily basis because the US knows they wont dare to attack back.","Russia has made a huge political mistake by not responding to the coalition attack on Syrian territory. It looks like their navy and soldiers ran away on the hills like little rabbits fearing their asses of being blown up.
Now Russia will be bullied by the US and so on the daily basis because the US knows they wont dare to attack back.",0,"2018-04-15 00:23:35","2018-04-15 00:25:07",0,null
4550,UgwTu7wO9amHYMuv9IV4AaABAg,jlGuBqQPxF8,"E turnall",UCcBBJUh8fJXGCaZNF7EFFlA,"this is a fake news channel . they put out so much bs making it take a lifetime to go over all this twisted edited bs to simply show its all bs","this is a fake news channel . they put out so much bs making it take a lifetime to go over all this twisted edited bs to simply show its all bs",0,"2018-04-15 00:23:28","2018-04-15 00:23:28",0,null
4551,Ugz7bjCvjKu2KKVlaEJ4AaABAg,jlGuBqQPxF8,"Camille Franzoni",UCzG0TIzXVMELQllRUCn78AQ,"WORLD WAR 3 WOULD BE THE RESULT OF 2 OVER INFLATED EGOS.   ITS A DAMN SHAME WE ALWAYS IN OTHER PEOPLES BUSINESS WHICH LEADS TO WAR.
EVERYONE LOSES IN WAR!  MAY GOD PROTECT US ALL!","WORLD WAR 3 WOULD BE THE RESULT OF 2 OVER INFLATED EGOS.   ITS A DAMN SHAME WE ALWAYS IN OTHER PEOPLES BUSINESS WHICH LEADS TO WAR.
EVERYONE LOSES IN WAR!  MAY GOD PROTECT US ALL!",0,"2018-04-15 00:23:17","2018-04-15 00:23:17",0,null
4552,UgwppaPWivg5TN9e9xp4AaABAg,jlGuBqQPxF8,Heather,UC4yQPrPs0rJrus8CDKJqz5A,"Now I know for sure that this entire video is horse crap because you believe Alex Jones from Infowars and anyone with half a brain knows that he has a disinfo agent and a fear-mongering bich.","Now I know for sure that this entire video is horse crap because you believe Alex Jones from Infowars and anyone with half a brain knows that he has a disinfo agent and a fear-mongering bich.",0,"2018-04-15 00:21:32","2018-04-15 00:21:32",0,null
4553,Ugw-Rkt5NI5YzNWyqfl4AaABAg,jlGuBqQPxF8,"Kirk Miller",UCiYkfJTrJC4okYBwOXlhYaA,"Russia is teaming up with North Korea, China and Iran trust me its right around the corner! America needs a few more false flag attacks to justify fabricated lies. I am from America and have lived all over the world everyone knows its the sinking ship Babylon! All Empires come and Go and America has had her run!!!!!!","Russia is teaming up with North Korea, China and Iran trust me its right around the corner! America needs a few more false flag attacks to justify fabricated lies. I am from America and have lived all over the world everyone knows its the sinking ship Babylon! All Empires come and Go and America has had her run!!!!!!",2,"2018-04-15 00:21:20","2018-04-15 00:21:20",0,null
4554,UgzH8eb0JcWJo7vk7RR4AaABAg,jlGuBqQPxF8,"Jurij Klimov",UCde3dZNXbacDXCMTJw-6MqQ,"china with russia liqudation america","china with russia liqudation america",0,"2018-04-15 00:20:12","2018-04-15 00:20:12",0,null
4555,UgyuXVbTfuAuBVNudxZ4AaABAg,jlGuBqQPxF8,"John Chung",UCsA3P-_7fqvttyBrjYUZn3Q,"Two super countries equipped with Nuclear Power. If both were firing at each other, USA and Russia will disappear from this world. Now tell me Why Putin wants that !!","Two super countries equipped with Nuclear Power. If both were firing at each other, USA and Russia will disappear from this world. Now tell me Why Putin wants that !!",0,"2018-04-15 00:20:04","2018-04-15 00:20:04",0,null
4556,UgxhXJCBlM2FZnzAEVx4AaABAg,jlGuBqQPxF8,"Sheila Becker",UCWFiSZcv1eeGrBVzyKJQzww,"REGUARDLESS.... OF WHAT...  IS GOING ON,  AROUND THE WORLD...I KNOW, TRUST, AND BELIEVE... THAT GOD THE HOLY FATHER IS IN CONTROL!

GOD.... IS THE ONLY THING... THAT I...FEAR!
⏳?????
TIME BELONGS TO THE CREATOR... GOD... ONLY HE, DECIDES WHOSE TIME IS UP AND WHEN!
ALL SHOULD PRAY... THAT IT ISNT YOUR TIME.","REGUARDLESS.... OF WHAT...  IS GOING ON,  AROUND THE WORLD...I KNOW, TRUST, AND BELIEVE... THAT GOD THE HOLY FATHER IS IN CONTROL!

GOD.... IS THE ONLY THING... THAT I...FEAR!
⏳?????
TIME BELONGS TO THE CREATOR... GOD... ONLY HE, DECIDES WHOSE TIME IS UP AND WHEN!
ALL SHOULD PRAY... THAT IT ISNT YOUR TIME.",0,"2018-04-15 00:19:50","2018-04-15 00:19:50",0,null
4557,UgxdKQCa7SObk-yqv_R4AaABAg,jlGuBqQPxF8,"Jurij Klimov",UCde3dZNXbacDXCMTJw-6MqQ,"america is satan","america is satan",0,"2018-04-15 00:19:09","2018-04-15 00:19:09",0,null
4558,UgwRyptxDjUzXRQJ_jl4AaABAg,jlGuBqQPxF8,"Roselyn Rabadon",UCWoiBpGezoF_4_X1fw2EgLQ,"assad is a devil. putin shouldnt help them..","assad is a devil. putin shouldnt help them..",0,"2018-04-15 00:18:31","2018-04-15 00:18:31",0,null
4559,UgyFQt_YMtBusu0jg_R4AaABAg,jlGuBqQPxF8,"CMC Carpentry",UCN27-ltM7p2jxCm3RrL6yYg,"Nothing we can do to stop it, you have plan and need muscle Im in","Nothing we can do to stop it, you have plan and need muscle Im in",0,"2018-04-15 00:17:57","2018-04-15 00:17:57",0,null
4560,Ugw62qGiUz30Uk7ZgPF4AaABAg,jlGuBqQPxF8,"Blaze Finder",UC-_krLV_6NlV95q1jPw1AkA,"Twoofers and fear porn.","Twoofers and fear porn.",0,"2018-04-15 00:17:40","2018-04-15 00:17:40",0,null
4561,Ugx4RqvaSjwyO9PohFN4AaABAg,jlGuBqQPxF8,"Joshua Dumas",UCXquFBo0TrQAiu8fgywWOJQ,"I warn that the ads are unavoidable NEW update! HOT","I warn that the ads are unavoidable NEW update! HOT",0,"2018-04-15 00:16:07","2018-04-15 00:16:07",0,null
4562,UgxSi6XbuxU1Rj9UgQ54AaABAg,jlGuBqQPxF8,"Derek OBrian",UCVIFfbBYuq88fa-gsJRI1Cw,"Fucking stinking Asian bolshevicks !!! Fuck you ,  dirty russ !!! Suki , bladzie sowieckie !!!","Fucking stinking Asian bolshevicks !!! Fuck you ,  dirty russ !!! Suki , bladzie sowieckie !!!",0,"2018-04-15 00:15:35","2018-04-15 00:15:35",0,null
4563,Ugy3Dv0Ewx8BGouVpst4AaABAg,jlGuBqQPxF8,"Thelma Lynne",UCzyiLdS6tjYotZAJf4V2Jvg,"America complaining about Ukraine when they are sitting on stolen land that they made genocide on the indigenous folks that had been there for eons.Humm! they speak with forked tongue.","America complaining about Ukraine when they are sitting on stolen land that they made genocide on the indigenous folks that had been there for eons.Humm! they speak with forked tongue.",0,"2018-04-15 00:15:35","2018-04-15 00:15:35",0,null
4564,UgxrYd9fSDlYFb4Oz8R4AaABAg,jlGuBqQPxF8,"JD W",UCVCmMenoRqBTE6GZ-dqhzqQ,"Bring it on Mr Putin! We right wing patriots are prepared and ready. You may takeout all the left wing crybabies you want.","Bring it on Mr Putin! We right wing patriots are prepared and ready. You may takeout all the left wing crybabies you want.",0,"2018-04-15 00:13:50","2018-04-15 00:14:27",0,null
4565,Ugwdrk49r69w0Cbf0ZN4AaABAg,jlGuBqQPxF8,"BANES WORLD",UCNr5ltQ248bfRSrtekxLTrg,"Sorry for my English . Have a good day .","Sorry for my English . Have a good day .",0,"2018-04-15 00:11:23","2018-04-15 00:11:23",0,null
4566,UgyaS_jopw9eKDeUFPZ4AaABAg,jlGuBqQPxF8,"Joe Wilson",UCR4MGgaljZq3h6V2X_GxTSg,"Obama ???????? Where does this guy come up with Obama when he is no longer the leader of this country .By the way Obama backed down and pulled the missile defence out of Europe .","Obama ???????? Where does this guy come up with Obama when he is no longer the leader of this country .By the way Obama backed down and pulled the missile defence out of Europe .",0,"2018-04-15 00:11:16","2018-04-15 00:12:43",0,null
4567,Ugx3qg2aBxIWbOg7Kv94AaABAg,jlGuBqQPxF8,"Kufi James",UCzOmEV5Dx6ZZORulOu4Uc1w,"propaganda PEOPLE.   there is no war only money transfer","propaganda PEOPLE.   there is no war only money transfer",0,"2018-04-15 00:11:03","2018-04-15 00:11:03",0,null
4568,UgxVNK_pk1RpTz2zyg54AaABAg,jlGuBqQPxF8,"Kufi James",UCzOmEV5Dx6ZZORulOu4Uc1w,"prop news","prop news",0,"2018-04-15 00:10:22","2018-04-15 00:10:22",0,null
4569,UgwGx7JtIiuNw3bEPiV4AaABAg,jlGuBqQPxF8,"Tony Gutierrez",UC3sN-ITH5Rbcf_IVYLEwabg,"Putin, we will call your BLUFF anytime .
Fuck you and your backward government 
you cant defeat many nations.Jerk off
To release your frustrations. TU ES UN
CABRON 100 %. Es verdad","Putin, we will call your BLUFF anytime .
Fuck you and your backward government 
you cant defeat many nations.Jerk off
To release your frustrations. TU ES UN
CABRON 100 %. Es verdad",0,"2018-04-15 00:10:22","2018-04-15 00:10:22",0,null
4570,UgyqCncQXBYyQq6uLrd4AaABAg,jlGuBqQPxF8,"Thelma Patocchi",UCQLsK_MUXh7ZfVT0MvrrpFw,"For the sake of innocent people God bless us all.","For the sake of innocent people God bless us all.",0,"2018-04-15 00:07:48","2018-04-15 00:07:48",0,null
4571,UgwGk_1qTdOOegCTdJx4AaABAg,jlGuBqQPxF8,"Mark Lawson",UCi1YB_KIccg6hdzXM-zLbjQ,"America and NATO is making a big mistake fighting Russia in the Baltics.You all walking right in Putins trap! Thats what Putin wants a ground war because he has
 a great ground force.
Russia is where great armies go to die. All those ship going to be sitting ducks because the seas around Russia are that big open waters and can be attack by land base systems.
You all better listen to the bible. It says that the king of the North is going to come the far North parts. The bible discribe him as GOG of the land of Magog it is prophesied in the bable in book  Ezekiel
According to prophecy that land is Russ also mentioned in the bible.
The bible also said that GOG is going to come to land of Israel and take a great spoil and booty!!!","America and NATO is making a big mistake fighting Russia in the Baltics.You all walking right in Putins trap! Thats what Putin wants a ground war because he has
 a great ground force.
Russia is where great armies go to die. All those ship going to be sitting ducks because the seas around Russia are that big open waters and can be attack by land base systems.
You all better listen to the bible. It says that the king of the North is going to come the far North parts. The bible discribe him as GOG of the land of Magog it is prophesied in the bable in book  Ezekiel
According to prophecy that land is Russ also mentioned in the bible.
The bible also said that GOG is going to come to land of Israel and take a great spoil and booty!!!",0,"2018-04-15 00:07:40","2018-04-15 00:07:40",0,null
4572,Ugxsl2PPWiYp8fjo2zV4AaABAg,jlGuBqQPxF8,"Joe Wilson",UCR4MGgaljZq3h6V2X_GxTSg,"Obama never did this as he didnt want to go against his own religion .","Obama never did this as he didnt want to go against his own religion .",0,"2018-04-15 00:06:33","2018-04-15 00:06:33",1,null
4573,Ugxsl2PPWiYp8fjo2zV4AaABAg.8f205napW0a8f4A00_nr6a,jlGuBqQPxF8,"Giggle Lizard",UCZPqgUQVm8MigoztWl2p_eA,"Yer abama was a good guy Hes not apart of them evil white people he just got in power he thought the massive white corporations and congress he beat them all these people make 100 year plans to have a war obama was a chess piece in this plan like every president before him obama never did this what are you talking about this is the illusion of voting for a new president the past presidents deeds get forgotten they needed someone loud to be a big distraction and now you have trump he is big distraction to make the people forget the big chess move obama made giving NUKES to IRAN everyone forgot about that because Were to busy arguing over how racist people are how sexist people are how homophobic we are when are people going to learn that its not obout color its between people with money and people with out","Yer abama was a good guy Hes not apart of them evil white people he just got in power he thought the massive white corporations and congress he beat them all these people make 100 year plans to have a war obama was a chess piece in this plan like every president before him obama never did this what are you talking about this is the illusion of voting for a new president the past presidents deeds get forgotten they needed someone loud to be a big distraction and now you have trump he is big distraction to make the people forget the big chess move obama made giving NUKES to IRAN everyone forgot about that because Were to busy arguing over how racist people are how sexist people are how homophobic we are when are people going to learn that its not obout color its between people with money and people with out",0,"2018-04-15 20:11:37","2018-04-15 20:11:37",0,Ugxsl2PPWiYp8fjo2zV4AaABAg
4574,UgwIOWyPgOgcjzfCw6N4AaABAg,jlGuBqQPxF8,"The Negro King",UCjk17n926ef_FRyfmQKMeig,"Some neo Nazis need to man up and target israel","Some neo Nazis need to man up and target israel",0,"2018-04-15 00:06:13","2018-04-15 00:06:13",0,null
4575,UgyXEi1ZTXYTMJxG7pZ4AaABAg,jlGuBqQPxF8,"Halo Spenser",UCMqwWarcbu0Zw1iAW8ROJIA,"There will be no war. Just some idiots trying to scare us all. Trust me some people somewhere are going to get rich from this.","There will be no war. Just some idiots trying to scare us all. Trust me some people somewhere are going to get rich from this.",0,"2018-04-15 00:04:40","2018-04-15 00:04:40",0,null
4576,UgzekVQfXFcOcQHOFaZ4AaABAg,jlGuBqQPxF8,"Rose Andres",UClmpqTYGRVIxvTEOzzsyr9w,"Im feeling i am a queen of the world..","Im feeling i am a queen of the world..",0,"2018-04-15 00:04:27","2018-04-15 00:04:27",0,null
4577,UgyAlRGovfVIGBFJQ4J4AaABAg,jlGuBqQPxF8,"Steve Sullivan",UCTs-WYJbOZmeFyL6LrNee7g,"Putin the posined","Putin the posined",0,"2018-04-15 00:03:39","2018-04-15 00:03:39",0,null
4578,Ugz43bnKlzQUU3nV8ah4AaABAg,jlGuBqQPxF8,Rebel,UCHSN3Wnc4Jecm_wr2jPFAGQ,"Who gives a shit, fuck Russia!!","Who gives a shit, fuck Russia!!",0,"2018-04-15 00:02:35","2018-04-15 00:02:35",0,null
4579,Ugxot26nRDvLM8NNjVx4AaABAg,jlGuBqQPxF8,"DormantIdeas NIQ",UCCZg8P9mjGHrZDhScGDsb4Q,"SUE Trump for WAR CRIMES and FOR LYING TO the Americans
 -- Syria strikes on April 13th, 2018 more than likely were timed to either destroy evidence,
 -- or to insert chemical evidence, but that could not cover for the fact that no hospital reported any chem attack, nor any victims exist, except the fake victims on the fake CIA video that show kids with ZERO SYMPTOMs!
FILTHY JOOjakced nations of GOYim... JOOmurika, JOO.K., JOOFrance, ... MURDERERS, ASSASSINS, SCOURGE ON MANKIND!!!","SUE Trump for WAR CRIMES and FOR LYING TO the Americans
 -- Syria strikes on April 13th, 2018 more than likely were timed to either destroy evidence,
 -- or to insert chemical evidence, but that could not cover for the fact that no hospital reported any chem attack, nor any victims exist, except the fake victims on the fake CIA video that show kids with ZERO SYMPTOMs!
FILTHY JOOjakced nations of GOYim... JOOmurika, JOO.K., JOOFrance, ... MURDERERS, ASSASSINS, SCOURGE ON MANKIND!!!",0,"2018-04-15 00:01:13","2018-04-15 00:01:13",0,null
4580,Ugw0SOyTxEtSjgPAm8Z4AaABAg,jlGuBqQPxF8,"Marisela Gomez",UCEti8OSqIxrsIJLVGt8e3qQ,"Prepare for TRIBULATION , read Revelations,  
Give your life to Jesuschrist He is the only way to the Father.
Pray!","Prepare for TRIBULATION , read Revelations,  
Give your life to Jesuschrist He is the only way to the Father.
Pray!",0,"2018-04-15 00:00:31","2018-04-15 00:00:31",0,null
4581,UgzxfpDUjcII4Zyb1q54AaABAg,jlGuBqQPxF8,"brett worsham",UCLp-i74ph5Vmf_BJZCUMzWQ,https://youtu.be/uVfmVPCIAdU,https://youtu.be/uVfmVPCIAdU,0,"2018-04-14 23:59:46","2018-04-14 23:59:46",0,null
4582,UgwSwF00jo2w-JhcR1t4AaABAg,jlGuBqQPxF8,"Ernesto Dela Cruz",UCGNWkMVbo8wH0R3m9UH1EQw,"If the UN ban the arm forces, what will happen? Police movement is for internal affairs.

If there is no ARMY the earth is a PARADISE","If the UN ban the arm forces, what will happen? Police movement is for internal affairs.

If there is no ARMY the earth is a PARADISE",4,"2018-04-14 23:59:36","2018-04-14 23:59:36",2,null
4583,UgwSwF00jo2w-JhcR1t4AaABAg.8f2-Iv83Fay8f3V7H9xVVL,jlGuBqQPxF8,"Shane Cary",UCXHoSuoL2uY_8MJRbdgfTlw,"When theres religion there will always b an army of some kind, so ban religion","When theres religion there will always b an army of some kind, so ban religion",0,"2018-04-15 13:56:52","2018-04-15 13:56:52",0,UgwSwF00jo2w-JhcR1t4AaABAg
4584,UgwSwF00jo2w-JhcR1t4AaABAg.8f2-Iv83Fay8f2dz0ekSTO,jlGuBqQPxF8,"The obese bird",UCeoS1MmO2wMmz6BvfUHbutw,"If there is no army people would still fight. Its not banning army that will make anger and hate for each others disappear.","If there is no army people would still fight. Its not banning army that will make anger and hate for each others disappear.",0,"2018-04-15 06:03:45","2018-04-15 06:03:45",0,UgwSwF00jo2w-JhcR1t4AaABAg
4585,UgzSYisGzDk3mAX3MNh4AaABAg,jlGuBqQPxF8,"Rudy P.",UCpzhsV3YrJrCiAPW5rmP0mw,"Posted Apr. 14, 2018, and all the clips show that they were filmed in Apr. 2016; two years prior. Even though the video may be fake, WW3 started by this administration isnt. If you voted for Trump and you have sons between the age of 18 and 25, they may be drafted; maybe he can grow a bone spur or something.","Posted Apr. 14, 2018, and all the clips show that they were filmed in Apr. 2016; two years prior. Even though the video may be fake, WW3 started by this administration isnt. If you voted for Trump and you have sons between the age of 18 and 25, they may be drafted; maybe he can grow a bone spur or something.",0,"2018-04-14 23:59:09","2018-04-14 23:59:09",0,null
4586,UgxYHClvcM_8NaaXD9N4AaABAg,jlGuBqQPxF8,"Chris Thompson",UCLv34Uk7fA2kpB9rtUIpfbA,"See Dr Steven Greer Tyler from secureteam10 the alien races will not stand for this aggression humanity has been warned","See Dr Steven Greer Tyler from secureteam10 the alien races will not stand for this aggression humanity has been warned",0,"2018-04-14 23:59:02","2018-04-14 23:59:02",0,null
4587,UgxyDePhxKnxKgIgRRB4AaABAg,jlGuBqQPxF8,"Jay Johnson",UCLS2sL6OUXl2VJYWhAJusUg,"Trump is president and king of the North!! Sword drawn full speed ahead. Obama is nothing this video is a waste of time. There will be war, very soon. Russia didnt respond because they know the end result but yet use there mouth to flex fake muscle. Its not that you cant beat America because you can! But you cannot and will not beat Nato, as one. Impossible even against Russia and China","Trump is president and king of the North!! Sword drawn full speed ahead. Obama is nothing this video is a waste of time. There will be war, very soon. Russia didnt respond because they know the end result but yet use there mouth to flex fake muscle. Its not that you cant beat America because you can! But you cannot and will not beat Nato, as one. Impossible even against Russia and China",0,"2018-04-14 23:58:03","2018-04-14 23:58:03",0,null
4588,UgxUWrfh3XWEc2l7MdR4AaABAg,jlGuBqQPxF8,"Randy Helton",UCD2CpmGZD8QmFH6bgiI0Oyw,"I watched 9 squads of fighter jets fly over Tennessee today Ive never seen that before something is going on","I watched 9 squads of fighter jets fly over Tennessee today Ive never seen that before something is going on",0,"2018-04-14 23:57:39","2018-04-14 23:57:39",0,null
4589,UgwKisbs5pbGbcvshON4AaABAg,jlGuBqQPxF8,"Kemal Mustafa",UC17WqIY7xqFHqR6QULZ3aAg,"THE EASTERN WORLD 
IT IS EXPLODIN
VIOLENCE FLARIN BULLETS LOADIN
YOURE OLD ENOUGH TO KILL
BUT NOT FOR VOTIN
YOU DONT BELIEVE IN WAR
BUT WHATS THAT GUN YOURE TOTIN
AND EVEN THE JORDAN RIVER
HAS BODIES FLOATIN 
AND YOU TELL ME
OVER AND OVER AND OVER AND OVER AGAIN 
MY FRIENDS
YOU DONT BELIEVE 
WERE ON THE EVE OF DESTRUCTION!","THE EASTERN WORLD 
IT IS EXPLODIN
VIOLENCE FLARIN BULLETS LOADIN
YOURE OLD ENOUGH TO KILL
BUT NOT FOR VOTIN
YOU DONT BELIEVE IN WAR
BUT WHATS THAT GUN YOURE TOTIN
AND EVEN THE JORDAN RIVER
HAS BODIES FLOATIN 
AND YOU TELL ME
OVER AND OVER AND OVER AND OVER AGAIN 
MY FRIENDS
YOU DONT BELIEVE 
WERE ON THE EVE OF DESTRUCTION!",0,"2018-04-14 23:57:38","2018-04-14 23:57:38",0,null
4590,Ugw-9AGPTenN5BL70lx4AaABAg,jlGuBqQPxF8,"carlos lopez",UCYAnPWWfO4veBYT0UiXAPRg,"Putin and Trump wants war to remain in power.","Putin and Trump wants war to remain in power.",0,"2018-04-14 23:57:09","2018-04-14 23:57:09",0,null
4591,UgxkDGxExLIY3c7hsgt4AaABAg,jlGuBqQPxF8,"david mcintire",UCP4ernrK49iowdKiQ3UFxRA,"Good lets get it over o rebuilding their shit take all there land and move are citizens into free housing","Good lets get it over o rebuilding their shit take all there land and move are citizens into free housing",0,"2018-04-14 23:57:07","2018-04-14 23:57:07",0,null
4592,UgzaZF9OK4mx0Mw1EfJ4AaABAg,jlGuBqQPxF8,"Tony Megan",UCfl_a4hWTizihJfCRmeWgjw,"JESUS is KING of KINGS....","JESUS is KING of KINGS....",0,"2018-04-14 23:56:34","2018-04-14 23:56:34",0,null
4593,UgyCZKx0U6gqZ80gA2Z4AaABAg,jlGuBqQPxF8,"We all die Anyway",UCv4rUD7Gmfd4en4w3lxY5pQ,"i am stoooooopid i taaaaalk like stoooooopid becccuuuuuuz i am stoooooopid!!!! (fake russian guys voice in this video) hahahaha","i am stoooooopid i taaaaalk like stoooooopid becccuuuuuuz i am stoooooopid!!!! (fake russian guys voice in this video) hahahaha",0,"2018-04-14 23:55:38","2018-04-14 23:55:38",0,null
4594,Ugxob0VYY8QMZUqBFQB4AaABAg,jlGuBqQPxF8,"Cheng Teresa",UCnFO9qCVzUoaUmvR4ALYb0A,"Trust in God! Wake up  America  only  God who created heaven and earth can do some things awesome in your  country rather than worry.This is real!","Trust in God! Wake up  America  only  God who created heaven and earth can do some things awesome in your  country rather than worry.This is real!",0,"2018-04-14 23:54:06","2018-04-14 23:54:06",0,null
4595,Ugz7hB9GxTH1J7L737Z4AaABAg,jlGuBqQPxF8,"The Boss",UC8uuh94SZVYNp8H5BVNsEVA,"it wouldnt be just russia they have allies and they dont like the USA","it wouldnt be just russia they have allies and they dont like the USA",0,"2018-04-14 23:54:02","2018-04-14 23:54:02",0,null
4596,UgwcnQjP5SOESR6Z9cZ4AaABAg,jlGuBqQPxF8,"Michael Shane",UCKdLMhNWxo-jhAs0k6295wQ,"this is just more fear mongering to keep the little guy under control.","this is just more fear mongering to keep the little guy under control.",1,"2018-04-14 23:53:42","2018-04-14 23:53:42",0,null
4597,Ugx8ZCyUDDDqDrA-1yt4AaABAg,jlGuBqQPxF8,"Josh Ervin",UCWcmmdRnSyNCcE-67E0xYLQ,"Good. Let the nukes fly.","Good. Let the nukes fly.",0,"2018-04-14 23:53:33","2018-04-14 23:53:33",0,null
