id,comment_id,video_id,commenter_name,commenter_id,comment_displayed,comment_original,likes,published_date,updated_date,total_replies,replyto
4659,UgyOsjZYIlxKfUExQ4J4AaABAg,jlGuBqQPxF8,notsac44,UCzjeRSVM7tai-hwe7ZhA2DA,"Fear mongering lately?","Fear mongering lately?",0,"2018-04-14 23:36:53","2018-04-14 23:36:53",0,null
4660,UgwAgdVSLilu72vJJUl4AaABAg,jlGuBqQPxF8,"Terri L",UCcndRfYFdfKyy6s9q0ge9qQ,"The US and Canadian citizens dont want any ME involvement.  Both countries are stuck with luciferin leaders.","The US and Canadian citizens dont want any ME involvement.  Both countries are stuck with luciferin leaders.",0,"2018-04-14 23:36:24","2018-04-14 23:36:24",0,null
4661,Ugy-2V_1ssuWTi6-ITt4AaABAg,jlGuBqQPxF8,"Jackie Blue",UCJQvLlvLV-KNlHIpnA_4FJw,"Thank Trumptards for giving us a mental case for POTUS","Thank Trumptards for giving us a mental case for POTUS",0,"2018-04-14 23:36:17","2018-04-14 23:36:17",0,null
4662,UgyN5Th7mSkDPRWFaGB4AaABAg,jlGuBqQPxF8,"Hydrophobic Frog",UCRZhzTgzALEAnT2qXMLYYEA,"Dont forget that RT=Russian Television which is State owned. That being said, hold on to your asses folks. SHTF time.","Dont forget that RT=Russian Television which is State owned. That being said, hold on to your asses folks. SHTF time.",0,"2018-04-14 23:36:11","2018-04-14 23:41:36",0,null
4663,UgwwZ3RORaL4RI5RH4N4AaABAg,jlGuBqQPxF8,"Dave Christensen",UCikw-lguLmOV4xuhnuSiKww,"bad video folks   click bait to","bad video folks   click bait to",0,"2018-04-14 23:35:42","2018-04-14 23:35:42",0,null
4664,Ugy0FNgJHOC_wyt5dZF4AaABAg,jlGuBqQPxF8,"Jumping Piggie",UCa9Wc_LpUI_83q-Hyo4zaQA,"The articles shown are from 2016.... i call meh...","The articles shown are from 2016.... i call meh...",0,"2018-04-14 23:35:41","2018-04-14 23:35:41",0,null
4665,UgwCSHYng4REBiYgk_J4AaABAg,jlGuBqQPxF8,"Michelle Passmore",UC-3-af1Etrx_B19npP2ns8w,"This is old news OPrickhead is acting like a President","This is old news OPrickhead is acting like a President",0,"2018-04-14 23:35:27","2018-04-14 23:35:27",0,null
4666,Ugwx8dsi9Iux-EY_Mlh4AaABAg,jlGuBqQPxF8,"RAINS ACOMING",UC2CQRwwn1tgFLXgkTHGteqA,"It has a date on it, March 3, 2016. Damn come on! Old news passed off as new news.  Give it a break!","It has a date on it, March 3, 2016. Damn come on! Old news passed off as new news.  Give it a break!",0,"2018-04-14 23:35:25","2018-04-14 23:35:25",0,null
4667,UgzgVpzEoFZOz0loXGN4AaABAg,jlGuBqQPxF8,"Noe Moreno",UCEdmTpTAH7syh0-ahqoxaGA,"For God will destroy what he created. #FEARTHEFIRSTWORD","For God will destroy what he created. #FEARTHEFIRSTWORD",0,"2018-04-14 23:34:42","2018-04-14 23:34:42",0,null
4668,UgyRBVIZVUw3ZmATPVx4AaABAg,jlGuBqQPxF8,"Chris Thompson",UCLv34Uk7fA2kpB9rtUIpfbA,"We are on red alert the humanity","We are on red alert the humanity",0,"2018-04-14 23:34:18","2018-04-14 23:34:18",0,null
4669,UgwEZQYZ43K2E_n982R4AaABAg,jlGuBqQPxF8,rjmidnite,UCbt-zi7TosbAPHGclhRv5RA,"Russia doesnt bother us why would we do anything  this is fake news","Russia doesnt bother us why would we do anything  this is fake news",0,"2018-04-14 23:34:13","2018-04-14 23:34:13",0,null
4670,Ugxoe_MpRRg5_ewNSqp4AaABAg,jlGuBqQPxF8,"lee c",UCTDN-eB3d3sY1lGk59zlY9A,"how old is this footage!? ... stop scaring people with childish headlines!!!!","how old is this footage!? ... stop scaring people with childish headlines!!!!",0,"2018-04-14 23:33:57","2018-04-14 23:33:57",0,null
4671,UgzaxujMCZEzcl66mgB4AaABAg,jlGuBqQPxF8,"Chris Thompson",UCLv34Uk7fA2kpB9rtUIpfbA,"We have to inform they alien races are ETS on this situation please look at Dr Steven Greer and Tyler from secureteam10 the warning has begun thank you","We have to inform they alien races are ETS on this situation please look at Dr Steven Greer and Tyler from secureteam10 the warning has begun thank you",0,"2018-04-14 23:33:45","2018-04-14 23:33:45",0,null
4672,UgxiFSExr7qKY4ACqUt4AaABAg,jlGuBqQPxF8,"Maniac Builder",UCVux2q_le60LgLBcT4YQ_cQ,"Dislike for taking liberties with the ads ...","Dislike for taking liberties with the ads ...",0,"2018-04-14 23:33:27","2018-04-14 23:33:27",0,null
4673,UgzzRuyqt9-QurWpLpB4AaABAg,jlGuBqQPxF8,"US Marine Corporal",UCbG0YM6aiX9sWdzuYzraPzw,"It’s time to declare war on Russia.","It’s time to declare war on Russia.",0,"2018-04-14 23:32:53","2018-04-14 23:32:53",1,null
4674,UgzzRuyqt9-QurWpLpB4AaABAg.8f1xFBnoFMH8f1yDpTrWdK,jlGuBqQPxF8,"TERRAXX l",UCtZOHx-RFX5CTt81plCPgUA,"US Marine Corporal Its time russia wiped you off the face of the map, you and all your gay military fuck boys.","US Marine Corporal Its time russia wiped you off the face of the map, you and all your gay military fuck boys.",0,"2018-04-14 23:41:26","2018-04-14 23:41:26",0,UgzzRuyqt9-QurWpLpB4AaABAg
4675,UgwRxKwEK0aVVPNFgpV4AaABAg.8f1xECMiG4U8f22h-8m1DZ,jlGuBqQPxF8,"Divine Intervention",UC-yimG6cQoDCwOz5ZKH3vsA,"no shit. im over this. ive been waiting forever for something to happen but nope. maybe were stuck in some puzzle","no shit. im over this. ive been waiting forever for something to happen but nope. maybe were stuck in some puzzle",0,"2018-04-15 00:29:14","2018-04-15 00:29:14",0,UgwRxKwEK0aVVPNFgpV4AaABAg
4676,Ugy-So8f5zgEcw2i9mB4AaABAg,jlGuBqQPxF8,"Michelle Passmore",UC-3-af1Etrx_B19npP2ns8w,"Yes someone said Kill Globalists, elites SES
Pull them right out of their homes and arrest them. If there is a war kill one at a time. Siri’s goes first. Siri’s is afraid to die. He gets to go to whom he serves
He better get a g- string
Eewwwwwwwwwwww","Yes someone said Kill Globalists, elites SES
Pull them right out of their homes and arrest them. If there is a war kill one at a time. Siri’s goes first. Siri’s is afraid to die. He gets to go to whom he serves
He better get a g- string
Eewwwwwwwwwwww",0,"2018-04-14 23:32:20","2018-04-14 23:32:20",0,null
4677,UgzTNY6w7ZdUkkDuk954AaABAg,jlGuBqQPxF8,"Greg M",UCw_xHtE7-fVyIwhsMJmFRuA,"Russia is a degraded nation. Its progress has been stopped, its strength can grow but it is stopped under Putin. Putin has to use military bluffs at this point, his economy is nothing but oil. I love and respect Russia, just know it cannot compete outside of military currently. Scary music and lunatics.","Russia is a degraded nation. Its progress has been stopped, its strength can grow but it is stopped under Putin. Putin has to use military bluffs at this point, his economy is nothing but oil. I love and respect Russia, just know it cannot compete outside of military currently. Scary music and lunatics.",0,"2018-04-14 23:31:12","2018-04-14 23:31:12",0,null
4678,UgxLEN6GMwju3oXWmaB4AaABAg,jlGuBqQPxF8,"Darrin Moon1",UCUvSYlPv-O1C0BVsryEuf6w,"Lets get it on!!!! Bring it!!!!!","Lets get it on!!!! Bring it!!!!!",0,"2018-04-14 23:31:11","2018-04-14 23:31:11",2,null
4679,UgxLEN6GMwju3oXWmaB4AaABAg.8f1x2nuhlDX8f2LCw_uO09,jlGuBqQPxF8,"Darrin Moon1",UCUvSYlPv-O1C0BVsryEuf6w,"You dont know me how do you know i dont want it. The end is much better than what this world has become .","You dont know me how do you know i dont want it. The end is much better than what this world has become .",0,"2018-04-15 03:11:02","2018-04-15 03:11:02",0,UgxLEN6GMwju3oXWmaB4AaABAg
4680,UgxLEN6GMwju3oXWmaB4AaABAg.8f1x2nuhlDX8f1xxT1Csgy,jlGuBqQPxF8,"TERRAXX l",UCtZOHx-RFX5CTt81plCPgUA,"Darrin Moon1 LOL when its brung you wont want it.","Darrin Moon1 LOL when its brung you wont want it.",0,"2018-04-14 23:39:04","2018-04-14 23:39:04",0,UgxLEN6GMwju3oXWmaB4AaABAg
4681,Ugz6Z4BAnBgYFiDp02p4AaABAg,jlGuBqQPxF8,"max lobel",UCr3azyuUvLqXbI-C-G8jmRw,"God man got enough ads?","God man got enough ads?",0,"2018-04-14 23:29:51","2018-04-14 23:29:51",0,null
4682,Ugxltmjmz7PyuEF85NZ4AaABAg,jlGuBqQPxF8,Moe,UCehJ-hRXYtbek6quwsTT5qg,"After WW3 , FEMA WILL THROW YOU IN THE FEMA CAMPS THEYRE DESIGNED LIKE NAZI CONCENTRATION CAMPS FUCK FEMA AND DONT COMPLIE WITH THEM","After WW3 , FEMA WILL THROW YOU IN THE FEMA CAMPS THEYRE DESIGNED LIKE NAZI CONCENTRATION CAMPS FUCK FEMA AND DONT COMPLIE WITH THEM",0,"2018-04-14 23:29:49","2018-04-14 23:29:49",0,null
4683,Ugyl9PoP5z0ZEHB31eZ4AaABAg,jlGuBqQPxF8,"Rogers Aquarium",UCbKUPCL2-LnN0HNTMCrV0rA,"Putins not gonna do jack shit.  Yes, Russia has nukes, but there 1950s technology sitting in rusted silos.  This is like the New England Patriots versus the Cleveland Browns.  Russia does not have a modern military anymore.","Putins not gonna do jack shit.  Yes, Russia has nukes, but there 1950s technology sitting in rusted silos.  This is like the New England Patriots versus the Cleveland Browns.  Russia does not have a modern military anymore.",0,"2018-04-14 23:29:07","2018-04-14 23:31:24",0,null
4684,UgwtImxMLvad00rVV0l4AaABAg,jlGuBqQPxF8,"Jo dy",UCGAgYjswyw1LcjGanNVEB7Q,"Sooner or later we are going to blow Putins communist ass!","Sooner or later we are going to blow Putins communist ass!",0,"2018-04-14 23:29:00","2018-04-14 23:29:00",0,null
4685,Ugwz2XMaNMEgZLenU3J4AaABAg,jlGuBqQPxF8,"Good Citizen",UCLxfWAkufqMSEooMATTCo2g,"Obama....current news...?","Obama....current news...?",0,"2018-04-14 23:28:23","2018-04-14 23:28:23",0,null
4686,UgzEDY90Ac78fHIgLxl4AaABAg,jlGuBqQPxF8,"Jewel Grier",UCTam11oAtwXxfgMWDyHNnEg,"I didnt vote 4 him","I didnt vote 4 him",0,"2018-04-14 23:28:17","2018-04-14 23:28:17",0,null
4687,Ugx2jZ_E-69IuYUBcad4AaABAg,jlGuBqQPxF8,"Greg Hakes",UCs-Fq7oSHMI1w69q7lyivtw,"FOLLOW THE MONEY - Yeah isnt he the same guy that said hed shoot down any misslels launched with his
top of the line S400 defense system ????  LOL, LMOL.  Putin is a tough talker, but when he gets in the ring with
the U.S. he will get K.Od every time.","FOLLOW THE MONEY - Yeah isnt he the same guy that said hed shoot down any misslels launched with his
top of the line S400 defense system ????  LOL, LMOL.  Putin is a tough talker, but when he gets in the ring with
the U.S. he will get K.Od every time.",3,"2018-04-14 23:28:13","2018-04-14 23:28:13",4,null
4688,Ugx2jZ_E-69IuYUBcad4AaABAg.8f1wi1EaPjG8f26lWVuEdu,jlGuBqQPxF8,"Greg Hakes",UCs-Fq7oSHMI1w69q7lyivtw,"Jr ALEXANDER - It doesnt matter what the U.S. media says.  The U.S. Pentagon and their allies say zero missiles were shot down.   Please click on the link below for proof.
https://www.theguardian.com/world/2018/apr/14/allies-dispute-russian-and-syrian-claims-of-shot-down-missiles","Jr ALEXANDER - It doesnt matter what the U.S. media says.  The U.S. Pentagon and their allies say zero missiles were shot down.   Please click on the link below for proof.
https://www.theguardian.com/world/2018/apr/14/allies-dispute-russian-and-syrian-claims-of-shot-down-missiles",0,"2018-04-15 01:04:49","2018-04-15 01:05:06",0,Ugx2jZ_E-69IuYUBcad4AaABAg
4689,Ugx2jZ_E-69IuYUBcad4AaABAg.8f1wi1EaPjG8f24V3a5taU,jlGuBqQPxF8,"Jr ALEXANDER",UCrcurhTXH0x5PJc2VGYfnJw,"Greg Hakes 
Even u.s. media says 13","Greg Hakes 
Even u.s. media says 13",0,"2018-04-15 00:44:57","2018-04-15 00:44:57",0,Ugx2jZ_E-69IuYUBcad4AaABAg
4690,Ugx2jZ_E-69IuYUBcad4AaABAg.8f1wi1EaPjG8f247tedwic,jlGuBqQPxF8,"Greg Hakes",UCs-Fq7oSHMI1w69q7lyivtw,"Mena Battista -  I highly doubt they shot down more than 6 missiles, even that is probably
a stretch.","Mena Battista -  I highly doubt they shot down more than 6 missiles, even that is probably
a stretch.",0,"2018-04-15 00:41:47","2018-04-15 00:41:47",0,Ugx2jZ_E-69IuYUBcad4AaABAg
4691,Ugx2jZ_E-69IuYUBcad4AaABAg.8f1wi1EaPjG8f21Rxh4PsG,jlGuBqQPxF8,"Mena Battista",UCQekZYuJMEFT_44iDKb32Gg,"They actually bragged thry shot down about 70 :)","They actually bragged thry shot down about 70 :)",0,"2018-04-15 00:18:19","2018-04-15 00:18:19",0,Ugx2jZ_E-69IuYUBcad4AaABAg
4692,Ugwh_e0ZLNmZQi9aHGt4AaABAg,jlGuBqQPxF8,"Sneaky Pete",UC-mpIXNmuOrmbSKcOOOKOdw,"We have to NUKE ☢️ ALL SHITHOLE COUNTRIES","We have to NUKE ☢️ ALL SHITHOLE COUNTRIES",0,"2018-04-14 23:28:10","2018-04-14 23:28:10",0,null
4693,UgwgQyCsUhuaJJA5tdB4AaABAg,jlGuBqQPxF8,Woodsman,UC50X7aczATYA4MyjNI2uJIA,"Russia warned, not to attack Syria and we did, Russia didnt do shit, and cant do shit about it. Its all a bluff and war porn.","Russia warned, not to attack Syria and we did, Russia didnt do shit, and cant do shit about it. Its all a bluff and war porn.",0,"2018-04-14 23:27:37","2018-04-14 23:27:37",2,null
4694,UgwgQyCsUhuaJJA5tdB4AaABAg.8f1wdaiPt6i8f1zBINltFF,jlGuBqQPxF8,Woodsman,UC50X7aczATYA4MyjNI2uJIA,"Moe 

Hey Moe are you related to the Three Stooges? If Russia wanted to avoid it all together, why make empty threats and play along? Yup that makes alot of sense!","Moe 

Hey Moe are you related to the Three Stooges? If Russia wanted to avoid it all together, why make empty threats and play along? Yup that makes alot of sense!",0,"2018-04-14 23:49:49","2018-04-14 23:49:49",0,UgwgQyCsUhuaJJA5tdB4AaABAg
4695,UgwgQyCsUhuaJJA5tdB4AaABAg.8f1wdaiPt6i8f1wzxhrwjV,jlGuBqQPxF8,Moe,UCehJ-hRXYtbek6quwsTT5qg,"Russia is trying to avoid ww3 you idiot while UK , US and israel are trying to provoke it they need ww3 not russia. You fucktarded american.","Russia is trying to avoid ww3 you idiot while UK , US and israel are trying to provoke it they need ww3 not russia. You fucktarded american.",0,"2018-04-14 23:30:40","2018-04-14 23:30:40",0,UgwgQyCsUhuaJJA5tdB4AaABAg
4696,UgwMzgcldDrsO-9-R114AaABAg,jlGuBqQPxF8,"Nikki PiP",UC3yZ_u0p8IrdeRpp3MhT10w,"Ive given up on you.","Ive given up on you.",0,"2018-04-14 23:27:32","2018-04-14 23:27:32",0,null
4697,UgwAanpDhDf-_6830lJ4AaABAg,jlGuBqQPxF8,"Ken Krause",UC1wJHuI5cvjx1XBmMANCrfw,"dont believe this crap.  RT = Russian crap","dont believe this crap.  RT = Russian crap",0,"2018-04-14 23:26:56","2018-04-14 23:26:56",0,null
4698,UgygNWzYWYj6y34I5Yd4AaABAg,jlGuBqQPxF8,"R Packham",UCTr00PcVXyfL1K-f-8KdZOA,"If China pulls the plug on lending to the USA the USA will implode the biggest security threat to USA is debt","If China pulls the plug on lending to the USA the USA will implode the biggest security threat to USA is debt",0,"2018-04-14 23:26:52","2018-04-14 23:26:52",0,null
4699,Ugz_ZTVr5FYq5xat23R4AaABAg,jlGuBqQPxF8,"Jack Nadeau",UCtsx8zLklmbQAcDSkKmiJhA,"Info war is getting ridiculous, Alex calm  the fuck down..","Info war is getting ridiculous, Alex calm  the fuck down..",0,"2018-04-14 23:24:33","2018-04-14 23:24:33",0,null
4700,UgyHKoyACnFGga31Oj54AaABAg,jlGuBqQPxF8,"Auther Whitmire",UCQlCTS7DhAkE0gjHXOkzu-g,"Hes rite, So LETS GIT IT ON!","Hes rite, So LETS GIT IT ON!",0,"2018-04-14 23:24:24","2018-04-14 23:24:24",0,null
4701,UgxsMCRGz4GUBbdmNil4AaABAg,jlGuBqQPxF8,"Donald Kosse",UCXA92e-fiZmragfmIFTyYlQ,"Bring it on we have the greatest president we have ever had, and the best army.we can  not just beat Russia we will end you for good are  generals  and the best army  so bring it on   you  cant  beat the true American","Bring it on we have the greatest president we have ever had, and the best army.we can  not just beat Russia we will end you for good are  generals  and the best army  so bring it on   you  cant  beat the true American",0,"2018-04-14 23:23:58","2018-04-14 23:25:44",0,null
4702,UgyotWgFoc6oR4PRnl14AaABAg,jlGuBqQPxF8,"Phil Jones",UC9XfXquaIKRqc1j_n2XAACQ,"fools run the world and now those same fools will do everything they can to attain their desires. EVEN IF IT MEANS WALKING OFF A CLIFF! so blinded by their greed which leads them to their ruin.","fools run the world and now those same fools will do everything they can to attain their desires. EVEN IF IT MEANS WALKING OFF A CLIFF! so blinded by their greed which leads them to their ruin.",0,"2018-04-14 23:23:56","2018-04-14 23:23:56",0,null
4703,Ugzxb165Fhkn-4IVkUl4AaABAg,jlGuBqQPxF8,"stan marsh",UCSvMZXEqn5EKurQOPEdFsAA,"NOT TRUE OLD NEWS ....THATS NOT EVEN ALEX JONES NEW STUDIO....OBAMA GONNA FIND OUT WHAT WORKS DESTROYING AMERICA AND DOUBLE DOWN AND SUPPORT ISIL MORE","NOT TRUE OLD NEWS ....THATS NOT EVEN ALEX JONES NEW STUDIO....OBAMA GONNA FIND OUT WHAT WORKS DESTROYING AMERICA AND DOUBLE DOWN AND SUPPORT ISIL MORE",0,"2018-04-14 23:23:06","2018-04-14 23:23:06",0,null
4704,UgwgSfPx5v3OBfHESlt4AaABAg,jlGuBqQPxF8,"Jack Nadeau",UCtsx8zLklmbQAcDSkKmiJhA,"Putin is full of shit, he will be destroyed  in a few days, cuz the US are not alone so come on Putin do you thing...","Putin is full of shit, he will be destroyed  in a few days, cuz the US are not alone so come on Putin do you thing...",0,"2018-04-14 23:22:26","2018-04-14 23:22:26",0,null
4705,UgykA-Fe6Qxc7Wh7WC94AaABAg,jlGuBqQPxF8,Silverstone,UCv3rR3fyHpDTMaNjOjGr9eQ,"Russias the kid running away yelling...Im goin to get you asshole","Russias the kid running away yelling...Im goin to get you asshole",0,"2018-04-14 23:22:04","2018-04-14 23:22:04",0,null
4706,UgxMK-E7EgcRmjaN_jZ4AaABAg,jlGuBqQPxF8,"A CHOSEN VESSEL",UCdmqQDjsb7TXBVbeIahH9Pw,"Study the prophecy.......America is going to be destroyed in one hour.","Study the prophecy.......America is going to be destroyed in one hour.",0,"2018-04-14 23:21:49","2018-04-14 23:21:49",0,null
4707,Ugy8vTuODkH4IQJrFXp4AaABAg,jlGuBqQPxF8,"Eisen J Eisen",UCI02UWHrBBYtJQBpUfVF6zA,"America is already destroyed , the Petrodollar is on its way out","America is already destroyed , the Petrodollar is on its way out",0,"2018-04-14 23:21:21","2018-04-14 23:21:21",0,null
4708,Ugw3NuhnONibD3CANhp4AaABAg,jlGuBqQPxF8,"David O",UCsi9MO_cfUkcBbvLULLuxkA,"PRAY FOR PEACE !!!","PRAY FOR PEACE !!!",0,"2018-04-14 23:21:14","2018-04-14 23:21:14",0,null
4709,Ugy54xPIqj8NZJCVfXd4AaABAg,jlGuBqQPxF8,"my Kirk",UCuThC1hqOC20jRIpB1SIm7A,"sanction that mother f***** goes broke tell he cant even afford goats milk","sanction that mother f***** goes broke tell he cant even afford goats milk",0,"2018-04-14 23:20:45","2018-04-14 23:20:45",0,null
4710,UgyV-Salo8VbotvTsI54AaABAg,jlGuBqQPxF8,"Kent Lawson",UC_1ycQAVy6zvmr5s2xxqbTA,"old news , dont waste your time watching . OLD OLD OLD","old news , dont waste your time watching . OLD OLD OLD",0,"2018-04-14 23:20:18","2018-04-14 23:20:18",0,null
4711,UgzigeuhEfWqGiQAaqB4AaABAg,jlGuBqQPxF8,"Michael Fletcher",UCBTrGTwXoTy3NbHTZ5M3b0g,"I love the Photoshop image on the thumbnail! How are ppl buying into these fake YouTube channels!!??","I love the Photoshop image on the thumbnail! How are ppl buying into these fake YouTube channels!!??",0,"2018-04-14 23:20:01","2018-04-14 23:20:01",0,null
4712,UgysHwY4K30BZQrsEzt4AaABAg,jlGuBqQPxF8,"Chris Sharpe",UCKhvBIsiCNdiM6e3_ERHTNA,"Alex . Leave yr emotions at homey.  Dont be a comey.  You fat squeling pig..","Alex . Leave yr emotions at homey.  Dont be a comey.  You fat squeling pig..",0,"2018-04-14 23:20:00","2018-04-14 23:20:00",0,null
4713,Ugz75y7iNwNrj3EqqQV4AaABAg,jlGuBqQPxF8,"Paul Smith",UCUChZagqDG4GXW_YW80t_yA,"Russias response is going to be deadly for the U.K. And US","Russias response is going to be deadly for the U.K. And US",0,"2018-04-14 23:19:55","2018-04-14 23:19:55",0,null
4714,Ugw-3lPaj29Inw9ybUd4AaABAg,jlGuBqQPxF8,"Edwin Rodgers",UCn1nwZ8UJ7qCl8CHmCWbwXg,"Reports Israel has hit Iran recently since the strikes in Syria. But all this is most likely a distraction for something else to slip under the carpet...... but what Ive no clue, maybe the announcement of other life in the galaxy has arrived? !!","Reports Israel has hit Iran recently since the strikes in Syria. But all this is most likely a distraction for something else to slip under the carpet...... but what Ive no clue, maybe the announcement of other life in the galaxy has arrived? !!",0,"2018-04-14 23:19:42","2018-04-14 23:19:42",0,null
4715,Ugza7uyk3E6D4q1oPKd4AaABAg,jlGuBqQPxF8,"Jr Lee",UCAxafi7uSmWrGHIwbjnRR0Q,"I’m Asian and I say fuck China and Russia. Go president trump","I’m Asian and I say fuck China and Russia. Go president trump",0,"2018-04-14 23:19:04","2018-04-14 23:19:04",0,null
4716,Ugy5AtD2ALoAGux8u9h4AaABAg,jlGuBqQPxF8,"marco testa",UCX_MLICZ9IDvbIEzUrMVdtA,"all propaganda ,...fear the mass ,...these top elites have an agenda ,... even the truthers are sounding like a broken record.","all propaganda ,...fear the mass ,...these top elites have an agenda ,... even the truthers are sounding like a broken record.",58,"2018-04-14 23:18:42","2018-04-14 23:18:42",10,null
4717,Ugy5AtD2ALoAGux8u9h4AaABAg.8f1vcHSJ52U8f4Kdg7A9BH,jlGuBqQPxF8,"A CHOSEN VESSEL",UCdmqQDjsb7TXBVbeIahH9Pw,"marco testa: Idiots like you on the day of 9/11 were calling that propaganda too. Americas destruction is going to come suddenly and people like you who didnt believe are going to be caught off guard.","marco testa: Idiots like you on the day of 9/11 were calling that propaganda too. Americas destruction is going to come suddenly and people like you who didnt believe are going to be caught off guard.",0,"2018-04-15 21:44:33","2018-04-15 21:44:33",0,Ugy5AtD2ALoAGux8u9h4AaABAg
4718,Ugy5AtD2ALoAGux8u9h4AaABAg.8f1vcHSJ52U8f25xIAS3Tg,jlGuBqQPxF8,"mike jansen",UCk3a1z_Sq_LXXr4NxSxvSqg,"349mikval Whut nooooooo","349mikval Whut nooooooo",0,"2018-04-15 00:57:41","2018-04-15 00:57:41",0,Ugy5AtD2ALoAGux8u9h4AaABAg
4719,Ugy5AtD2ALoAGux8u9h4AaABAg.8f1vcHSJ52U8f25uClNm-G,jlGuBqQPxF8,"mike jansen",UCk3a1z_Sq_LXXr4NxSxvSqg,"marco testa Yes i believe so to this is all meant to make us believen that 1 global government is a must have, but remember the united states is already spying on everyone so trust me their intensions are not good at all... and if they realy start nuking us then this is a very sick game their playing ?","marco testa Yes i believe so to this is all meant to make us believen that 1 global government is a must have, but remember the united states is already spying on everyone so trust me their intensions are not good at all... and if they realy start nuking us then this is a very sick game their playing ?",0,"2018-04-15 00:57:16","2018-04-15 00:57:16",0,Ugy5AtD2ALoAGux8u9h4AaABAg
4720,Ugy5AtD2ALoAGux8u9h4AaABAg.8f1vcHSJ52U8f23x0oHz6q,jlGuBqQPxF8,"Jr ALEXANDER",UCrcurhTXH0x5PJc2VGYfnJw,"349mikval 
I havent heard that yet","349mikval 
I havent heard that yet",0,"2018-04-15 00:40:10","2018-04-15 00:40:10",0,Ugy5AtD2ALoAGux8u9h4AaABAg
4721,Ugy5AtD2ALoAGux8u9h4AaABAg.8f1vcHSJ52U8f238uDWVuy,jlGuBqQPxF8,349mikval,UCdOta2-iAQY9vHKVuTOKMEw,"I think it all just changed , Israel just bombed Irans military depot in Syria and the Iranians are Russias buddys.","I think it all just changed , Israel just bombed Irans military depot in Syria and the Iranians are Russias buddys.",2,"2018-04-15 00:33:11","2018-04-15 00:33:11",0,Ugy5AtD2ALoAGux8u9h4AaABAg
4722,UgwSK_ZNt-cHtgfA9Od4AaABAg,jlGuBqQPxF8,"Haji al Kidya",UC4euIAb7TRSTDurjETWxOqg,"This is the United Nations plan, as part of Agenda 21 and Agenda 2030 to drastically reduce the human population of the world.  The elites will be well protected in their underground bunkers for years if necessary while those living on the surface will suffer the effects of nuclear radiation,  exposure to cosmic radiation due to loss of ozone layer and nuclear winter with no electricity.","This is the United Nations plan, as part of Agenda 21 and Agenda 2030 to drastically reduce the human population of the world.  The elites will be well protected in their underground bunkers for years if necessary while those living on the surface will suffer the effects of nuclear radiation,  exposure to cosmic radiation due to loss of ozone layer and nuclear winter with no electricity.",15,"2018-04-14 23:17:14","2018-04-14 23:17:14",7,null
4723,UgwSK_ZNt-cHtgfA9Od4AaABAg.8f1vSZ4xWNB8f275-Ztssp,jlGuBqQPxF8,"Ten Spades",UC_1HrwylnO7ev6I96yq6wvw,"gforce dabomb Im not ex anything. Ima 22 yr old stoner with anxiety that likes to research and learn.","gforce dabomb Im not ex anything. Ima 22 yr old stoner with anxiety that likes to research and learn.",0,"2018-04-15 01:07:36","2018-04-15 01:07:36",0,UgwSK_ZNt-cHtgfA9Od4AaABAg
4724,UgwSK_ZNt-cHtgfA9Od4AaABAg.8f1vSZ4xWNB8f25yYxLlE8,jlGuBqQPxF8,"gforce dabomb",UClgS7LIofh_j8r3Mnufw_Kg,"Ten Spades OK Rambo calm the fuck down not everybody is an ex navy seal are they ? G","Ten Spades OK Rambo calm the fuck down not everybody is an ex navy seal are they ? G",0,"2018-04-15 00:57:51","2018-04-15 00:57:51",0,UgwSK_ZNt-cHtgfA9Od4AaABAg
4725,UgwSK_ZNt-cHtgfA9Od4AaABAg.8f1vSZ4xWNB8f25spzCyf7,jlGuBqQPxF8,"Marc Turk",UCxMljRkOOX21qGqx58Pr7ig,"Haji al Kidya I call em the chickenshit coward elite they built it ,cause it run and hide like cowards,make us little people pay the sacrifice then they can all get back to there lives  as usual when its all over !","Haji al Kidya I call em the chickenshit coward elite they built it ,cause it run and hide like cowards,make us little people pay the sacrifice then they can all get back to there lives  as usual when its all over !",0,"2018-04-15 00:57:04","2018-04-15 00:57:04",0,UgwSK_ZNt-cHtgfA9Od4AaABAg
