id,comment_id,video_id,commenter_name,commenter_id,comment_displayed,comment_original,likes,published_date,updated_date,total_replies,replyto
12371,UgwktWcwzARMQDu2p414AaABAg,mkBbFWxLIT8,"Crystal Torres-Kolberg",UCUyzZty3wqzQkuTfx5AE-tg,"All of this on Shabbat a Holy day","All of this on Shabbat a Holy day",6,"2018-04-14 06:22:52","2018-04-14 06:23:15",3,null
12372,UgwktWcwzARMQDu2p414AaABAg.8f06N4ig-Gq8f4ToFGVi8l,mkBbFWxLIT8,"Terrarium Firma",UCYrbvFNVRiyaPPBn5VpJUZQ,"Now you know who the jews worship. Sheva is the Devil, Shiva. Seven.","Now you know who the jews worship. Sheva is the Devil, Shiva. Seven.",0,"2018-04-15 23:04:38","2018-04-15 23:04:38",0,UgwktWcwzARMQDu2p414AaABAg
12373,UgwktWcwzARMQDu2p414AaABAg.8f06N4ig-Gq8f09sQFopzp,mkBbFWxLIT8,AzraelPercussionNEO,UC3kebStK_kTLI6cXbWbgSIw,"Crystal Torres-Kolberg All on Friday 13th US (Yeah Satan is working his magic). The beginning of the beginning of the End. Before the coming of Him.","Crystal Torres-Kolberg All on Friday 13th US (Yeah Satan is working his magic). The beginning of the beginning of the End. Before the coming of Him.",3,"2018-04-14 06:53:29","2018-04-14 06:54:34",0,UgwktWcwzARMQDu2p414AaABAg
12374,UgwktWcwzARMQDu2p414AaABAg.8f06N4ig-Gq8f08ZmKIZZd,mkBbFWxLIT8,"Think 4 Yourself",UCWhtboE5irtej6gK2tauI6A,"Makes sense now.","Makes sense now.",2,"2018-04-14 06:42:04","2018-04-14 06:42:04",0,UgwktWcwzARMQDu2p414AaABAg
12375,UgyJWWLSizgYLJaa8nd4AaABAg,mkBbFWxLIT8,"Richard Barnes",UCZLzIk6ujg3Tba0YGkA4z-g,"I wanted to see proof as well but now that the bullets are flying we had better be backing our boys!","I wanted to see proof as well but now that the bullets are flying we had better be backing our boys!",6,"2018-04-14 06:22:20","2018-04-14 06:22:20",1,null
12376,UgyJWWLSizgYLJaa8nd4AaABAg.8f06JGYScKG8f1yjgHKPSf,mkBbFWxLIT8,"camba man512",UCFbDJxfR_aePt5JwDnjKN3g,"see  your  ass","see  your  ass",0,"2018-04-14 23:45:55","2018-04-14 23:45:55",0,UgyJWWLSizgYLJaa8nd4AaABAg
12377,UgyNA_37dttNVOZwdBR4AaABAg,mkBbFWxLIT8,"Lewis Artyum",UCIJXE1RugVtiMI74f1CAEgw,"Oh my god...what the hell is going on with the stupid North Americans. Leave the Russsians alone...idiots, what a bunch of imbeciles. They should like at their own backyard first...","Oh my god...what the hell is going on with the stupid North Americans. Leave the Russsians alone...idiots, what a bunch of imbeciles. They should like at their own backyard first...",0,"2018-04-14 06:19:54","2018-04-14 06:19:54",2,null
12378,UgyNA_37dttNVOZwdBR4AaABAg.8f061MgvHOQ8f0CI349Bay,mkBbFWxLIT8,"Lewis Artyum",UCIJXE1RugVtiMI74f1CAEgw,"really...so you are the good guys...right. Wake up mate, the USA will go to extremes and will do the unthinkable to control the world by political and economically, can you see it? Where ever you go you create chaos, and blame someone else, your country created ISIS and all the havoc in the middle east...why? have you ask yourself the question? Oil...plus who know what the Jewish state also wants...open you eyes.. there is nothing wrong with having an opinion. Not because i have a  different ideology Im a bad guy...think intelligently arent yo a free person leaving in a  free democratic society> Well think like one...and allow me to express my views and feelings.","really...so you are the good guys...right. Wake up mate, the USA will go to extremes and will do the unthinkable to control the world by political and economically, can you see it? Where ever you go you create chaos, and blame someone else, your country created ISIS and all the havoc in the middle east...why? have you ask yourself the question? Oil...plus who know what the Jewish state also wants...open you eyes.. there is nothing wrong with having an opinion. Not because i have a  different ideology Im a bad guy...think intelligently arent yo a free person leaving in a  free democratic society> Well think like one...and allow me to express my views and feelings.",0,"2018-04-14 07:14:36","2018-04-14 07:14:36",0,UgyNA_37dttNVOZwdBR4AaABAg
12379,UgyNA_37dttNVOZwdBR4AaABAg.8f061MgvHOQ8f07VQRV9PK,mkBbFWxLIT8,"Ruben Zuniga",UC-jBriZMUHjHVYzX9UAhiYg,"Lewis Artyum why u mad u ppl r the bad guys","Lewis Artyum why u mad u ppl r the bad guys",1,"2018-04-14 06:32:44","2018-04-14 06:32:44",0,UgyNA_37dttNVOZwdBR4AaABAg
12380,UgxH3aOjnD7C7m93xP54AaABAg,mkBbFWxLIT8,Mannequinwizard,UCUWtO141M_TTRoDK5ci1Obw,"IT LOOKS LIKE IT MAY HAVE JUST STARTED SLOWLY FROM THIS EVENT.","IT LOOKS LIKE IT MAY HAVE JUST STARTED SLOWLY FROM THIS EVENT.",4,"2018-04-14 06:15:15","2018-04-14 06:15:15",0,null
12381,UgyJalGgoqH40zlBs_x4AaABAg,mkBbFWxLIT8,"Graham Meek",UCCVVrN1bnKuw2QLQ8U4jCuA,"Very old footage. Maybe three to four yeas old.","Very old footage. Maybe three to four yeas old.",2,"2018-04-14 06:15:01","2018-04-14 06:15:01",0,null
12382,UgyUvqhS3qskfw69mmV4AaABAg,mkBbFWxLIT8,"Daniel Schwap",UCH3mk6deRbiZhDbP8RQZkqg,"Ww3? ? where are enemies?where are rats? Iran Hizbollah and Russia why are silent and leaved Syria? I dont agree and with this war terrorism will finnish","Ww3? ? where are enemies?where are rats? Iran Hizbollah and Russia why are silent and leaved Syria? I dont agree and with this war terrorism will finnish",1,"2018-04-14 06:14:08","2018-04-14 06:14:08",4,null
12383,UgyUvqhS3qskfw69mmV4AaABAg.8f05ND6mpjn8f0kOs496GQ,mkBbFWxLIT8,"behlool samad",UCahkNYKddEaPO2M3pxNXOqA,"Devvon Hitt  America isnt at the top but rather it is at the fuck by the ugly monkey Trump and Zionist lobby who are exploiting the US power for their own benifit","Devvon Hitt  America isnt at the top but rather it is at the fuck by the ugly monkey Trump and Zionist lobby who are exploiting the US power for their own benifit",0,"2018-04-14 12:21:22","2018-04-14 12:21:22",0,UgyUvqhS3qskfw69mmV4AaABAg
12384,UgyUvqhS3qskfw69mmV4AaABAg.8f05ND6mpjn8f0O_7am5TN,mkBbFWxLIT8,"R. AMI",UC14ZHYdlZ-BptLSXZlO8Kfg,"Daniel Schwap may be they planning to strike you when you cant expect.just a possibility.if I be RUSSIA ,ill do attack your cost when you never can imagine....look you are involved in war every corner of world...why you think defeting you is difficult?EMP.","Daniel Schwap may be they planning to strike you when you cant expect.just a possibility.if I be RUSSIA ,ill do attack your cost when you never can imagine....look you are involved in war every corner of world...why you think defeting you is difficult?EMP.",0,"2018-04-14 09:01:55","2018-04-14 09:04:04",0,UgyUvqhS3qskfw69mmV4AaABAg
12385,UgyUvqhS3qskfw69mmV4AaABAg.8f05ND6mpjn8f0JepZaFyX,mkBbFWxLIT8,"Devvon Hitt",UCiOUUTatLlViXniNNSE96jw,"behlool samad Lmao the America will allways be at the top","behlool samad Lmao the America will allways be at the top",1,"2018-04-14 08:19:01","2018-04-14 08:19:01",0,UgyUvqhS3qskfw69mmV4AaABAg
12386,UgyUvqhS3qskfw69mmV4AaABAg.8f05ND6mpjn8f09yS-DQyO,mkBbFWxLIT8,"behlool samad",UCahkNYKddEaPO2M3pxNXOqA,"Daniel Schwap fuck up motherfucker a Zionist terrorist and colonial power of USA will decline soon .futhermore US is definitely the loser of syrian game","Daniel Schwap fuck up motherfucker a Zionist terrorist and colonial power of USA will decline soon .futhermore US is definitely the loser of syrian game",0,"2018-04-14 06:54:18","2018-04-14 06:54:18",0,UgyUvqhS3qskfw69mmV4AaABAg
12387,UgyjhZbtPqYXQ0jEz7J4AaABAg,mkBbFWxLIT8,"wredny dziadzio",UCpuIIYP6PjFsIWpKquM5Npg,"do not listen to Russian propaganda on YT !!!
Russia is just propaganda and cheating
do you want to see the truth about the Russian army?
https://www.youtube.com/watch?v=9w4IDtKLNuo","do not listen to Russian propaganda on YT !!!
Russia is just propaganda and cheating
do you want to see the truth about the Russian army?
https://www.youtube.com/watch?v=9w4IDtKLNuo",2,"2018-04-14 06:13:39","2018-04-14 06:13:39",3,null
12388,UgyjhZbtPqYXQ0jEz7J4AaABAg.8f05Jditubj8f29TbAXISR,mkBbFWxLIT8,Pisstake,UCDlboBReZVOP3d_WFuM8qEg,"wredny dziadzio fuck you dziadzio","wredny dziadzio fuck you dziadzio",0,"2018-04-15 01:28:26","2018-04-15 01:28:26",0,UgyjhZbtPqYXQ0jEz7J4AaABAg
12389,UgyjhZbtPqYXQ0jEz7J4AaABAg.8f05Jditubj8f21DziiEYf,mkBbFWxLIT8,"H G",UCdC8SMkq9M46FZ-HucEyWSQ,"anthonygeorge wesleyy CNN? XD","anthonygeorge wesleyy CNN? XD",0,"2018-04-15 00:16:24","2018-04-15 00:16:24",0,UgyjhZbtPqYXQ0jEz7J4AaABAg
12390,UgyjhZbtPqYXQ0jEz7J4AaABAg.8f05Jditubj8f083ybsWTZ,mkBbFWxLIT8,"anthonygeorge wesleyy",UCUMhtPmid5PAS9aWT4dktdg,"wredny dziadzio the most and truthful news media is CNNx all other news channels tend to bend the stories....","wredny dziadzio the most and truthful news media is CNNx all other news channels tend to bend the stories....",0,"2018-04-14 06:37:43","2018-04-14 06:37:43",0,UgyjhZbtPqYXQ0jEz7J4AaABAg
12391,Ugw0j_WE1K9HGfp6LpZ4AaABAg,mkBbFWxLIT8,"Vue Lee",UC-FuvHSEdtyYteaQDGn4Drg,"fyi, every country throws in the towel trump gets impeached.... sad news.","fyi, every country throws in the towel trump gets impeached.... sad news.",3,"2018-04-14 06:07:44","2018-04-14 06:07:44",0,null
12392,UgyIDs_zMAYY06G4y0d4AaABAg,mkBbFWxLIT8,"bob .right",UC1G85gk81PXYMN4pe6Uk_BA,"THE USA IS FUCK","THE USA IS FUCK",2,"2018-04-14 06:04:42","2018-04-14 06:04:42",0,null
12393,UgwiNPTwTgbuFV_2QOp4AaABAg,mkBbFWxLIT8,"Naila  Martus",UCmCMieZzyHBOb_-_Vafr77g,"Well ok then. Um excuse me Mr.Putin are going to return fire?","Well ok then. Um excuse me Mr.Putin are going to return fire?",14,"2018-04-14 06:02:27","2018-04-14 06:02:27",11,null
12394,UgwiNPTwTgbuFV_2QOp4AaABAg.8f041ab_gPl8f0vapUk5qD,mkBbFWxLIT8,"Josue Dong",UCypIeQuAW6e4HrJ0NJJpbhg,"Putin maybe a pussy buy hes not stupid, he knows the USA will chew his punk sorry ass in seconds.","Putin maybe a pussy buy hes not stupid, he knows the USA will chew his punk sorry ass in seconds.",0,"2018-04-14 13:59:15","2018-04-14 13:59:15",0,UgwiNPTwTgbuFV_2QOp4AaABAg
12395,UgwiNPTwTgbuFV_2QOp4AaABAg.8f041ab_gPl8f0S48EXtoC,mkBbFWxLIT8,"Cricket Wireless",UC-hB2EfPaIyBrikcgWP9DAA,"Naila  Martus NO! MY  Al..MISSILES DONT WANT TO COME OUT AND PLAY..WITH THOSE WESTERN COWBOYS.GANGSTERS ...THEY PLAY FOR KEEPS..","Naila  Martus NO! MY  Al..MISSILES DONT WANT TO COME OUT AND PLAY..WITH THOSE WESTERN COWBOYS.GANGSTERS ...THEY PLAY FOR KEEPS..",0,"2018-04-14 09:32:31","2018-04-14 09:34:03",0,UgwiNPTwTgbuFV_2QOp4AaABAg
12396,UgwiNPTwTgbuFV_2QOp4AaABAg.8f041ab_gPl8f0NQdRj5Ks,mkBbFWxLIT8,"Stuart Crossland",UCAe5qbaIHTYwRIM_aVodMwA,"It was a token strike with the knowledge of the Russians.","It was a token strike with the knowledge of the Russians.",0,"2018-04-14 08:51:53","2018-04-14 08:51:53",0,UgwiNPTwTgbuFV_2QOp4AaABAg
12397,UgwiNPTwTgbuFV_2QOp4AaABAg.8f041ab_gPl8f0EWBharjj,mkBbFWxLIT8,setsebbati,UCq_wj9_quWzsfFutP-gl6mQ,"Pray he doesnt ❗️The US believe no one can respond to their so called  might If Putin does respond the world will see a catastrophe the likes of which has never been seen before. Today Trump, May, Macron broke international law, they are war criminals.","Pray he doesnt ❗️The US believe no one can respond to their so called  might If Putin does respond the world will see a catastrophe the likes of which has never been seen before. Today Trump, May, Macron broke international law, they are war criminals.",0,"2018-04-14 07:34:00","2018-04-14 07:34:00",0,UgwiNPTwTgbuFV_2QOp4AaABAg
12398,UgwiNPTwTgbuFV_2QOp4AaABAg.8f041ab_gPl8f0EMvlDFLy,mkBbFWxLIT8,"Max Foam",UCvPx91iID0Rgz4FpXVkxXsQ,"Allen Tweedy 100% true I’m going to be the 10% I wish I would have planed more but hank taught me how to survive so let’s get this shit done","Allen Tweedy 100% true I’m going to be the 10% I wish I would have planed more but hank taught me how to survive so let’s get this shit done",0,"2018-04-14 07:32:44","2018-04-14 07:32:44",0,UgwiNPTwTgbuFV_2QOp4AaABAg
