id,comment_id,video_id,commenter_name,commenter_id,comment_displayed,comment_original,likes,published_date,updated_date,total_replies,replyto
12313,UgwchfaQqYLwyyTdRe94AaABAg.8f09ghAPijQ8f2fRPDDeWU,mkBbFWxLIT8,Andreas,UCnmhZW3pQrCpcicclOnKr1g,"Youre just not getting, what it would mean for Russia or China to get it really going. They would have to take the US by the balls and hit its face until they dont think about moving again. And that means, maybe millions of US People, of wich they KNOW dont want a war between them would have to be killed at once. Every time you have the wrong People to pay for a war, the real Robbers hide until the smokes gone again. Putin at least, knows that. Its only the US Military complex, run by insane criminals, that dont give a shit about you. You cant rely on the US gvt. too, if you take it seriously. They dont give a damn about their common citizens, because they think theyre safe in their DUMPs. Oh, and btw. YOU are NOT there with them.","Youre just not getting, what it would mean for Russia or China to get it really going. They would have to take the US by the balls and hit its face until they dont think about moving again. And that means, maybe millions of US People, of wich they KNOW dont want a war between them would have to be killed at once. Every time you have the wrong People to pay for a war, the real Robbers hide until the smokes gone again. Putin at least, knows that. Its only the US Military complex, run by insane criminals, that dont give a shit about you. You cant rely on the US gvt. too, if you take it seriously. They dont give a damn about their common citizens, because they think theyre safe in their DUMPs. Oh, and btw. YOU are NOT there with them.",0,"2018-04-15 06:16:30","2018-04-15 06:24:17",0,UgwchfaQqYLwyyTdRe94AaABAg
12314,Ugw-PNL3lwlxmsmEK3R4AaABAg,mkBbFWxLIT8,AzraelPercussionNEO,UC3kebStK_kTLI6cXbWbgSIw,"This is fucking bullshit...I really do not want to follow this bullshit (but I have too)...I am sticking to continue to practice my guitar and say fuck this political bullshit. I cry for a simple life man.","This is fucking bullshit...I really do not want to follow this bullshit (but I have too)...I am sticking to continue to practice my guitar and say fuck this political bullshit. I cry for a simple life man.",0,"2018-04-14 06:51:02","2018-04-14 06:51:02",0,null
12315,UgxnSEUuOSYhzpqhL-54AaABAg,mkBbFWxLIT8,"vLadimir L",UCkaZqXP_ZKY4GMctuvAmI9g,"America is already paying and yet that is just beginning.
You will get your boomerang back.","America is already paying and yet that is just beginning.
You will get your boomerang back.",0,"2018-04-14 06:50:27","2018-04-14 06:50:27",0,null
12316,Ugxi4uhcGFV3hqUfCvN4AaABAg,mkBbFWxLIT8,"A-Ball BEATZ",UCpPAdR81P2pI3l5dT4lm6jQ,"Haha I fuckin knew he would  do this shit game over America game over","Haha I fuckin knew he would  do this shit game over America game over",3,"2018-04-14 06:49:54","2018-04-14 06:49:54",0,null
12317,UgwbOcGXcSx7hIumqBl4AaABAg,mkBbFWxLIT8,gottabump,UCYxTO5IVSCMT7f69e0sUIYw,"That didnt start anything & Russia wont do a dam thing","That didnt start anything & Russia wont do a dam thing",0,"2018-04-14 06:49:42","2018-04-14 06:49:42",0,null
12318,UgxmdX6ut5KM3cA5uTd4AaABAg,mkBbFWxLIT8,"Eric Sean Outkast",UCnyqC0L0dC9AE_3Fz6d7hxg,"im scared, lets all hold hands","im scared, lets all hold hands",8,"2018-04-14 06:47:35","2018-04-14 06:47:35",10,null
12319,UgxmdX6ut5KM3cA5uTd4AaABAg.8f09CBZ6OGw8f3mWvIU3sE,mkBbFWxLIT8,"The Me",UCowbajTSFfjYfNh_VE6tBFw,"Eric Sean Outkast
Fear not him who is able to destroy the body...but rather fear Him who is able to destroy both body and soul in hell.","Eric Sean Outkast
Fear not him who is able to destroy the body...but rather fear Him who is able to destroy both body and soul in hell.",0,"2018-04-15 16:37:40","2018-04-15 16:37:40",0,UgxmdX6ut5KM3cA5uTd4AaABAg
12320,UgxmdX6ut5KM3cA5uTd4AaABAg.8f09CBZ6OGw8f2X7dnw1L-,mkBbFWxLIT8,"VAHALLA SKOL",UCItZ4N3C2vjgstVWKrepzbw,"POOP! Your gona feel bad for saying that in the merning","POOP! Your gona feel bad for saying that in the merning",0,"2018-04-15 04:55:10","2018-04-15 04:55:10",0,UgxmdX6ut5KM3cA5uTd4AaABAg
12321,UgxmdX6ut5KM3cA5uTd4AaABAg.8f09CBZ6OGw8f1stNJ_WxD,mkBbFWxLIT8,plavcer,UCd7CST8d-0LrH8DRG8r9yyQ,??Done!,??Done!,0,"2018-04-14 22:54:49","2018-04-14 22:54:49",0,UgxmdX6ut5KM3cA5uTd4AaABAg
12322,UgxmdX6ut5KM3cA5uTd4AaABAg.8f09CBZ6OGw8f0Luc-Mw35,mkBbFWxLIT8,POOP!,UCt14-hkg-doU6Nej3cb-bTQ,"Eric Sean Outkast 
Okay okay... im sorry princess","Eric Sean Outkast 
Okay okay... im sorry princess",0,"2018-04-14 08:38:39","2018-04-14 08:38:39",0,UgxmdX6ut5KM3cA5uTd4AaABAg
12323,UgxmdX6ut5KM3cA5uTd4AaABAg.8f09CBZ6OGw8f0L18ibVlw,mkBbFWxLIT8,"Eric Sean Outkast",UCnyqC0L0dC9AE_3Fz6d7hxg,"youre boring no more replies for you","youre boring no more replies for you",0,"2018-04-14 08:30:56","2018-04-14 08:30:56",0,UgxmdX6ut5KM3cA5uTd4AaABAg
12324,UgzBvfnjxnZnFajqJ2Z4AaABAg,mkBbFWxLIT8,"Dennis Schell",UCRHFH4Tiht8yI2d54_9z1WQ,"FAKE NEWS.....TROLLING FOR HITS!!!","FAKE NEWS.....TROLLING FOR HITS!!!",2,"2018-04-14 06:46:03","2018-04-14 06:46:03",11,null
12325,UgzBvfnjxnZnFajqJ2Z4AaABAg.8f090sm4r7G8f28-PqXexM,mkBbFWxLIT8,POOP!,UCt14-hkg-doU6Nej3cb-bTQ,"Dennis Schell 
Pffft! Bitch your time is well on its way fucking bumbs! And if my wife or my people ever suffer it will be because of you terrorists funding scum! But guess what you cuck that will never happen you hypocritical ass wipes! Guess what dumbass you fucks are about to get it strait up your asses and the only ones getting beheaded will be you ignorant twats! So Ill pray for you to receive it fast since you want to call for pain and suffering of other nations!  Karma is a bitch buddy and it is headed your way in a level you will never expect!  And yeah bitch you asked for it for wishing your bullshit beheading comment so enjoy you pussy hurt bitch! I rebuke and send all that you want to happen to hit you back 100 fold! But thats a given since you already have that thought!  So ENJOY you imbecile!","Dennis Schell 
Pffft! Bitch your time is well on its way fucking bumbs! And if my wife or my people ever suffer it will be because of you terrorists funding scum! But guess what you cuck that will never happen you hypocritical ass wipes! Guess what dumbass you fucks are about to get it strait up your asses and the only ones getting beheaded will be you ignorant twats! So Ill pray for you to receive it fast since you want to call for pain and suffering of other nations!  Karma is a bitch buddy and it is headed your way in a level you will never expect!  And yeah bitch you asked for it for wishing your bullshit beheading comment so enjoy you pussy hurt bitch! I rebuke and send all that you want to happen to hit you back 100 fold! But thats a given since you already have that thought!  So ENJOY you imbecile!",0,"2018-04-15 01:15:35","2018-04-15 01:15:35",0,UgzBvfnjxnZnFajqJ2Z4AaABAg
12326,UgzBvfnjxnZnFajqJ2Z4AaABAg.8f090sm4r7G8f2606C_5aY,mkBbFWxLIT8,"Dennis Schell",UCRHFH4Tiht8yI2d54_9z1WQ,"PS: Almost forgot. Enjoy all the moderate muzzies invading your once proud and free country. Hope you arent raped and beheaded. Hope your wife isnt stoned to death. Good luck once again and feel free to call on America to save your pompous hides when all is lost over there...We can handle it! ;-)","PS: Almost forgot. Enjoy all the moderate muzzies invading your once proud and free country. Hope you arent raped and beheaded. Hope your wife isnt stoned to death. Good luck once again and feel free to call on America to save your pompous hides when all is lost over there...We can handle it! ;-)",0,"2018-04-15 00:58:12","2018-04-15 00:58:12",0,UgzBvfnjxnZnFajqJ2Z4AaABAg
12327,UgzBvfnjxnZnFajqJ2Z4AaABAg.8f090sm4r7G8f1i_fzjZYz,mkBbFWxLIT8,POOP!,UCt14-hkg-doU6Nej3cb-bTQ,"Dennis Schell 
Bye Felicia!  Hope Both you libtards and trumptards enjoy killing each other off or sucking each other off you pussy fags! Lol lemme my popcorn!","Dennis Schell 
Bye Felicia!  Hope Both you libtards and trumptards enjoy killing each other off or sucking each other off you pussy fags! Lol lemme my popcorn!",1,"2018-04-14 21:24:44","2018-04-14 21:24:44",0,UgzBvfnjxnZnFajqJ2Z4AaABAg
12328,UgzBvfnjxnZnFajqJ2Z4AaABAg.8f090sm4r7G8f1i-lE1txf,mkBbFWxLIT8,"Dennis Schell",UCRHFH4Tiht8yI2d54_9z1WQ,"Limey libtarded shit for brains...bye! ;-)","Limey libtarded shit for brains...bye! ;-)",0,"2018-04-14 21:19:42","2018-04-14 21:19:42",0,UgzBvfnjxnZnFajqJ2Z4AaABAg
12329,UgzBvfnjxnZnFajqJ2Z4AaABAg.8f090sm4r7G8f1hNyEnGvI,mkBbFWxLIT8,POOP!,UCt14-hkg-doU6Nej3cb-bTQ,"Dennis Schell 
Gods country! ? Bahahahaha! Hey you must of forgotten how much of a bunch of hypocrisy comes out of your country! We are NATO you pussy! We created you and you ask us for help because you cant ever win a fair fight! And that said maybe you should stop funding terrorism like you fucks have fro the past 50 years! Russia has put the ass whooping on isis (U.S. created and funded) in just a few years but the U.S. couldnt even put a dent on it for 20 years! Oh and lets not forget that trump made an arms deal with the Saudis and guess where those weapons will end up! So no bitch fuck you and quit asking for help in your on creation you gullible twats!","Dennis Schell 
Gods country! ? Bahahahaha! Hey you must of forgotten how much of a bunch of hypocrisy comes out of your country! We are NATO you pussy! We created you and you ask us for help because you cant ever win a fair fight! And that said maybe you should stop funding terrorism like you fucks have fro the past 50 years! Russia has put the ass whooping on isis (U.S. created and funded) in just a few years but the U.S. couldnt even put a dent on it for 20 years! Oh and lets not forget that trump made an arms deal with the Saudis and guess where those weapons will end up! So no bitch fuck you and quit asking for help in your on creation you gullible twats!",1,"2018-04-14 21:14:16","2018-04-14 21:14:16",0,UgzBvfnjxnZnFajqJ2Z4AaABAg
12330,Ugz4U5bnzy-c7iKTexd4AaABAg,mkBbFWxLIT8,"Gold Hunter",UCodUm6lLVFAY3DFEJkeuI4Q,"For Trump supporters - like the Who said We wont get fooled again.   Meet the new warmonger - same as the old warmonger.","For Trump supporters - like the Who said We wont get fooled again.   Meet the new warmonger - same as the old warmonger.",12,"2018-04-14 06:45:58","2018-04-14 06:45:58",5,null
12331,Ugz4U5bnzy-c7iKTexd4AaABAg.8f090K31GgQ8f2_QzQpJo6,mkBbFWxLIT8,"Dobs R",UCtPnt5hQkERhncBuvbr4Tsw,"Gold Hunter Hoe is that that war in the middle was already going in s thousand years ago no if Russia attacks the USA then Russia started WW3","Gold Hunter Hoe is that that war in the middle was already going in s thousand years ago no if Russia attacks the USA then Russia started WW3",0,"2018-04-15 05:24:01","2018-04-15 05:24:01",0,Ugz4U5bnzy-c7iKTexd4AaABAg
12332,Ugz4U5bnzy-c7iKTexd4AaABAg.8f090K31GgQ8f2UTDGigb5,mkBbFWxLIT8,"William Burgess",UCCx3Yces8zC0T1-lPnrY5Rg,"Gold Hunter.  This policy was signed by JFK & congress has backed it. Stop blaming President Trump everythime you get a hair across your ass. & this video is total propaganda.","Gold Hunter.  This policy was signed by JFK & congress has backed it. Stop blaming President Trump everythime you get a hair across your ass. & this video is total propaganda.",0,"2018-04-15 04:31:53","2018-04-15 04:31:53",0,Ugz4U5bnzy-c7iKTexd4AaABAg
12333,Ugz4U5bnzy-c7iKTexd4AaABAg.8f090K31GgQ8f29tRFeHkr,mkBbFWxLIT8,"Ricardo Cerna",UCE_p4dv_X9cT4dkZ-6fES1A,"Hope they die are get bomb all trump supporters are racist no life caring other races besides themselves","Hope they die are get bomb all trump supporters are racist no life caring other races besides themselves",0,"2018-04-15 01:32:06","2018-04-15 01:32:06",0,Ugz4U5bnzy-c7iKTexd4AaABAg
12334,Ugz4U5bnzy-c7iKTexd4AaABAg.8f090K31GgQ8f0khKonstL,mkBbFWxLIT8,"es kimo",UCPXNsQwekyZduT7FoMbAtHg,"Gold Hunter i had hopes that were crushed yesterday. Its money, money, money. Its not about kids being killed. Those were crisis actors.","Gold Hunter i had hopes that were crushed yesterday. Its money, money, money. Its not about kids being killed. Those were crisis actors.",0,"2018-04-14 12:24:01","2018-04-14 12:24:01",0,Ugz4U5bnzy-c7iKTexd4AaABAg
12335,Ugz4U5bnzy-c7iKTexd4AaABAg.8f090K31GgQ8f0NbvFlFuQ,mkBbFWxLIT8,"Stuart Crossland",UCAe5qbaIHTYwRIM_aVodMwA,"Its so much deeper than you could imagine.","Its so much deeper than you could imagine.",1,"2018-04-14 08:53:34","2018-04-14 08:53:34",0,Ugz4U5bnzy-c7iKTexd4AaABAg
12336,UgyHZPUbUjx7SBOE65V4AaABAg,mkBbFWxLIT8,"Jeff Watson",UCLlMHkXvaKxCaIiAJFL1Vag,"It started months ago..asswipe","It started months ago..asswipe",0,"2018-04-14 06:45:26","2018-04-14 06:45:26",0,null
12337,UgyZb1lRmlE7BiXAduJ4AaABAg,mkBbFWxLIT8,"Ratha krishnan",UCSmJMXGrqG4aeqBvYy6ZxWg,"Im waiting to see this happen soon...………..welldone putin.whack the world.","Im waiting to see this happen soon...………..welldone putin.whack the world.",0,"2018-04-14 06:44:46","2018-04-14 06:44:46",0,null
12338,UgzP3WAx-lzdE6iWmg14AaABAg,mkBbFWxLIT8,"Azrul Osman",UCBYYOvFQcKMM6JDAjD6AEHg,"gud job mr trump","gud job mr trump",0,"2018-04-14 06:41:15","2018-04-14 06:41:15",0,null
12339,UgzFgWyrrueoblCiSGZ4AaABAg,mkBbFWxLIT8,"RaielYAH Yisrael",UCzv6-_ICRbu8KNYQOVZTVJQ,"Wow looks like the war machineshop are at it again....Why do USA want the whole world....why....are they in every dam country where they want to control.....and kill the people of the lands ....why.....KARMA.....Is coming.....what goes around comes around.
The USA want to bully the world......but change is here and all will fight and many will die....for Greed.....you say we need ...who is we?? ? No Gods in any country .....wrong......your greedy.....and want to kill the entire planet...you will feel the Fury of The Most High...bible says so....
China owns California....did you know......??????","Wow looks like the war machineshop are at it again....Why do USA want the whole world....why....are they in every dam country where they want to control.....and kill the people of the lands ....why.....KARMA.....Is coming.....what goes around comes around.
The USA want to bully the world......but change is here and all will fight and many will die....for Greed.....you say we need ...who is we?? ? No Gods in any country .....wrong......your greedy.....and want to kill the entire planet...you will feel the Fury of The Most High...bible says so....
China owns California....did you know......??????",0,"2018-04-14 06:41:04","2018-04-14 06:41:04",0,null
12340,UgwrQ9-FsFdtorM-36t4AaABAg,mkBbFWxLIT8,"Kyrissaean DragonsFlight",UCPDDsu_pE0rhji1RG_JDxeQ,"dems/illegals only help rich get richer by outsource=mexico plays low inflation/2nd world wages forever,but usa plagued with high living cost=job creation variety dies=social benefits not sustainable","dems/illegals only help rich get richer by outsource=mexico plays low inflation/2nd world wages forever,but usa plagued with high living cost=job creation variety dies=social benefits not sustainable",0,"2018-04-14 06:40:12","2018-04-14 06:40:12",0,null
12341,UgwlBQnDDHDIUf8M6X94AaABAg,mkBbFWxLIT8,"DJ GTO",UCxBHNYgODp3ibysTyNoN_PA,"STOP WITH THE BULL SHIT CLICK BATE REALLY IGNORANT.......","STOP WITH THE BULL SHIT CLICK BATE REALLY IGNORANT.......",1,"2018-04-14 06:39:46","2018-04-14 06:39:46",0,null
12342,UgwiACjOBaFGCBELM394AaABAg,mkBbFWxLIT8,"Tommy Sena",UCgqxrIwOSdhuqIqICBSSMKQ,"America! Drop a bomb! God bless it! Amen!","America! Drop a bomb! God bless it! Amen!",8,"2018-04-14 06:38:26","2018-04-14 06:38:26",0,null
12343,Ugwkreiq93ASteOeA114AaABAg,mkBbFWxLIT8,"DEALWITHIT DREALIST",UCiU613ABZHBc4mdgctpXbBg,"I guess I wont have to return murder on the Orient Express back to Red Box then","I guess I wont have to return murder on the Orient Express back to Red Box then",0,"2018-04-14 06:38:16","2018-04-14 06:38:16",0,null
12344,UgwBhxAneZgSkIKVzzR4AaABAg,mkBbFWxLIT8,"Tommy Sena",UCgqxrIwOSdhuqIqICBSSMKQ,"You Go! America!! Land of the free and the brave..  America! This bitch dont play! And yes! Lord!  I pray for america! May God change his mind and ♥","You Go! America!! Land of the free and the brave..  America! This bitch dont play! And yes! Lord!  I pray for america! May God change his mind and ♥",0,"2018-04-14 06:37:15","2018-04-14 06:37:15",0,null
12345,UgzN6wB-wAdiognj5OR4AaABAg,mkBbFWxLIT8,"Sören Nilsson",UCgVNd_zddRhFKJZ7wgaUX-Q,"An idiotic headline, the WW III is not even close start. Use some logic and you will see why the closest the world has been to WW III is the Cuba crisis and we are miles away from such a tense moment. One is grateful that neither Trump nor Putin was in power during those days because if they would have been we would not exist today.","An idiotic headline, the WW III is not even close start. Use some logic and you will see why the closest the world has been to WW III is the Cuba crisis and we are miles away from such a tense moment. One is grateful that neither Trump nor Putin was in power during those days because if they would have been we would not exist today.",6,"2018-04-14 06:35:22","2018-04-14 06:35:22",6,null
12346,UgzN6wB-wAdiognj5OR4AaABAg.8f07nd3UiC68f70XOzTJoq,mkBbFWxLIT8,Ronaldreganfan,UCnMQFrfWvmx06eJZ5qcST9w,"Sören Nilsson   We would probably be stronger it it had . HOOYA !!!","Sören Nilsson   We would probably be stronger it it had . HOOYA !!!",0,"2018-04-16 22:46:31","2018-04-16 22:46:31",0,UgzN6wB-wAdiognj5OR4AaABAg
12347,UgzN6wB-wAdiognj5OR4AaABAg.8f07nd3UiC68f2m8Y-thWq,mkBbFWxLIT8,"oliver vella",UCq7Nmnuj5vxNe57e1LEwaDQ,"Andrew and Izzy gaming 
Cold or hot it will come to us too eventually and by the looks of things it might be soon","Andrew and Izzy gaming 
Cold or hot it will come to us too eventually and by the looks of things it might be soon",0,"2018-04-15 07:15:05","2018-04-15 07:15:05",0,UgzN6wB-wAdiognj5OR4AaABAg
12348,UgzN6wB-wAdiognj5OR4AaABAg.8f07nd3UiC68f2k_rPcL9U,mkBbFWxLIT8,"Andrew and Izzy gaming",UCdJWEPeipx3tKZ4ZTxd3qMA,"Sören Nilsson exactly its a cold war again","Sören Nilsson exactly its a cold war again",0,"2018-04-15 07:01:29","2018-04-15 07:01:29",0,UgzN6wB-wAdiognj5OR4AaABAg
12349,UgzN6wB-wAdiognj5OR4AaABAg.8f07nd3UiC68f2hL5x1o6T,mkBbFWxLIT8,"oliver vella",UCq7Nmnuj5vxNe57e1LEwaDQ,"Sören Nilsson 
Just because it didnt happen last time doesnt mean its not gona happen this time and to believe it wont happen in our lifetime with all thats been going on then your in denial. Too much is going on ,
even the Bibles prophecies are being furfilled.","Sören Nilsson 
Just because it didnt happen last time doesnt mean its not gona happen this time and to believe it wont happen in our lifetime with all thats been going on then your in denial. Too much is going on ,
even the Bibles prophecies are being furfilled.",0,"2018-04-15 06:33:07","2018-04-15 06:33:07",0,UgzN6wB-wAdiognj5OR4AaABAg
12350,UgzN6wB-wAdiognj5OR4AaABAg.8f07nd3UiC68f0PX5fmmj1,mkBbFWxLIT8,"Sören Nilsson",UCgVNd_zddRhFKJZ7wgaUX-Q,"We have five problems.
1.Tthe USA is not at war with Syria so an alteration of the situation would demand that a state of war is declared. 
2.Trump is reluctant to send troops to Syria and what little troops there are, he plans to take home.
3. North Korea forces him to keep the larger part of military resources in reserve, he has to maintain freedom of action with most of them.
4. Russia and Iran.
5. Asad is not a good person but there are worse standing in line to take over.","We have five problems.
1.Tthe USA is not at war with Syria so an alteration of the situation would demand that a state of war is declared. 
2.Trump is reluctant to send troops to Syria and what little troops there are, he plans to take home.
3. North Korea forces him to keep the larger part of military resources in reserve, he has to maintain freedom of action with most of them.
4. Russia and Iran.
5. Asad is not a good person but there are worse standing in line to take over.",1,"2018-04-14 09:10:15","2018-04-14 09:10:15",0,UgzN6wB-wAdiognj5OR4AaABAg
12351,UgyTrbZNK5EzYiF1P4R4AaABAg,mkBbFWxLIT8,"Dennis Madigan",UC4tb3L8WcFIZ-HXg7w9Cg8A,"Russia isnt going to do a damn thing.","Russia isnt going to do a damn thing.",0,"2018-04-14 06:34:01","2018-04-14 06:34:01",1,null
12352,UgyTrbZNK5EzYiF1P4R4AaABAg.8f07dmEpVZV8f0CPmVU3Db,mkBbFWxLIT8,AzraelPercussionNEO,UC3kebStK_kTLI6cXbWbgSIw,"Dennis Madigan Honestly I totally agree with you...but at the same time I hope shit doesnt hit the fan.","Dennis Madigan Honestly I totally agree with you...but at the same time I hope shit doesnt hit the fan.",0,"2018-04-14 07:15:39","2018-04-14 07:15:39",0,UgyTrbZNK5EzYiF1P4R4AaABAg
12353,UgzXrmlHup7KyBIZcKR4AaABAg,mkBbFWxLIT8,"Xtrack TV",UCHw5va675G-c-ZXuZmX4xYA,https://youtu.be/JK9F_gVUq7A,https://youtu.be/JK9F_gVUq7A,0,"2018-04-14 06:33:44","2018-04-14 06:33:44",0,null
12354,UgyB_JmcZ2L-bNIO51R4AaABAg,mkBbFWxLIT8,"Fabian Rojas",UCAzjzYfnLy8lTogbpGP7Cng,Blyat,Blyat,0,"2018-04-14 06:33:01","2018-04-14 06:33:01",2,null
12355,UgyB_JmcZ2L-bNIO51R4AaABAg.8f07XRbg8I_8f0AAHm9JrO,mkBbFWxLIT8,"Cranium Therapy",UCwHhjTTT0QvfhojalGvBA7w,"Fabian Rojas Blythe","Fabian Rojas Blythe",1,"2018-04-14 06:56:04","2018-04-14 06:56:04",0,UgyB_JmcZ2L-bNIO51R4AaABAg
12356,UgyB_JmcZ2L-bNIO51R4AaABAg.8f07XRbg8I_8f08NsxtFQJ,mkBbFWxLIT8,RadicalGreekBeard,UCiz4Bcp8qxn4Hki7wYoAu-A,"Fabian Rojas 
Cyka","Fabian Rojas 
Cyka",1,"2018-04-14 06:40:27","2018-04-14 06:40:27",0,UgyB_JmcZ2L-bNIO51R4AaABAg
12357,Ugw8KL4jpLjDZqylEM94AaABAg,mkBbFWxLIT8,"BANES WORLD",UCNr5ltQ248bfRSrtekxLTrg,"Brb i forgot to flush my putin .","Brb i forgot to flush my putin .",14,"2018-04-14 06:32:26","2018-04-14 06:32:26",8,null
12358,Ugw8KL4jpLjDZqylEM94AaABAg.8f07TAoq0ef8f4YppDm0bG,mkBbFWxLIT8,"keith ochs",UCPqYRgNKYnnOq3SEn4Mi1ag,"Go on with your bullshit videos. Shit for brains","Go on with your bullshit videos. Shit for brains",0,"2018-04-15 23:48:33","2018-04-15 23:48:33",0,Ugw8KL4jpLjDZqylEM94AaABAg
12359,Ugw8KL4jpLjDZqylEM94AaABAg.8f07TAoq0ef8f40n4JK0Vk,mkBbFWxLIT8,"Jess Bess",UCKyT7tS79FxmYZZ1Yp3Ocvg,"BANES WORLD.    Je peux te le dire en français.   Tu peux jeter ta poutine. Les Américains ont le records des plus gros culs. 
Là cest plus clair?  Si tas pas compris tu peux faire traduire ou améliorer ton sort en apprenant le français. 
NOW ITS OK?","BANES WORLD.    Je peux te le dire en français.   Tu peux jeter ta poutine. Les Américains ont le records des plus gros culs. 
Là cest plus clair?  Si tas pas compris tu peux faire traduire ou améliorer ton sort en apprenant le français. 
NOW ITS OK?",0,"2018-04-15 18:51:05","2018-04-15 18:52:11",0,Ugw8KL4jpLjDZqylEM94AaABAg
12360,Ugw8KL4jpLjDZqylEM94AaABAg.8f07TAoq0ef8f2NwoKPtCq,mkBbFWxLIT8,"BANES WORLD",UCNr5ltQ248bfRSrtekxLTrg,"Jesus Chavez you must be a dreamer afraid of being deported.","Jesus Chavez you must be a dreamer afraid of being deported.",2,"2018-04-15 03:34:54","2018-04-15 03:34:54",0,Ugw8KL4jpLjDZqylEM94AaABAg
12361,Ugw8KL4jpLjDZqylEM94AaABAg.8f07TAoq0ef8f2NnUcW1F7,mkBbFWxLIT8,"BANES WORLD",UCNr5ltQ248bfRSrtekxLTrg,"Jess Bess youre comment needs some major work","Jess Bess youre comment needs some major work",1,"2018-04-15 03:33:38","2018-04-15 03:33:38",0,Ugw8KL4jpLjDZqylEM94AaABAg
12362,Ugw8KL4jpLjDZqylEM94AaABAg.8f07TAoq0ef8f2N50EKx_H,mkBbFWxLIT8,"Jesus Chavez",UCYLtCcqLXHLK4ee-4ESeT4Q,"Watch Putin Defeat American","Watch Putin Defeat American",0,"2018-04-15 03:27:25","2018-04-15 03:27:25",0,Ugw8KL4jpLjDZqylEM94AaABAg
12363,UgymOu1NDk6Vk7DAf0l4AaABAg,mkBbFWxLIT8,"Ruben Zuniga",UC-jBriZMUHjHVYzX9UAhiYg,"Wait the natos jet was tailing them? So did that jet have a nuke on it or wa? Im confused","Wait the natos jet was tailing them? So did that jet have a nuke on it or wa? Im confused",1,"2018-04-14 06:31:38","2018-04-14 06:31:38",0,null
12364,UgyNs8MtCPJY6cBj8gx4AaABAg,mkBbFWxLIT8,TheImperial333,UC_O5tGNPNh3jj8MvfcF3UvA,"Well let be start war 3.  the devlis they will  kill each other","Well let be start war 3.  the devlis they will  kill each other",0,"2018-04-14 06:31:30","2018-04-14 06:31:30",0,null
12365,UgzH52p2UGP-1OjDNLh4AaABAg,mkBbFWxLIT8,"Stan M",UCAyp7RSMf_UCr5TFq5lYscA,"RT likes chemical attacks They will go to war to keep them","RT likes chemical attacks They will go to war to keep them",1,"2018-04-14 06:30:32","2018-04-14 06:30:32",1,null
12366,UgzH52p2UGP-1OjDNLh4AaABAg.8f07FHDN5J_8f1yqHvlICb,mkBbFWxLIT8,"camba man512",UCFbDJxfR_aePt5JwDnjKN3g,"to keep  your  ass","to keep  your  ass",0,"2018-04-14 23:46:49","2018-04-14 23:46:49",0,UgzH52p2UGP-1OjDNLh4AaABAg
12367,UgxE3MgtYGNnf4bFxsV4AaABAg,mkBbFWxLIT8,"Ramon Nadales",UCXeYOyk8to-5ZqrOMZDJQzw,"A psychopath will send this country to nuclear war. ,sell everything and run away soon","A psychopath will send this country to nuclear war. ,sell everything and run away soon",6,"2018-04-14 06:30:18","2018-04-14 06:30:18",1,null
12368,UgxE3MgtYGNnf4bFxsV4AaABAg.8f07DYjUJqK8f0JvEXIQUx,mkBbFWxLIT8,"jom_ aca",UC0ACZk5VnmbfXMhpTcjZFdw,"Ramon Nadales drug all Mexicans and illehal immigrans","Ramon Nadales drug all Mexicans and illehal immigrans",0,"2018-04-14 08:21:15","2018-04-14 08:21:15",0,UgxE3MgtYGNnf4bFxsV4AaABAg
12369,UgzGM3YorMUHZ-bFYX54AaABAg,mkBbFWxLIT8,"Mike Conlin",UCg0FFGVYua265SvqwqWiVkg,"Really? Trump started ww3?  get your facts straight Dick-- then cancel your account","Really? Trump started ww3?  get your facts straight Dick-- then cancel your account",4,"2018-04-14 06:29:35","2018-04-14 06:29:35",0,null
12370,UgxW9Lau2DE107o2eDN4AaABAg,mkBbFWxLIT8,"YaFav Goon",UCDhESS5WPpe9qCTukH1nJ5A,"Whole lotta gang shit nigga ?? trump  did the right thing now we  need to kill these cracker russians","Whole lotta gang shit nigga ?? trump  did the right thing now we  need to kill these cracker russians",0,"2018-04-14 06:28:36","2018-04-14 06:28:36",0,null
