id,comment_id,video_id,commenter_name,commenter_id,comment_displayed,comment_original,likes,published_date,updated_date,total_replies,replyto
12251,UgwPbaYbAl0rT6rAhnR4AaABAg,mkBbFWxLIT8,"Marina Borovinskaya",UC8VNnG2DW5hy6n1gkINjmYA,"Mr British foreign minister, you talk about international law!! Just repeat that word number of times to with no international mandate and you call yourself law-abiding nation? And you are calling Russia as a threat to the international peace. You and your country including America and France are threat to the national security and peace and try quality around the globe. You people are nothing other than international thugs trying to grab other peoples resources for your own nation.","Mr British foreign minister, you talk about international law!! Just repeat that word number of times to with no international mandate and you call yourself law-abiding nation? And you are calling Russia as a threat to the international peace. You and your country including America and France are threat to the national security and peace and try quality around the globe. You people are nothing other than international thugs trying to grab other peoples resources for your own nation.",2,"2018-04-14 18:33:16","2018-04-14 18:33:16",0,null
12252,Ugww62bAuPRIJjk9Zp94AaABAg,mkBbFWxLIT8,"Kizzy Kaye",UCBiQvbz02388KJXOjS-69vQ,"This is biblical. USA is not in the final battle to the point that God steps in and defends Israel when the whole world attacks it. USA is most likely Mystery Babylon acting more like Sodom and Gomorrah these days and removing God from everything. God has protected USA in the past. Mystery Babylon is destroyed in one hour by fire. The previous administration reduced our military while Russia and China built theirs up. We are screwed in the USA. Prediction: Russia will attack the east coast and China will attack the west coast. All we can do is ask Jesus to forgive us and repent. America’s fate was sealed with passing the tranny laws, and removing God from everything.","This is biblical. USA is not in the final battle to the point that God steps in and defends Israel when the whole world attacks it. USA is most likely Mystery Babylon acting more like Sodom and Gomorrah these days and removing God from everything. God has protected USA in the past. Mystery Babylon is destroyed in one hour by fire. The previous administration reduced our military while Russia and China built theirs up. We are screwed in the USA. Prediction: Russia will attack the east coast and China will attack the west coast. All we can do is ask Jesus to forgive us and repent. America’s fate was sealed with passing the tranny laws, and removing God from everything.",0,"2018-04-14 17:35:52","2018-04-14 17:40:03",0,null
12253,Ugx4ZK4uyq5dbYcu7id4AaABAg,mkBbFWxLIT8,"Tom Beller",UCqpreI7gprfRy6WH3ipfWfQ,"JOHN KERRY WAS ALSO A SECRETARY OF STATE WITH THE LIKES OF CROOKED HILLARYS TIME IN OFFICE OF PAY TO PLAY SELLING OFF AMERICA ONE SELF-SERVING TREASOUS ENRICHMENT OF GREED FOR THEMSELVES AT A TIME. KERRY COMES BACK FROM IRAN CLAIMS TO NOT HAVE READ OR KNOWS WHAT WAS IN THE DEAL HE JUST DID FOR BARRY THE FORGERS  UNCONSTITUTIONAL NON-AMERICAN ILLEGAL ALIEN FORGED EVERYTHING ASS PRESIDENT. PLEASE ENOUGH OF THIS LAWLESS SHIT SHOW MOCKERY TO EVERY FUCKEN AMERICAN AND THE CONSTITUTIONAL LAWS OF OUR SOVEREIGN REPUBLIC THAT IS BEING LOOTED AND STOLEN RIGHT BEFORE OUR EYES. ENOUGH SAID WE THE PEOPLE OF THE UNITED STATES OF AMERICA WILL NOT LET THIS LAWLESS SHIT SHOW MOCKERY TO AMERICA TO PREVAIL PERIOD","JOHN KERRY WAS ALSO A SECRETARY OF STATE WITH THE LIKES OF CROOKED HILLARYS TIME IN OFFICE OF PAY TO PLAY SELLING OFF AMERICA ONE SELF-SERVING TREASOUS ENRICHMENT OF GREED FOR THEMSELVES AT A TIME. KERRY COMES BACK FROM IRAN CLAIMS TO NOT HAVE READ OR KNOWS WHAT WAS IN THE DEAL HE JUST DID FOR BARRY THE FORGERS  UNCONSTITUTIONAL NON-AMERICAN ILLEGAL ALIEN FORGED EVERYTHING ASS PRESIDENT. PLEASE ENOUGH OF THIS LAWLESS SHIT SHOW MOCKERY TO EVERY FUCKEN AMERICAN AND THE CONSTITUTIONAL LAWS OF OUR SOVEREIGN REPUBLIC THAT IS BEING LOOTED AND STOLEN RIGHT BEFORE OUR EYES. ENOUGH SAID WE THE PEOPLE OF THE UNITED STATES OF AMERICA WILL NOT LET THIS LAWLESS SHIT SHOW MOCKERY TO AMERICA TO PREVAIL PERIOD",0,"2018-04-14 16:05:26","2018-04-14 16:05:26",0,null
12254,UgxP0OuNT8F0dOWLt754AaABAg,mkBbFWxLIT8,"Donna Taliercio",UCsX8Y3bYDJAzMp9EWzZPxCQ,"CHINA?  MILLIONS! THEY COULD WALK ACROSS AMERICA  AND LEAVE A MARK?","CHINA?  MILLIONS! THEY COULD WALK ACROSS AMERICA  AND LEAVE A MARK?",0,"2018-04-14 14:58:13","2018-04-14 14:58:13",0,null
12255,UgzgzLnQ5plYNIYwX2B4AaABAg,mkBbFWxLIT8,"Annmarie Mckenzie",UC5Dzcmldz6MSJOYgESEv-IQ,"What the FUCK ARE WRONG WITH THESE PEOPLE!!! NUCLEAR  WEAPONS  , NUCLEAR  WAR TO END ALL THINGS WHERE IS YOUR BRAINS KILLING THE CLIMATE DO U THINK YOU ARE GODS YOU DONT OWN THIS WORLD WHAT ABOUT HUMANITY? ?????","What the FUCK ARE WRONG WITH THESE PEOPLE!!! NUCLEAR  WEAPONS  , NUCLEAR  WAR TO END ALL THINGS WHERE IS YOUR BRAINS KILLING THE CLIMATE DO U THINK YOU ARE GODS YOU DONT OWN THIS WORLD WHAT ABOUT HUMANITY? ?????",0,"2018-04-14 14:13:17","2018-04-14 14:13:17",0,null
12256,Ugw2sK2z7sW57HmOxiV4AaABAg,mkBbFWxLIT8,"dog of war",UCFLxMCh6ul5yQUrwriIIrvg,"Putin and China very very quiet!! They planning something. Be prepared for repercussions Americans U.K. France. When a leader/leaders aint on tv or showing anything somthing is going on.thats what Japanese did and pearl harbour happened.","Putin and China very very quiet!! They planning something. Be prepared for repercussions Americans U.K. France. When a leader/leaders aint on tv or showing anything somthing is going on.thats what Japanese did and pearl harbour happened.",0,"2018-04-14 13:31:04","2018-04-14 13:33:34",0,null
12257,UgwQ2rzlHHgbgfRsMit4AaABAg,mkBbFWxLIT8,"Milos Stanojevic",UC0zlQeKpTfqbsblhgxUWqcQ,"U nited  S hit  A lloround  ! ! !   Dirty  cowboys hawe right  in Chines  sea ? ! ? ! ? ! ? !","U nited  S hit  A lloround  ! ! !   Dirty  cowboys hawe right  in Chines  sea ? ! ? ! ? ! ? !",0,"2018-04-14 13:06:05","2018-04-14 13:49:18",0,null
12258,Ugx2iXV9MnbNnqFJkKJ4AaABAg,mkBbFWxLIT8,SOTHISISDEMOCRACY,UCIreglA2pnoosm5OIK5lSMA,"thats what  you  get when you  vote a  moron who says  hes   the  most  militaristic  guy  in the room","thats what  you  get when you  vote a  moron who says  hes   the  most  militaristic  guy  in the room",0,"2018-04-14 13:02:16","2018-04-14 13:02:16",0,null
12259,UgzjGAe2pRD6XQXeS0J4AaABAg,mkBbFWxLIT8,"es kimo",UCPXNsQwekyZduT7FoMbAtHg,"They gonna kill Assad!","They gonna kill Assad!",0,"2018-04-14 12:21:32","2018-04-14 12:21:32",0,null
12260,Ugy_l0V1-UpG618PkR94AaABAg,mkBbFWxLIT8,"fedjov mochavz",UCNQGUyb1AAB4FQbmvDmxcgw,"Alert alert alert .....there is Virus Attack on your Mind....lol","Alert alert alert .....there is Virus Attack on your Mind....lol",0,"2018-04-14 12:05:59","2018-04-14 12:05:59",0,null
12261,Ugx6T5dSqGI2hOEa5ld4AaABAg,mkBbFWxLIT8,"Martin Metz",UCs92f7xMloz9KbvQO81zr_Q,"Alert, WW2 started. How wonderful. Wonderfully nothing learned from WW1 & WW2.  Just wanting to make other peoples life a hell.  How about cleaning  in and around Los fallen Angeles and politics?","Alert, WW2 started. How wonderful. Wonderfully nothing learned from WW1 & WW2.  Just wanting to make other peoples life a hell.  How about cleaning  in and around Los fallen Angeles and politics?",0,"2018-04-14 10:36:17","2018-04-14 10:36:17",0,null
12262,UgxMnpd-sC7MnecM76N4AaABAg,mkBbFWxLIT8,"MIlan Josifoski",UCGZQ0Ply21SPwZDbVt4kqzg,"There’s new Hitler now who dose what hi wants","There’s new Hitler now who dose what hi wants",0,"2018-04-14 09:48:40","2018-04-14 09:48:40",0,null
12263,Ugz-kwzRoSDBJVmv2ch4AaABAg,mkBbFWxLIT8,"Eduardo Bailon",UCyoWfMqyfkn2CEH1LgvrKwQ,"Creo que es precipitado el decir que la 3 guerra mundial ha comenzado.Un poco más de rigor estaría bien.Un saludo!!.","Creo que es precipitado el decir que la 3 guerra mundial ha comenzado.Un poco más de rigor estaría bien.Un saludo!!.",0,"2018-04-14 09:47:27","2018-04-14 09:47:27",0,null
12264,Ugy7L313FXnymCBWbXB4AaABAg,mkBbFWxLIT8,"ASHOK KURIAN",UC6DgDzDQv8IlQCWRUYoawkw,"World war 3 has come and gone with the wind
Now we are back to the negotiating table","World war 3 has come and gone with the wind
Now we are back to the negotiating table",0,"2018-04-14 09:36:09","2018-04-14 09:36:09",0,null
12265,UgwB1Cu8-mg2ftKgnYV4AaABAg,mkBbFWxLIT8,"Chas Peking",UC9C4ZLZbFWokf6S5uUfkBxw,"Trump is doing it to get Russia, China and the U.S. to destroy each other leaving the BRITISH EMPIRE ON TOP.","Trump is doing it to get Russia, China and the U.S. to destroy each other leaving the BRITISH EMPIRE ON TOP.",0,"2018-04-14 09:29:20","2018-04-14 09:29:20",0,null
12266,UgwzN9ALvZHs1syMV6R4AaABAg,mkBbFWxLIT8,"Mohd Azam Abdullah",UCFXUVa4jhcgHgH2Aw465Cog,"You all are abunch of fools.this is not the way to rule the world.opressor....","You all are abunch of fools.this is not the way to rule the world.opressor....",0,"2018-04-14 09:28:40","2018-04-14 09:28:40",0,null
12267,UgxNmpRYVLIEVhdoy0B4AaABAg,mkBbFWxLIT8,"Glenn parent",UCmrhgGM6uiMq28U4b62Zfuw,"good luck feeding the people in the inspace station","good luck feeding the people in the inspace station",0,"2018-04-14 09:23:19","2018-04-14 09:23:19",0,null
12268,UgxMkAZyf1Gs_onZ2Ql4AaABAg,mkBbFWxLIT8,"Glenn parent",UCmrhgGM6uiMq28U4b62Zfuw,"nuke london -paris and new york","nuke london -paris and new york",0,"2018-04-14 09:20:54","2018-04-14 09:20:54",0,null
12269,Ugy6qzIQWvRNFdQ22U54AaABAg,mkBbFWxLIT8,"WiiZoX San",UCw92pqyNrpRgEaLFoD6xT5w,"AND THEY DONT CHOICE THE WAY OF SALVATION LIKE IS WRIT IN THE PROFECY . NOW EVERY ONE KNOW : THAN THE NATIONS WHO SAY WE ARE DEMOCRATIES; ARE NOT THE TRUE DEMOCRATIES, BUT THE REAL DEMON-CRATIES CAUSE THEY DON T PRACTISE FROM THE BEGININ WHAT THEY PREACH LIKE EVERY ONE CAN SEE TODAY . BUT IN THE PROFECY ITS ALSO WRIT : THE TRAGIC END OF THE BEAST WITH 7 HEADS AND 10 HORNS . PRAISE THE LORD AND REMENBER : MATTHIEU  7 : 13 . J - CHRIST. C","AND THEY DONT CHOICE THE WAY OF SALVATION LIKE IS WRIT IN THE PROFECY . NOW EVERY ONE KNOW : THAN THE NATIONS WHO SAY WE ARE DEMOCRATIES; ARE NOT THE TRUE DEMOCRATIES, BUT THE REAL DEMON-CRATIES CAUSE THEY DON T PRACTISE FROM THE BEGININ WHAT THEY PREACH LIKE EVERY ONE CAN SEE TODAY . BUT IN THE PROFECY ITS ALSO WRIT : THE TRAGIC END OF THE BEAST WITH 7 HEADS AND 10 HORNS . PRAISE THE LORD AND REMENBER : MATTHIEU  7 : 13 . J - CHRIST. C",0,"2018-04-14 09:07:18","2018-04-14 09:07:18",0,null
12270,Ugz8QtQiCirz6oGYX7l4AaABAg,mkBbFWxLIT8,"JD faz",UCMhT5H-QV5aznkAnj2BKeng,"If china and russia attack usa l think usa will be totally destoryed","If china and russia attack usa l think usa will be totally destoryed",0,"2018-04-14 09:04:07","2018-04-14 09:04:07",0,null
12271,Ugx-JMiApIM5ceh1IXB4AaABAg,mkBbFWxLIT8,phloridababe,UCD06gBDsjxBgNVlKUWqbQgg,"Stop being a fear monger.","Stop being a fear monger.",0,"2018-04-14 09:02:19","2018-04-14 09:02:19",0,null
12272,Ugy1wn2h9wrAMaQSpyZ4AaABAg,mkBbFWxLIT8,"GRACE ALVAREZ",UCGOfH6j7y1XZvZ7k8gIhOwg,"this is an old news...WTF","this is an old news...WTF",0,"2018-04-14 08:54:45","2018-04-14 08:54:45",0,null
12273,UgzDsiw4zW9NSwE-vwp4AaABAg,mkBbFWxLIT8,"GRACE ALVAREZ",UCGOfH6j7y1XZvZ7k8gIhOwg,"Lord,please dont let this happen...we are your children.","Lord,please dont let this happen...we are your children.",0,"2018-04-14 08:51:29","2018-04-14 08:51:29",0,null
12274,UgwsLpWdF_6Rot6WTTF4AaABAg,mkBbFWxLIT8,"Godless Powers",UCU6cqyHgOrbL2-H-gW95QyA,"Now this is Ilegal,Time to put the BOOT down on China.","Now this is Ilegal,Time to put the BOOT down on China.",0,"2018-04-14 08:38:04","2018-04-14 08:38:04",0,null
12275,UgzFDvxCHu_8d3ilA654AaABAg,mkBbFWxLIT8,"Paul d",UCrD3LF31NDDjhWdng8IOoag,"If the rev 12 sign heralds the start of the Trib. APRIL 30th 2018. 220 days from the start of the Tribulation. (wars and rumours) until the daily sacrifice is taken away Daniel 8:14.... 2300 Days both the sanctuary and the host will be trodden under foot? What is the daily sacrifice, any-one Know ????????","If the rev 12 sign heralds the start of the Trib. APRIL 30th 2018. 220 days from the start of the Tribulation. (wars and rumours) until the daily sacrifice is taken away Daniel 8:14.... 2300 Days both the sanctuary and the host will be trodden under foot? What is the daily sacrifice, any-one Know ????????",0,"2018-04-14 08:16:09","2018-04-14 08:16:09",0,null
12276,UgxyD-YqrXNc2mhwRbJ4AaABAg,mkBbFWxLIT8,"Χαραλαμπος Στρογγυλος",UCoERPnpV4hf_tVqJ6juLycA,"E I freaks way you dont go to do your war masturbation on mars and not on our earth . Your savage monkey attitude is not for civilized world. You consume sow many drags that you she enemies everywhere and you have wrong. You are the reason to have enemies because you created them with your politics. Do you thing that now Syrian people will see you like liberators  you are lunatic and insane I have told it all ready to many drags","E I freaks way you dont go to do your war masturbation on mars and not on our earth . Your savage monkey attitude is not for civilized world. You consume sow many drags that you she enemies everywhere and you have wrong. You are the reason to have enemies because you created them with your politics. Do you thing that now Syrian people will see you like liberators  you are lunatic and insane I have told it all ready to many drags",0,"2018-04-14 08:15:14","2018-04-14 08:15:14",0,null
12277,UgxWXJKEp6SEosW43RZ4AaABAg,mkBbFWxLIT8,"Charlie Thompson",UCW8-hsv79_FMH0SkOi5y1RA,"well shit","well shit",0,"2018-04-14 07:52:13","2018-04-14 07:52:13",0,null
12278,UgxXw0-4JMLa2RMBJhp4AaABAg,mkBbFWxLIT8,"We are IF",UCSEEg7EXS0L2sOQLMFGyT-A,"ww3 has now gone hot!!","ww3 has now gone hot!!",0,"2018-04-14 07:48:09","2018-04-14 07:48:09",0,null
12279,Ugzd5IKUj6rpLjXNP4R4AaABAg,mkBbFWxLIT8,"tim wathen",UCQGX-ywenHX8jQNx7kNU0cA,"ALL YOU DUMB SHITS WITH BIG MOUTHS SHUT THE FUCK UP. THIS IS TOTAL DESTRUCTION OF THE WORLD. ALL THE EARTHQUAKES AND VOLCANOES LETS LET THE NUKES FLY, AND I AM SURE WE CAN DESTROY PLANET EARTH AND ALL THOSE IN THE BUNKERS AS WELL. THE NUCLEAR WINTER WILL KILL ALL MANKIND. BOYS WITH TOYS, STAND DOWN, NOT WORTH KILLING US ALL OVER PENIS ENVY.","ALL YOU DUMB SHITS WITH BIG MOUTHS SHUT THE FUCK UP. THIS IS TOTAL DESTRUCTION OF THE WORLD. ALL THE EARTHQUAKES AND VOLCANOES LETS LET THE NUKES FLY, AND I AM SURE WE CAN DESTROY PLANET EARTH AND ALL THOSE IN THE BUNKERS AS WELL. THE NUCLEAR WINTER WILL KILL ALL MANKIND. BOYS WITH TOYS, STAND DOWN, NOT WORTH KILLING US ALL OVER PENIS ENVY.",0,"2018-04-14 07:47:05","2018-04-14 07:47:05",0,null
12280,UgxecjpdMWo_ixykZh14AaABAg,mkBbFWxLIT8,Virgo,UChGoErvRyWDICdJCB9wJEig,"RUSSIA AND CHINA ARE CONTROLLED BY ZIONISTS TOO","RUSSIA AND CHINA ARE CONTROLLED BY ZIONISTS TOO",0,"2018-04-14 07:46:32","2018-04-14 07:46:32",0,null
12281,UgyV6d4Bh-5uCED6V_F4AaABAg,mkBbFWxLIT8,"Tha RealNizz",UCqwtriJTA_fiBr5uPeNxBvQ,"Trump got balls!!!! i dont like him as our commanderan chief ,but this is one of the things i am glad he has done to let russia and china and who ever else is with them know ,we READY no time for games cuz game over.","Trump got balls!!!! i dont like him as our commanderan chief ,but this is one of the things i am glad he has done to let russia and china and who ever else is with them know ,we READY no time for games cuz game over.",0,"2018-04-14 07:36:45","2018-04-14 07:36:45",0,null
12282,Ugy1wXN_V6hpXJVsmD94AaABAg,mkBbFWxLIT8,"wayne mortell",UCp_Q1ovPhxJttGCsx58l78Q,"fuck him up.","fuck him up.",0,"2018-04-14 07:35:19","2018-04-14 07:35:19",0,null
12283,UgyLauS5U-1OUlsrN8x4AaABAg,mkBbFWxLIT8,"Kalle Kakkula",UCEuXLxZVGv1cFZ4gI2e-_aA,"Oh no this poor little nice Putin boy","Oh no this poor little nice Putin boy",0,"2018-04-14 07:26:36","2018-04-14 07:26:36",0,null
12284,Ugxtw7w9tzAfCUKsvbp4AaABAg,mkBbFWxLIT8,"just a guy",UCIBhMpmSLrXph7VEvWdObIw,"RT is full of shit russian propaganda","RT is full of shit russian propaganda",0,"2018-04-14 07:24:05","2018-04-14 07:24:05",0,null
12285,UgxR0ApnBWeT_oyS9sx4AaABAg,mkBbFWxLIT8,"Brittany Laws",UCNgJ1Z4XAX9FdZvO0bpoNvw,"Here we go again!!!","Here we go again!!!",0,"2018-04-14 07:23:16","2018-04-14 07:23:16",0,null
12286,UgzAU24UiBb1tYXDfIN4AaABAg,mkBbFWxLIT8,"crazeeavery XVII",UCIg812kG_e3yA7A_N_A30xQ,"Really video from Russian TV?","Really video from Russian TV?",0,"2018-04-14 07:20:43","2018-04-14 07:20:43",0,null
12287,UgxKsgMbMaiKHuI7zml4AaABAg,mkBbFWxLIT8,"Michael Solomon",UC2CO1SNKxBWscBtZz8QcyJQ,"What a dumbass you are...","What a dumbass you are...",0,"2018-04-14 07:16:17","2018-04-14 07:16:17",0,null
12288,UgylSURaS4SLUx-5Ksx4AaABAg,mkBbFWxLIT8,artyrad,UC0gYf02mJKYdgvDlCI3r8mA,"same shit as last year and the year before then so its pathetic to think its ww3","same shit as last year and the year before then so its pathetic to think its ww3",0,"2018-04-14 07:16:04","2018-04-14 07:16:04",0,null
12289,Ugxo-0JDgcl9bBXFxKl4AaABAg,mkBbFWxLIT8,"Gordon Welford",UCc7s_2SXaoRUhry_UYirKqg,"CLICKBAIT SHIT!","CLICKBAIT SHIT!",0,"2018-04-14 07:15:12","2018-04-14 07:15:12",0,null
12290,UgzrLLyNjPiuAljUoZN4AaABAg,mkBbFWxLIT8,"Max Foam",UCvPx91iID0Rgz4FpXVkxXsQ,"World wars tend to pull country’s out of a shitty economy remind people to live in there means decrease population and set new tracks for unbelievable future problems maybe this is what the world need to smarten up. Hopefully Trudeau bitches out and sells out to trump ?","World wars tend to pull country’s out of a shitty economy remind people to live in there means decrease population and set new tracks for unbelievable future problems maybe this is what the world need to smarten up. Hopefully Trudeau bitches out and sells out to trump ?",0,"2018-04-14 07:12:31","2018-04-14 07:12:31",0,null
12291,UgwWvBpYR1Au52x-Wu94AaABAg,mkBbFWxLIT8,"HIVE KILLER",UCagp80tGgpaFH6Lv33pDD8A,"U.S.A U.S.A U.S.A stand with us or bow to our enemies I rather die for my soil and stand tall","U.S.A U.S.A U.S.A stand with us or bow to our enemies I rather die for my soil and stand tall",0,"2018-04-14 07:12:31","2018-04-14 07:12:31",0,null
12292,UgwvEaZzFE4CuC0s-Qh4AaABAg,mkBbFWxLIT8,"M Kefayati",UCGXLs_O_CFm2SLxelkZDQKQ,"ummm...so what happened to the so called SATCOMMS(Satellite Communications) !!  so i guess SATCOMMS are just another bullshit story?? what are all the Satellites out there for then?? if Sea line cables are damaged....90% of earths comms are through SEA LINE CABLES!  SATCOMMS are just bullshit then no?? wow! 
cheers!","ummm...so what happened to the so called SATCOMMS(Satellite Communications) !!  so i guess SATCOMMS are just another bullshit story?? what are all the Satellites out there for then?? if Sea line cables are damaged....90% of earths comms are through SEA LINE CABLES!  SATCOMMS are just bullshit then no?? wow! 
cheers!",0,"2018-04-14 07:08:27","2018-04-14 07:08:27",0,null
12293,UgyO_qvZgudTxXp3xqx4AaABAg,mkBbFWxLIT8,magnus4g63,UCfHIWmAD1_KCZxQ4vTbV7hA,"Statism ... the religion of violence and death.","Statism ... the religion of violence and death.",0,"2018-04-14 07:07:00","2018-04-14 07:07:00",0,null
12294,UgzAHx-OgmR6IvVq2n94AaABAg,mkBbFWxLIT8,"zesty mexican",UCHsd-FhdBJfK64d8xM7rGvw,"Damn, Sukhois are rad looking. Too bad well have to scrap so many of them.","Damn, Sukhois are rad looking. Too bad well have to scrap so many of them.",0,"2018-04-14 07:04:21","2018-04-14 07:04:21",0,null
12295,UgwGhe2cD1HZHcuGvCR4AaABAg,mkBbFWxLIT8,JellyPlays,UChFQJEFNkMN_2TShkpfvA3g,"Bro get the fuck out of here with all the damn ads","Bro get the fuck out of here with all the damn ads",0,"2018-04-14 07:01:01","2018-04-14 07:01:01",0,null
12296,Ugy5m0Lv9cL1TqJnQod4AaABAg,mkBbFWxLIT8,tripeboi,UClHlzitdbbOgQXE50Y5gt_Q,"Lol no he did not. Russia said they would only retaliate if Russian soldiers were harmed. None were Russia ain’t going to do shit!","Lol no he did not. Russia said they would only retaliate if Russian soldiers were harmed. None were Russia ain’t going to do shit!",0,"2018-04-14 07:00:03","2018-04-14 07:00:03",0,null
12297,UgzrafmxY9FvEkCKQ2d4AaABAg,mkBbFWxLIT8,gerace007,UCbAOLbgzkCOsVqLWmwQZggw,"WW3?  You are an idiot.","WW3?  You are an idiot.",0,"2018-04-14 06:59:45","2018-04-14 06:59:45",0,null
12298,UgzI8VHTuhScWybFwHh4AaABAg,mkBbFWxLIT8,"Linda Carpenter",UCYYOU7eCI5hH-8ZUj68pnhQ,"we didnt start it  Syria did....","we didnt start it  Syria did....",0,"2018-04-14 06:57:47","2018-04-14 06:57:47",0,null
12299,Ugwd5tK78aV27Hi6ufN4AaABAg,mkBbFWxLIT8,MrT-Rex,UCQmyP7tRqiWcKwA_SQncQyw,"The title of this video is fucking retarded. Get a life.","The title of this video is fucking retarded. Get a life.",0,"2018-04-14 06:57:09","2018-04-14 06:57:09",0,null
12300,UgyEFvfYXK6bqWIvqJp4AaABAg,mkBbFWxLIT8,"gabriel iosef",UCv4HqiEDDZ8MbT2v6WCtjkQ,"Putin boasted that the S400 it will intercept all the Tomahawk missiles.S-400 it a Russian junk","Putin boasted that the S400 it will intercept all the Tomahawk missiles.S-400 it a Russian junk",0,"2018-04-14 06:57:08","2018-04-14 06:57:08",0,null
12301,UgxxT3b0nWKP0LUBXkB4AaABAg,mkBbFWxLIT8,"rt bigman",UCsvpi-pzsfsury5EUWyXAfw,"Trump is gonna do nothing, he is a very smart man, with a BIG mouth !! His Policy is/was to INTIMIDATE but he picked the wrong Country and the WRONG MAN !, PUTIN IS TOO POWERFUL, THE UK IS JUST A PUSSY US PROSTITUTE,","Trump is gonna do nothing, he is a very smart man, with a BIG mouth !! His Policy is/was to INTIMIDATE but he picked the wrong Country and the WRONG MAN !, PUTIN IS TOO POWERFUL, THE UK IS JUST A PUSSY US PROSTITUTE,",0,"2018-04-14 06:56:59","2018-04-14 06:56:59",0,null
12302,Ugxw1mgw0mP7K9X8z4N4AaABAg,mkBbFWxLIT8,"J W",UCNTGU0SwHU_h2s5-ojjlfmw,"This is all old video. Utter shit.","This is all old video. Utter shit.",0,"2018-04-14 06:55:37","2018-04-14 06:55:37",0,null
12303,Ugx6xFfm6GCKmW0NOJZ4AaABAg,mkBbFWxLIT8,"True Colors",UCezYMzJ9uNsOrocxCLvdWkQ,"Time to rename Syria to ruinous heap.","Time to rename Syria to ruinous heap.",1,"2018-04-14 06:53:48","2018-04-14 06:53:48",0,null
12304,UgwEuv3Thq0MOjRIeOh4AaABAg,mkBbFWxLIT8,"E turnall",UCcBBJUh8fJXGCaZNF7EFFlA,"try better camera and then i might believe your bs edited random put together to create your own preception","try better camera and then i might believe your bs edited random put together to create your own preception",0,"2018-04-14 06:52:45","2018-04-14 06:52:45",0,null
12305,UgyoPP4o8D3Mp08-FAZ4AaABAg,mkBbFWxLIT8,"El Ray",UCDrl2TH2XBveZNQyBgW2csg,"Did not need th Russians. News tells us everyone hates Assad in Syria . Look how we demoralized Syria with the strike   http://www.presstv.com/Detail/2018/04/14/558439/Syria-Russia-Donald-Trump","Did not need th Russians. News tells us everyone hates Assad in Syria . Look how we demoralized Syria with the strike   http://www.presstv.com/Detail/2018/04/14/558439/Syria-Russia-Donald-Trump",0,"2018-04-14 06:52:33","2018-04-14 06:52:33",0,null
12306,UgxTFxMu7rB-EKnKZ_V4AaABAg,mkBbFWxLIT8,"DAVID Mondragon",UCHrTraYYQe8CRDM0eSNHzQQ,"Check out this guy..( Lee stoneking ) revelation part one though 7...an( Ivin Baxter Bible prophecy end times. Pretty awesome stuff.","Check out this guy..( Lee stoneking ) revelation part one though 7...an( Ivin Baxter Bible prophecy end times. Pretty awesome stuff.",2,"2018-04-14 06:51:58","2018-04-14 06:52:36",0,null
12307,UgyWluq1Tj_Wo5Khrsh4AaABAg,mkBbFWxLIT8,Marco,UC3yxzkB6cYIiGH14E5iGefQ,"No he didnt. Stop the fearmongering. Nothing will happen.","No he didnt. Stop the fearmongering. Nothing will happen.",0,"2018-04-14 06:51:55","2018-04-14 06:51:55",0,null
12308,UgwchfaQqYLwyyTdRe94AaABAg,mkBbFWxLIT8,"Afghan Hound",UCsHKVkmreuzOhaKLksk1kWQ,"WW III? What WW III??? Only USA got the balls to do things as it wishes, Russia and all others are pussying around and don’t have the guts to fight. Clearly this proves that Russia and China are losers and you should never rely on them.","WW III? What WW III??? Only USA got the balls to do things as it wishes, Russia and all others are pussying around and don’t have the guts to fight. Clearly this proves that Russia and China are losers and you should never rely on them.",26,"2018-04-14 06:51:53","2018-04-14 21:55:13",38,null
12309,UgwchfaQqYLwyyTdRe94AaABAg.8f09ghAPijQ8f3z5HrDeIk,mkBbFWxLIT8,"Cryptic Mind",UC_jdtr6B92GUCuiB8xid3Pw,"Afghan Hound you got it all figured out Huh?","Afghan Hound you got it all figured out Huh?",0,"2018-04-15 18:27:29","2018-04-15 18:27:29",0,UgwchfaQqYLwyyTdRe94AaABAg
12310,UgwchfaQqYLwyyTdRe94AaABAg.8f09ghAPijQ8f3d1pdQijb,mkBbFWxLIT8,"What Z Up",UCrZs31b5LDPBPDmj4Zn1cDA,"Afghan Hound 
Shame on u","Afghan Hound 
Shame on u",0,"2018-04-15 15:14:46","2018-04-15 15:14:46",0,UgwchfaQqYLwyyTdRe94AaABAg
12311,UgwchfaQqYLwyyTdRe94AaABAg.8f09ghAPijQ8f3Od9WGQsh,mkBbFWxLIT8,"barbara knowles",UCUB7b1YordnrWLJEwwHyGoQ,"AzraelPercussionNEO submarines lots of them Satan sounds like a weapon of indignation to me","AzraelPercussionNEO submarines lots of them Satan sounds like a weapon of indignation to me",0,"2018-04-15 13:00:12","2018-04-15 13:00:12",0,UgwchfaQqYLwyyTdRe94AaABAg
12312,UgwchfaQqYLwyyTdRe94AaABAg.8f09ghAPijQ8f2fucmFQ_A,mkBbFWxLIT8,Andreas,UCnmhZW3pQrCpcicclOnKr1g,"Connor Fallon, i think its more of both ;) Sometimes its much harder NOT to strike than to do so.","Connor Fallon, i think its more of both ;) Sometimes its much harder NOT to strike than to do so.",0,"2018-04-15 06:20:38","2018-04-15 06:20:38",0,UgwchfaQqYLwyyTdRe94AaABAg
