id,comment_id,video_id,commenter_name,commenter_id,comment_displayed,comment_original,likes,published_date,updated_date,total_replies,replyto
13534,UgyqF_cODtw0VKe0Ec94AaABAg,ufHApVWmrpw,"Tsohg Repins 47",UCyItq6b9TBCvbYC1znNCZLg,"LOL. Love these titles!!!","LOL. Love these titles!!!",0,"2018-04-15 02:52:03","2018-04-15 02:52:03",0,null
13535,Ugx2TpqtO9hrYfbQbi14AaABAg,ufHApVWmrpw,"Eugene Rotter",UCLAgC0FBEif2RCD5xOWYZSw,"All countries have enough of US behave it will not end up good for the US??","All countries have enough of US behave it will not end up good for the US??",0,"2018-04-15 02:49:10","2018-04-15 02:49:10",0,null
13536,UgxebC1spyyLLi89nTt4AaABAg,ufHApVWmrpw,"Eddie Reyna",UCsdrNrcV8fYgABC7AEA1d9A,"Lies lies","Lies lies",0,"2018-04-15 02:48:22","2018-04-15 02:48:22",0,null
13537,UgzAOhRyzNHQJtG-wlZ4AaABAg,ufHApVWmrpw,"gina brown",UCPrSb4W7jJ4clavGMNa_vfQ,Stupid!!,Stupid!!,1,"2018-04-15 02:47:57","2018-04-15 02:47:57",0,null
13538,UgyVAc1vSjH1eeN76Bh4AaABAg,ufHApVWmrpw,"david thomas",UCdmmfVT1eJra-QQ090BkWKg,"no syria is sending troops","no syria is sending troops",0,"2018-04-15 02:46:51","2018-04-15 02:46:51",0,null
13539,Ugw5EmzxdPDDbGUicTB4AaABAg,ufHApVWmrpw,"Fly Oz",UCYRmSEAUnRXi_52J1tC8MDA,"According to youtubbe soothsayers the world has ended so many times already yet its still hasnt happend","According to youtubbe soothsayers the world has ended so many times already yet its still hasnt happend",0,"2018-04-15 02:39:28","2018-04-15 02:39:28",0,null
13540,UgywKoNeiBNkVDcdsXh4AaABAg,ufHApVWmrpw,"Serge Kaznady",UCgrWqy98A1AHdNWH61uaA6Q,"This is  an excellent example of Russian propaganda of war.  Everyones preparing for war!  Wow! Only Russia is preparing for war because it cannot distract its peoples attention from  economic problems its government cannot resolve!","This is  an excellent example of Russian propaganda of war.  Everyones preparing for war!  Wow! Only Russia is preparing for war because it cannot distract its peoples attention from  economic problems its government cannot resolve!",0,"2018-04-15 02:37:22","2018-04-15 02:37:22",0,null
13541,Ugz8nODJlnjDOYzZuoB4AaABAg,ufHApVWmrpw,"Family Andrade",UCdBJ43UBSNjKzBb9etSjGYA,"Comments: 90% Talking about religion and how the Bible speaks the truth.

5% Actually aren’t dumbasses and know it’s propaganda.

The other 5% Nah. America Fuck Yeah!","Comments: 90% Talking about religion and how the Bible speaks the truth.

5% Actually aren’t dumbasses and know it’s propaganda.

The other 5% Nah. America Fuck Yeah!",0,"2018-04-15 02:35:40","2018-04-15 02:35:40",0,null
13542,Ugx012y-j-x7q4_uLkx4AaABAg,ufHApVWmrpw,"Jim Belluccio",UCXImRhzwAC9-1tt9vNAOM9A,"There are about 100 million armed American citizens.  Lol send everyone in Russia and Chinas army and we would win. We literally have 100 million man army in the United States of America every day","There are about 100 million armed American citizens.  Lol send everyone in Russia and Chinas army and we would win. We literally have 100 million man army in the United States of America every day",0,"2018-04-15 02:34:23","2018-04-15 02:34:23",0,null
13543,Ugw0ATcqClPNV4pBbnF4AaABAg,ufHApVWmrpw,"Van Wallace",UCHkq1ygAUUnfEqm2ckPq6Dg,"They are going to take out the deep state","They are going to take out the deep state",0,"2018-04-15 02:33:34","2018-04-15 02:33:34",0,null
13544,UgwK8xC0Try4fLRNPqR4AaABAg,ufHApVWmrpw,"Steven Taylor",UCKvAxuJVEgV_HwLQyz3LsUw,"Putin does not know Americans,  we will kick the shit out of the troops..  we will use just our hunters....lol","Putin does not know Americans,  we will kick the shit out of the troops..  we will use just our hunters....lol",0,"2018-04-15 02:31:42","2018-04-15 02:31:42",0,null
13545,UgwhkGR2feS5-Ltsvc94AaABAg,ufHApVWmrpw,whitewavewaterfall,UC01d6Q85BPlCibaRrJjK7kQ,"Revelation 16:12-16 Amen.","Revelation 16:12-16 Amen.",0,"2018-04-15 02:27:00","2018-04-15 02:27:00",0,null
13546,UgxsNuwLfKuR56Cmy0d4AaABAg,ufHApVWmrpw,"Woodyrimshot Music",UCg9KorDxgMWvlZdUb4KY3wA,"Here comes the anti-_____________. fill it in for yourselves since youre so versed at it. Fuck God and Fuck Jesus Christ, if thats even the real name of an arab from 2000 years ago. Thank nothingness that we are confined to this planet, in this solar system, so far from everything else. So why not pray for world war 3? It would be a change from all the insanity and would end that shit fast enough. Im venting to those of you who dont quite get it. The world is an endless train of hustlers who are gonna take for themselves no matter what has to happen. To those people I pray the worst for. Their own doings. It should fold over upon them like a tsunami of consequences. It shall get faster and more focused as time progresses. Forget it all... as I shall when I finally cease to exist. Im just stickin around to see just how bad it can really get. The world is full of addicts in every walk of life, me included. FUCK US ALL!!!","Here comes the anti-_____________. fill it in for yourselves since youre so versed at it. Fuck God and Fuck Jesus Christ, if thats even the real name of an arab from 2000 years ago. Thank nothingness that we are confined to this planet, in this solar system, so far from everything else. So why not pray for world war 3? It would be a change from all the insanity and would end that shit fast enough. Im venting to those of you who dont quite get it. The world is an endless train of hustlers who are gonna take for themselves no matter what has to happen. To those people I pray the worst for. Their own doings. It should fold over upon them like a tsunami of consequences. It shall get faster and more focused as time progresses. Forget it all... as I shall when I finally cease to exist. Im just stickin around to see just how bad it can really get. The world is full of addicts in every walk of life, me included. FUCK US ALL!!!",0,"2018-04-15 02:26:37","2018-04-15 02:26:37",0,null
13547,Ugwn-SMDkaGJZiUEywl4AaABAg,ufHApVWmrpw,"our earth",UCPWsGynws7v43VQICtPKVaA,"Good luck my fellow humans.","Good luck my fellow humans.",0,"2018-04-15 02:24:04","2018-04-15 02:24:04",0,null
13548,UgwnfmY1Ild_VZjfOyl4AaABAg,ufHApVWmrpw,KingKatRider,UCtyUkWszn7S97YyYx8ygFIA,"Look this turd doesnt even speak English which is the reason for the text reader so that shows how informed he is....propaganda nuff said","Look this turd doesnt even speak English which is the reason for the text reader so that shows how informed he is....propaganda nuff said",0,"2018-04-15 02:21:16","2018-04-15 02:21:16",0,null
13549,UgzVzrocudLPwUnDXp54AaABAg,ufHApVWmrpw,"Nurali Nur",UC3x42Lkx6gDi-PoMF5xyMuA,"Let’s all pray for Allah not war for peace","Let’s all pray for Allah not war for peace",1,"2018-04-15 02:18:43","2018-04-15 02:18:43",3,null
13550,UgzVzrocudLPwUnDXp54AaABAg.8f2FDpnsHoW8f3QyqH0_WH,ufHApVWmrpw,"James Vaughan",UCcTPgRRhb4eDypHJqiTyeaA,"Pray to Jesus not the fake God Allah","Pray to Jesus not the fake God Allah",0,"2018-04-15 13:20:38","2018-04-15 13:20:38",0,UgzVzrocudLPwUnDXp54AaABAg
13551,UgzVzrocudLPwUnDXp54AaABAg.8f2FDpnsHoW8f2SAr0yuim,ufHApVWmrpw,"Matthew Mccoy",UCgVUP0T-Kp_A_Rcvuy6Junw,"Fuck that bitch he was a war maker hes no better","Fuck that bitch he was a war maker hes no better",0,"2018-04-15 04:11:54","2018-04-15 04:11:54",0,UgzVzrocudLPwUnDXp54AaABAg
13552,UgzVzrocudLPwUnDXp54AaABAg.8f2FDpnsHoW8f2JsqSTyup,ufHApVWmrpw,"Josh Bullard",UCtzNHqfoiklJqJ9Q-5vz2oA,"Nurali Nur you are brainwashed","Nurali Nur you are brainwashed",0,"2018-04-15 02:59:24","2018-04-15 02:59:24",0,UgzVzrocudLPwUnDXp54AaABAg
13553,UgwLwUI_cPWRujiSCSB4AaABAg,ufHApVWmrpw,"Adrian Gonzales",UCjuXyo65XCUqo2rKl96Pymw,"Fake news","Fake news",1,"2018-04-15 02:10:58","2018-04-15 02:10:58",0,null
13554,UgxrJV7P6wfZTopBhep4AaABAg,ufHApVWmrpw,"AL T Tude",UCrOH8jdb1ZMhALBCSVg0gzw,"Liar Liar pants on fire.","Liar Liar pants on fire.",0,"2018-04-15 02:06:06","2018-04-15 02:06:06",0,null
13555,UgxDRqOMzSkYteZV3mV4AaABAg,ufHApVWmrpw,"John Tischer",UCLClADvx-MhYWZSjwZW-f6Q,"You really shouldnt be so stupid in public. It makes you look really really bad.","You really shouldnt be so stupid in public. It makes you look really really bad.",0,"2018-04-15 01:58:50","2018-04-15 01:58:50",0,null
13556,Ugy6XoAK9QZJvDABVy54AaABAg,ufHApVWmrpw,"Ratha krishnan",UCSmJMXGrqG4aeqBvYy6ZxWg,"Russia  ,North Korea, China and Iran should form alliance to whack U.S AND Nato cowards. I support you ...","Russia  ,North Korea, China and Iran should form alliance to whack U.S AND Nato cowards. I support you ...",0,"2018-04-15 01:56:07","2018-04-15 01:56:07",0,null
13557,Ugymsi9xfsmpiYrtdyx4AaABAg,ufHApVWmrpw,"Michael Hood",UChkkVEak_Tqz59cyIzOROJg,"Theyre doing a lot of War simulations so prop up the economy but it just so happens the children Syria were killed by militants invading Syria and it was blamed on the Assad regime its very sad the lengths governments will go to profit","Theyre doing a lot of War simulations so prop up the economy but it just so happens the children Syria were killed by militants invading Syria and it was blamed on the Assad regime its very sad the lengths governments will go to profit",0,"2018-04-15 01:55:18","2018-04-15 01:55:18",0,null
13558,Ugz2F71q9QYgZ4d9XmB4AaABAg,ufHApVWmrpw,"umaya abbasit",UC2xlVrtKaV8rkjtVq6p4T4A,"The evil called USA must leaves and let us live in peace","The evil called USA must leaves and let us live in peace",0,"2018-04-15 01:54:28","2018-04-15 01:54:28",0,null
13559,UgzdgQEVrHuoyl149zh4AaABAg,ufHApVWmrpw,"Henry Dalton",UCvipncmTzln8R8SqxzuOIpQ,"Im gonna fuck my girlfriend as much as I can then ??","Im gonna fuck my girlfriend as much as I can then ??",0,"2018-04-15 01:51:25","2018-04-15 01:51:25",0,null
13560,UgxruGqu19bPNG6Jsph4AaABAg,ufHApVWmrpw,eifeldude1,UCH7kv46mqJLIg6dNvoiqg7w,"M.A.D mutual assured destruction. Long standing US policy against Russia","M.A.D mutual assured destruction. Long standing US policy against Russia",0,"2018-04-15 01:50:41","2018-04-15 01:50:41",0,null
13561,Ugyx0rxgwJfMz-VEMxl4AaABAg,ufHApVWmrpw,"Marty McFly",UC8kjCw_3trnZ-JhpVj3iJnQ,"some say a comet will fall from the skies followed by meteor showers and tidal waves followed by fault lines that cannot sit still followed by millions of dumb founded dip shits","some say a comet will fall from the skies followed by meteor showers and tidal waves followed by fault lines that cannot sit still followed by millions of dumb founded dip shits",0,"2018-04-15 01:48:14","2018-04-15 01:48:14",0,null
13562,UgwaWLR-1Cb6y7whtLh4AaABAg,ufHApVWmrpw,"Hemara Otimi",UCxPFqYCbRZ0LUOpqbQ5dddQ,"What has Russia done for the rest of the world besides creating a fuxing Lada","What has Russia done for the rest of the world besides creating a fuxing Lada",1,"2018-04-15 01:47:49","2018-04-15 01:47:49",0,null
13563,UgxQnRy1tlaZ-NIRXzt4AaABAg,ufHApVWmrpw,"Tom Cat",UCVkLjv2NhRCx0WiXqO6UdsA,"And to think all ,war really is about resetting ones economy
While reducing the number of humans that inhabit the earth as we call it.","And to think all ,war really is about resetting ones economy
While reducing the number of humans that inhabit the earth as we call it.",0,"2018-04-15 01:47:32","2018-04-15 01:47:32",0,null
13564,Ugy94thX4eAV3M_ojY14AaABAg,ufHApVWmrpw,"RW Nation",UCjAIbBHRFERvmy8X5SDDqFw,"Why would you believe this crap now, it was crap before, its crap now. Wake up!!!","Why would you believe this crap now, it was crap before, its crap now. Wake up!!!",0,"2018-04-15 01:46:33","2018-04-15 01:46:33",0,null
13565,UgydP2riydPDjONoI2R4AaABAg,ufHApVWmrpw,"Rosanna Miller",UCqW8OMvVztC0gKr_r_6_scw,"Woe unto the idiots promoting fake news. You wont be able to point your finger and someone else by claiming you were only sharing what someone else told you. Hell awaits all liars. 

I am not speaking about anyone in particular or I would call you out specifically because only God knows who is spreading fake news. Woe unto you if you are!!","Woe unto the idiots promoting fake news. You wont be able to point your finger and someone else by claiming you were only sharing what someone else told you. Hell awaits all liars. 

I am not speaking about anyone in particular or I would call you out specifically because only God knows who is spreading fake news. Woe unto you if you are!!",0,"2018-04-15 01:43:26","2018-04-15 01:44:53",0,null
13566,UgxEx9sh1_DOe1flnCh4AaABAg,ufHApVWmrpw,"guy levi",UCaXfMkkXnnQ7-mNCvgVGe6w,"no no nooooooooooo im waiting for infinity wars for a long time you can do your shit after the movie damnnmm","no no nooooooooooo im waiting for infinity wars for a long time you can do your shit after the movie damnnmm",0,"2018-04-15 01:40:16","2018-04-15 01:40:16",0,null
13567,UgwLUVr8WVZ-C60LY3h4AaABAg,ufHApVWmrpw,"Anthony Geiger",UCVxRCD0TNSS9G9vDBNb6Phg,"Even if they got past our Military good luck against 300 million guns n trillions of rounds of ammo","Even if they got past our Military good luck against 300 million guns n trillions of rounds of ammo",18,"2018-04-15 01:37:57","2018-04-15 01:37:57",10,null
13568,UgwLUVr8WVZ-C60LY3h4AaABAg.8f2AZC5Y4cX8fCEbSgZGjx,ufHApVWmrpw,"K Kking",UCWcDsh1TvDa3iAW7LEY1hhg,"U really think WW3 is gonna be fought with guns?","U really think WW3 is gonna be fought with guns?",1,"2018-04-18 23:25:45","2018-04-18 23:25:45",0,UgwLUVr8WVZ-C60LY3h4AaABAg
13569,UgwLUVr8WVZ-C60LY3h4AaABAg.8f2AZC5Y4cX8f9py_Ua8Po,ufHApVWmrpw,"DALLAS __1971",UCoY05tLMN1y87W1LXHdv4-g,"Your gun can do NOTHING against chemicals. Pray & repent! Thats your ONLY hope.","Your gun can do NOTHING against chemicals. Pray & repent! Thats your ONLY hope.",1,"2018-04-18 01:03:14","2018-04-18 01:03:14",0,UgwLUVr8WVZ-C60LY3h4AaABAg
13570,UgwLUVr8WVZ-C60LY3h4AaABAg.8f2AZC5Y4cX8f4ZfacCLPc,ufHApVWmrpw,"Anthony Geiger",UCVxRCD0TNSS9G9vDBNb6Phg,"30 06 theyre good for human shields","30 06 theyre good for human shields",1,"2018-04-15 23:55:53","2018-04-15 23:55:53",0,UgwLUVr8WVZ-C60LY3h4AaABAg
13571,UgwLUVr8WVZ-C60LY3h4AaABAg.8f2AZC5Y4cX8f4YV7uotnC,ufHApVWmrpw,"30 06",UCEJh55IRilX41N9iXZKtpdQ,"Why should us gun owners defend all the lib tards that sit there and bash us and try and take our shit. We should just let the Russians take all the basterds.","Why should us gun owners defend all the lib tards that sit there and bash us and try and take our shit. We should just let the Russians take all the basterds.",2,"2018-04-15 23:45:35","2018-04-15 23:45:35",0,UgwLUVr8WVZ-C60LY3h4AaABAg
13572,UgwLUVr8WVZ-C60LY3h4AaABAg.8f2AZC5Y4cX8f43A4IzSR7,ufHApVWmrpw,"John Williams",UCJ3Lc5fxrIC3xdDE2StruhA,"Aztec Surfrider lol","Aztec Surfrider lol",0,"2018-04-15 19:11:50","2018-04-15 19:11:50",0,UgwLUVr8WVZ-C60LY3h4AaABAg
13573,UgyIde6zI3preANlEHR4AaABAg,ufHApVWmrpw,"Ryne Gentry",UCMWExUQhIiNjIHs61IcD4QQ,"Why are they talking about all these other countries?? The title says Putin and USA!!","Why are they talking about all these other countries?? The title says Putin and USA!!",0,"2018-04-15 01:36:09","2018-04-15 01:36:09",0,null
13574,UgyVnFjBhCbdYyGxum14AaABAg,ufHApVWmrpw,"Cheryl Bullard",UCk_cqdk3eYWn5OSXbHUPrAg,"I warned you all that Trump was a Lunatic but you didnt listen. Now how is your Trump going to make America Great again ? When Russia and China start bombing America Trump will be in Russia laughing his as off at the dum Americans running for their lives.","I warned you all that Trump was a Lunatic but you didnt listen. Now how is your Trump going to make America Great again ? When Russia and China start bombing America Trump will be in Russia laughing his as off at the dum Americans running for their lives.",0,"2018-04-15 01:34:07","2018-04-15 01:34:07",0,null
13575,UgyVAg-hyyGrcgSBFXh4AaABAg,ufHApVWmrpw,"Kevin OConnell",UCR6uHs7fZ8hst3HP3iHhkeg,"Click bait huge crock of shit title, you guys don’t care what you say do you?","Click bait huge crock of shit title, you guys don’t care what you say do you?",0,"2018-04-15 01:33:11","2018-04-15 01:33:11",0,null
13576,UgyqZyoQ_Vmxi05Zf7B4AaABAg,ufHApVWmrpw,jslasher1,UCNZz5MzxvuxFxCUH82p1SxQ,"What an absolute pile of poo.","What an absolute pile of poo.",0,"2018-04-15 01:30:11","2018-04-15 01:30:11",0,null
13577,UgyWFWZZCrCHVh8PprF4AaABAg,ufHApVWmrpw,"GARY DERBY",UCvkJLpbC33-D7LaDOeFG7Gw,"You idiots will believe anything the Government tells you.  Only in America folks!","You idiots will believe anything the Government tells you.  Only in America folks!",0,"2018-04-15 01:26:39","2018-04-15 01:26:39",0,null
13578,UgzdhWYPPi0BOQufdD14AaABAg,ufHApVWmrpw,"Mynamejefff 69",UC_ymiy6zw_6dx6YaXr75LeA,"Hhmm I think I heard this before. Oh yeah, last year when the same thing happened and everyone said “we’re going to war” and yet nothing happened. Relax people Russia is just throwing a little fit right now cause the allies shot some missiles in Syria, by next week everyone will forget this","Hhmm I think I heard this before. Oh yeah, last year when the same thing happened and everyone said “we’re going to war” and yet nothing happened. Relax people Russia is just throwing a little fit right now cause the allies shot some missiles in Syria, by next week everyone will forget this",0,"2018-04-15 01:22:09","2018-04-15 01:22:09",0,null
13579,Ugz5-Gg4e6kGusDqZz94AaABAg,ufHApVWmrpw,"David Osborne",UCAg0of4Yi-RUzqySW4loBPQ,"WAR MONGERERS can NEVER have a better world, WTF are you leaders thinking?????","WAR MONGERERS can NEVER have a better world, WTF are you leaders thinking?????",3,"2018-04-15 01:21:45","2018-04-15 01:21:45",0,null
13580,UgyXz2ffIkOfoMXDCFF4AaABAg,ufHApVWmrpw,"Sheila Sure",UClgLOcK7P4fd1np9TACU18A,"No he isnt, that is obviously the delusions of the pot you smoke. Shees what gullible fools you are. Squwaking like scared hens. Boo the boogy man is coming for you. Ha deranged as ususal you losers are. No weapon formed against America ever prospers.","No he isnt, that is obviously the delusions of the pot you smoke. Shees what gullible fools you are. Squwaking like scared hens. Boo the boogy man is coming for you. Ha deranged as ususal you losers are. No weapon formed against America ever prospers.",0,"2018-04-15 01:20:25","2018-04-15 01:20:25",0,null
13581,UgyvtFAs49wJY5NsTT54AaABAg,ufHApVWmrpw,"Youra Ninee",UC_k7_iudP5Tj7b_qcrFn4dg,"Russian troops can enter the US freely by crossing the Mexican boarder, its unprotected!!","Russian troops can enter the US freely by crossing the Mexican boarder, its unprotected!!",11,"2018-04-15 01:14:12","2018-04-15 01:54:28",2,null
13582,UgyvtFAs49wJY5NsTT54AaABAg.8f27qFNbzhv8f3duI_60N_,ufHApVWmrpw,"shana beg",UCvnn05Zx0Xrk4AlhO1jf1fA,"Youra Ninee middle eastern borders are unprotected actually... USA has been raping the Middle East for years .. what goes around comes around","Youra Ninee middle eastern borders are unprotected actually... USA has been raping the Middle East for years .. what goes around comes around",0,"2018-04-15 15:22:21","2018-04-15 15:22:21",0,UgyvtFAs49wJY5NsTT54AaABAg
13583,UgyvtFAs49wJY5NsTT54AaABAg.8f27qFNbzhv8f2L5yFyQgC,ufHApVWmrpw,"Mike Wood",UC0iGKtlxl9A74Nw-FA5x9RQ,"Youra Ninee its protected by millions of armed americans","Youra Ninee its protected by millions of armed americans",0,"2018-04-15 03:10:04","2018-04-15 03:10:04",0,UgyvtFAs49wJY5NsTT54AaABAg
13584,Ugxe9mF2nG9XawpWoa94AaABAg,ufHApVWmrpw,"William Rempkowski",UC-Jpqaf_Gmueal44-b5rqAQ,"Cant take a video seriously when they use sound clips from a xmen movie...smh","Cant take a video seriously when they use sound clips from a xmen movie...smh",2,"2018-04-15 01:12:33","2018-04-15 01:12:33",0,null
13585,UgxVN4Z_0sxEZOvd57N4AaABAg,ufHApVWmrpw,"Jose Trevino",UCV-orIPZCQIcS-ZsgYjK8nQ,"Trump dont listen to Copeland  Rev 4:11 rev17:17","Trump dont listen to Copeland  Rev 4:11 rev17:17",0,"2018-04-15 01:09:26","2018-04-15 01:09:26",0,null
13586,UgwK8_WJs5m17vFi9nB4AaABAg,ufHApVWmrpw,"Jose Trevino",UCV-orIPZCQIcS-ZsgYjK8nQ,"it is not require a response they are preparing for war here United States once Muslim sees they are losing the Muslims here in the state will retaliate we must be prepared","it is not require a response they are preparing for war here United States once Muslim sees they are losing the Muslims here in the state will retaliate we must be prepared",0,"2018-04-15 01:07:57","2018-04-15 01:07:57",0,null
13587,Ugw_Zrx69vRzQ3U2H1F4AaABAg,ufHApVWmrpw,"Dave Stuart",UC_4cYiFBY0qYVPRyYCyQN-w,"Nothing but over-dramatized fear porn!!!","Nothing but over-dramatized fear porn!!!",0,"2018-04-15 00:58:44","2018-04-15 00:58:44",0,null
13588,Ugwd05sMmWFZIBQi86t4AaABAg,ufHApVWmrpw,"Teresa Roberts",UCQpzZK0YvWElFdGQDPBu4JQ,"I wish peace..on all countrys..we dont want a war?","I wish peace..on all countrys..we dont want a war?",3,"2018-04-15 00:56:51","2018-04-15 00:56:51",1,null
13589,Ugwd05sMmWFZIBQi86t4AaABAg.8f25rEcyKSc8f6JyhJqiS0,ufHApVWmrpw,"Sam Osas",UCZQdS9F7J0WYdfnALxUnPPA,"l wish peace in the whole world","l wish peace in the whole world",0,"2018-04-16 16:17:10","2018-04-16 16:17:10",0,Ugwd05sMmWFZIBQi86t4AaABAg
13590,Ugxf6dmaAkKJUdO9WQ54AaABAg,ufHApVWmrpw,"Billy Singh Sagoo",UCrZxWfdUMhxY8lMfwfllZPA,"yummy love you too much BABYSITTING AND AFGHANISTAN WARS OF AGGRESSION AGAINST THE DOLLAR SINCE THEN","yummy love you too much BABYSITTING AND AFGHANISTAN WARS OF AGGRESSION AGAINST THE DOLLAR SINCE THEN",0,"2018-04-15 00:53:25","2018-04-15 00:53:25",0,null
13591,Ugyj12JyNiFQMCU8nTZ4AaABAg,ufHApVWmrpw,Silverhorse1970,UC2Y4p1q9wH-1jo70vRGcQsg,"troops will NEVER make it from Russia to the usa I hope they do make it but the chances of that are slim very slim","troops will NEVER make it from Russia to the usa I hope they do make it but the chances of that are slim very slim",0,"2018-04-15 00:47:56","2018-04-15 00:47:56",0,null
13592,UgygoOf583csDP6eHZx4AaABAg,ufHApVWmrpw,"Jimbob Jones",UCvu3WQTSSbffwQdvPg2hhvA,"Stop trying to scare everyone you fuck.","Stop trying to scare everyone you fuck.",0,"2018-04-15 00:42:49","2018-04-15 00:42:49",0,null
13593,UgzY_UbMmQFoYmWcoT54AaABAg,ufHApVWmrpw,"Jimbob Jones",UCvu3WQTSSbffwQdvPg2hhvA,"More lies wtf propaganga","More lies wtf propaganga",0,"2018-04-15 00:42:10","2018-04-15 00:42:10",0,null
13594,UgxWMPyen7e-GwJ27AF4AaABAg,ufHApVWmrpw,"Cormac McCarthy",UCk5VE3YPFEGulpMv4Vck-Dw,"Put in is the biggest ever gobshite in the world and the whole world nos hes an asswhole","Put in is the biggest ever gobshite in the world and the whole world nos hes an asswhole",0,"2018-04-15 00:38:04","2018-04-15 00:38:04",0,null
13595,UgzA7lzH93nijHRO4r94AaABAg,ufHApVWmrpw,"bestblood one",UCLww28ngaF0bz4Z55d9BEfQ,"War is to men as motherhood is to women.","War is to men as motherhood is to women.",0,"2018-04-15 00:19:33","2018-04-15 00:19:33",0,null
13596,UgyiGS3jj5kkWyudvHR4AaABAg,ufHApVWmrpw,"Erik Patiño",UChpL2NJNrTSSryMx9WZJUBw,"It’s all mixed up now , there is no guaranteed that Jesus is gonna save our asses , there are a lot of religions and a lot of scripts , nobody really knows the true , who does?","It’s all mixed up now , there is no guaranteed that Jesus is gonna save our asses , there are a lot of religions and a lot of scripts , nobody really knows the true , who does?",0,"2018-04-15 00:19:04","2018-04-15 00:19:04",0,null
13597,UgxpaQHX8wYIdYjd6BJ4AaABAg,ufHApVWmrpw,"Mike Clinton",UC7W4tdbmIS2KHvPFtsbHxug,Bulshit,Bulshit,0,"2018-04-15 00:15:20","2018-04-15 00:15:20",0,null
13598,Ugz3Vv6_CZ3lpbtIkdt4AaABAg,ufHApVWmrpw,"David Watts",UCoRUxLTZpUdg2pd4Egs9kLw,"Bull shirt","Bull shirt",1,"2018-04-15 00:15:04","2018-04-15 00:15:04",0,null
13599,Ugxi0DNW5lYVsN0nzJF4AaABAg,ufHApVWmrpw,"Stephanie Yelekci",UCuczy56nSE4dWInXjUWp2UA,"The aliens have to come to save this planet","The aliens have to come to save this planet",0,"2018-04-15 00:12:59","2018-04-15 00:12:59",0,null
13600,Ugzo7iu_qu86YPcD0tx4AaABAg,ufHApVWmrpw,"Andy Jones",UCy8ZIxW3U2xGMlcqcX3MFyg,"DEATH TO SATANS RUSSIA ....GOG AND MAGOG ...HOME OF THE ANTI CHRIST .....ALL THOSE THAT FOLLOW SATAN PRINCE OF LIES WILL BURN IN GODS HOLY FIRE FROM HEAVEN ...REPENT NOW WHILE THEIR IS TIME ......YOU HAVE BEEN WARNED SINNERS OF EARTH YOUR TIME HAS COME TO BE UTTERLY DESTROYED IN ETERNITY OF AGONY FOR YOU  BUT A MOMENT FOR THOSE WHO EMBRACE THE LOVE AND SACRIFICE OF OUR LORD JESUS CHRIST","DEATH TO SATANS RUSSIA ....GOG AND MAGOG ...HOME OF THE ANTI CHRIST .....ALL THOSE THAT FOLLOW SATAN PRINCE OF LIES WILL BURN IN GODS HOLY FIRE FROM HEAVEN ...REPENT NOW WHILE THEIR IS TIME ......YOU HAVE BEEN WARNED SINNERS OF EARTH YOUR TIME HAS COME TO BE UTTERLY DESTROYED IN ETERNITY OF AGONY FOR YOU  BUT A MOMENT FOR THOSE WHO EMBRACE THE LOVE AND SACRIFICE OF OUR LORD JESUS CHRIST",2,"2018-04-15 00:05:15","2018-04-15 00:05:15",2,null
13601,Ugzo7iu_qu86YPcD0tx4AaABAg.8f2-xF7wObP8f2hq37i_ZV,ufHApVWmrpw,"Иосиф Романов",UCPt7W0Y6i-tJ-nXvetojn0g,"Zionist idiot gog and magog are in Turkey, read a book for once in your life.","Zionist idiot gog and magog are in Turkey, read a book for once in your life.",0,"2018-04-15 06:37:29","2018-04-15 06:37:29",0,Ugzo7iu_qu86YPcD0tx4AaABAg
13602,Ugzo7iu_qu86YPcD0tx4AaABAg.8f2-xF7wObP8f226QoNtZm,ufHApVWmrpw,"Mena Battista",UCQekZYuJMEFT_44iDKb32Gg,"Satans seat is still in the evil Land of TURKEY.","Satans seat is still in the evil Land of TURKEY.",1,"2018-04-15 00:24:07","2018-04-15 00:24:07",0,Ugzo7iu_qu86YPcD0tx4AaABAg
