id,comment_id,video_id,commenter_name,commenter_id,comment_displayed,comment_original,likes,published_date,updated_date,total_replies,replyto
13603,UgxbrySPjhXSPhEOx9Z4AaABAg,ufHApVWmrpw,tyamada21,UCS6H-vuv0OO-Y0CXOofYlhQ,"I dont believe the aliens will allow nuclear weapons to be used - they have stopped them before...     http://www.cufon.org/cufon/malmstrom/malm1.htm      Have you wondered about the truth behind why North Korea suddenly stopped their tests??? I think they have been told to stop by the aliens. They may let us destroy each other but not the planet... Theyve been here watching us for centuries...","I dont believe the aliens will allow nuclear weapons to be used - they have stopped them before...     http://www.cufon.org/cufon/malmstrom/malm1.htm      Have you wondered about the truth behind why North Korea suddenly stopped their tests??? I think they have been told to stop by the aliens. They may let us destroy each other but not the planet... Theyve been here watching us for centuries...",0,"2018-04-14 23:55:39","2018-04-14 23:55:39",0,null
13604,UgwbvfW7VFSZgL3xyAV4AaABAg,ufHApVWmrpw,"Shadowsback Hoc",UCPEkHVv66OIkI9CP0UvZfyQ,"if I die I hope it does not hurt me","if I die I hope it does not hurt me",11,"2018-04-14 23:39:53","2018-04-14 23:39:53",7,null
13605,UgwbvfW7VFSZgL3xyAV4AaABAg.8f1y2PsWFcr8fDdrYu8Wmh,ufHApVWmrpw,"Rhonda clark",UCqPeG8fExPGif4jYRMg77Dw,"poplew   ????☪️UH UH LOOK WHATS HAPPENING AT THE MEXICO BORDER.  OBAMA IS THE ANTICHRIST. PLAUGES WARNING. EMERGENCY MESSAGES ON THIS  I PUT UP FOR YOU.  ADDING. 10 ZOMBIE VIRUS.  EVERYTHING IN BIBLE COMING TRUE. YOUR RIGHT. BUT ITS WORSE THAT THIS. !","poplew   ????☪️UH UH LOOK WHATS HAPPENING AT THE MEXICO BORDER.  OBAMA IS THE ANTICHRIST. PLAUGES WARNING. EMERGENCY MESSAGES ON THIS  I PUT UP FOR YOU.  ADDING. 10 ZOMBIE VIRUS.  EVERYTHING IN BIBLE COMING TRUE. YOUR RIGHT. BUT ITS WORSE THAT THIS. !",0,"2018-04-19 12:34:23","2018-04-19 12:34:23",0,UgwbvfW7VFSZgL3xyAV4AaABAg
13606,UgwbvfW7VFSZgL3xyAV4AaABAg.8f1y2PsWFcr8f4jpQbPMBt,ufHApVWmrpw,"Under A Rock",UCll6f5RfXHKDtKj59vKLUZQ,"oh it will hurt, BAD","oh it will hurt, BAD",0,"2018-04-16 01:33:21","2018-04-16 01:33:21",0,UgwbvfW7VFSZgL3xyAV4AaABAg
13607,UgwbvfW7VFSZgL3xyAV4AaABAg.8f1y2PsWFcr8f4XfehpHQQ,ufHApVWmrpw,"PLANET BOOM",UCUkQox_h9H6dGeogK6vHxoQ,"Dont fear","Dont fear",0,"2018-04-15 23:38:25","2018-04-15 23:38:25",0,UgwbvfW7VFSZgL3xyAV4AaABAg
13608,UgwbvfW7VFSZgL3xyAV4AaABAg.8f1y2PsWFcr8f2XcRMdPXY,ufHApVWmrpw,"MYSTICAL OUIJA",UCN9C8X1jWbKT3mKRuU6Gm-A,"Shadowsback Hoc I will pray for your request keep the HOPE Brother...","Shadowsback Hoc I will pray for your request keep the HOPE Brother...",2,"2018-04-15 04:59:30","2018-04-15 04:59:30",0,UgwbvfW7VFSZgL3xyAV4AaABAg
13609,UgwbvfW7VFSZgL3xyAV4AaABAg.8f1y2PsWFcr8f2Fxx81aWI,ufHApVWmrpw,"Julie Middleton",UC8Ad6W6YowOC-Ai89kpvmiQ,"Shadowsback Hoc Thats funny brother!!","Shadowsback Hoc Thats funny brother!!",0,"2018-04-15 02:25:09","2018-04-15 02:25:09",0,UgwbvfW7VFSZgL3xyAV4AaABAg
13610,UgzmE5CWLyfFzWIL2Hp4AaABAg,ufHApVWmrpw,"tree frog",UCpYjjwu7yYktMRf9u-VwgZQ,"hahaha. sending troops to usa. american citizens are better armed than russian troops. what crap..","hahaha. sending troops to usa. american citizens are better armed than russian troops. what crap..",0,"2018-04-14 23:06:24","2018-04-14 23:06:24",0,null
13611,UgxDCq1Xh5SLlPBXrw94AaABAg,ufHApVWmrpw,"Grace Bertrand",UCOWHr2LyV7YE8dmNjnD9_Sg,"Dump Trump....","Dump Trump....",0,"2018-04-14 22:44:45","2018-04-14 22:44:45",0,null
13612,UgwUNvI29cW5thmndKN4AaABAg,ufHApVWmrpw,"Jose Quiles",UCjp2nKVUgmj5jiTpAaJD4Pg,"We will face drastic moments soon people why life is been so less value it?","We will face drastic moments soon people why life is been so less value it?",1,"2018-04-14 22:44:21","2018-04-14 22:44:21",0,null
13613,UgymGb7SqvqkYaRJO6p4AaABAg,ufHApVWmrpw,KozyKleanKommunizt,UCRyDVzGar393HWHHXDBWZ5w,"I think this war is almost a guarantee which is unfortunate but I really think we will win it","I think this war is almost a guarantee which is unfortunate but I really think we will win it",0,"2018-04-14 22:44:14","2018-04-14 22:44:14",0,null
13614,Ugx-SeN28ydflmfngUV4AaABAg,ufHApVWmrpw,"Liz Brown",UCLSHQCbJFJ5g9IEX2b4t1rQ,"Yes fuck this war cos I dont effin care anymorePut Putin and that effin idiot in a ring  Putin to win Trump is a thing that is a rude thing from my butt sorr","Yes fuck this war cos I dont effin care anymorePut Putin and that effin idiot in a ring  Putin to win Trump is a thing that is a rude thing from my butt sorr",0,"2018-04-14 22:13:58","2018-04-14 22:13:58",0,null
13615,UgwnIfxYIau2-RhAgoh4AaABAg,ufHApVWmrpw,"Donna Anderson",UCay3i9clzFCIOQggcLtATcA,"Old old old.. .it would be nice to. Nuke all libtards. .lol.","Old old old.. .it would be nice to. Nuke all libtards. .lol.",4,"2018-04-14 22:03:50","2018-04-14 22:03:50",0,null
13616,UgzzcuMRSIBhjslEDCB4AaABAg,ufHApVWmrpw,"Im Not Funny",UCCu6eTLSV0DehvNSeOcK8Dw,"Red Dawn anybody?","Red Dawn anybody?",5,"2018-04-14 21:47:31","2018-04-14 21:47:31",2,null
13617,UgzzcuMRSIBhjslEDCB4AaABAg.8f1lBWgmwVg8fE8wx7TFwb,ufHApVWmrpw,"AC Russell",UCITIObDSDpyVA404ttABwGg,"Funny part is i live in Washington state?","Funny part is i live in Washington state?",0,"2018-04-19 17:14:44","2018-04-19 17:14:44",0,UgzzcuMRSIBhjslEDCB4AaABAg
13618,UgzzcuMRSIBhjslEDCB4AaABAg.8f1lBWgmwVg8fE8tW0ua2A,ufHApVWmrpw,"AC Russell",UCITIObDSDpyVA404ttABwGg,"Im Not Funny ??????","Im Not Funny ??????",0,"2018-04-19 17:14:16","2018-04-19 17:14:16",0,UgzzcuMRSIBhjslEDCB4AaABAg
13619,Ugz59JbmDDYblpDDsrJ4AaABAg,ufHApVWmrpw,"Ryan Wood",UCA0MESYEy8fq4dPwbFAeYRQ,"Is the reporter speaking in this the former C Ervana?  LOVE/LOVED your stuff and your voice.  Exceptional investigative Christian/prophetic reporting!!","Is the reporter speaking in this the former C Ervana?  LOVE/LOVED your stuff and your voice.  Exceptional investigative Christian/prophetic reporting!!",0,"2018-04-14 20:52:14","2018-04-14 20:52:14",0,null
13620,UgwIXmRvrO-ywmNqMV54AaABAg,ufHApVWmrpw,"Dick Neva",UCHdHAGwQG2NEiogAGzR2fEw,"I hope the US sends Putin and his Communists to Hell!","I hope the US sends Putin and his Communists to Hell!",0,"2018-04-14 20:21:15","2018-04-14 20:21:15",0,null
13621,Ugg5rNNrG2fl7XgCoAEC,ufHApVWmrpw,"Mathew Clifford Gert Hopkins Jones Viviers De klerk",UCfaSvGZs2pSlQu75GRjGceg,"THIS world will never end!  Eccl 1:4.   Rev 21:2-5.   

The EVIL blood guilty SYSTEM will end!    Daniel 2:44-45  Ps 37:9-11+34

How will  this System end? Rev 19:11 Jesus wage the war of Armageddon       verse 13.  JESUS.   Vers 14.  HEAVENLY SPIRIT forces follow him ......    15. The sword of Righteousness (word of GOD) will hit nations,   and bring Yehovah Gods wrath!    16 King of Kings and Lord of lords.

17+18 they will be stripped of all power and riches by symbolic birds that will eat them...... Masses in uproar

19.  Evil system attack Gods people! Kings or leaders of earth and their armies,  

(instigated by who? )

20 the FALSE PROPHET   and their united system  whom they...the FALSE PROPHET RULE OVER (Rev 17:18) WILL BE DESTROYED AT ARMAGEDDON!    

VERSE 21.   TOGETHER WITH ALL PEOPLE WHO SUPPORTED THEM AND EVEN THEIR CHILDREN!    EZEKIEL 9:4-6..........        GODS PEOPLE ARE MARKED...........SPIRITUALLY FOR SURVIVAL!!!!          JUST AS FALSE RELIGIONS PEOPLE WHO MEDDLE IN POLITICS ARE MARKED BY THE BEAST SYMBOLICALLY BECAUSE THEY MEDDLED IN POLITICS.......

READ ALL SCRIPTURES.  PLEASE AND MAKE SURE YOU DO AS REV 28:4 SAYS.....BEFORE ARMAGEDDON FROM REVELATION 18 VERSE 2-9+24.   

FLEE......RESIGN ABSTAIN FROM SUPPORTING EVIL BLOOD SHEDDING!  

REPENT OF FACE THE CONSEQUENCES OF WRONG CHOICES. 

GODS PEOPLE OBEY THEIR AUTHORITIES laws.....pay their taxes but do not meddle in political affairs!      

","THIS world will never end!  Eccl 1:4.   Rev 21:2-5.   

The EVIL blood guilty SYSTEM will end!    Daniel 2:44-45  Ps 37:9-11+34

How will  this System end? Rev 19:11 Jesus wage the war of Armageddon       verse 13.  JESUS.   Vers 14.  HEAVENLY SPIRIT forces follow him ......    15. The sword of Righteousness (word of GOD) will hit nations,   and bring Yehovah Gods wrath!    16 King of Kings and Lord of lords.

17+18 they will be stripped of all power and riches by symbolic birds that will eat them...... Masses in uproar

19.  Evil system attack Gods people! Kings or leaders of earth and their armies,  

(instigated by who? )

20 the FALSE PROPHET   and their united system  whom they...the FALSE PROPHET RULE OVER (Rev 17:18) WILL BE DESTROYED AT ARMAGEDDON!    

VERSE 21.   TOGETHER WITH ALL PEOPLE WHO SUPPORTED THEM AND EVEN THEIR CHILDREN!    EZEKIEL 9:4-6..........        GODS PEOPLE ARE MARKED...........SPIRITUALLY FOR SURVIVAL!!!!          JUST AS FALSE RELIGIONS PEOPLE WHO MEDDLE IN POLITICS ARE MARKED BY THE BEAST SYMBOLICALLY BECAUSE THEY MEDDLED IN POLITICS.......

READ ALL SCRIPTURES.  PLEASE AND MAKE SURE YOU DO AS REV 28:4 SAYS.....BEFORE ARMAGEDDON FROM REVELATION 18 VERSE 2-9+24.   

FLEE......RESIGN ABSTAIN FROM SUPPORTING EVIL BLOOD SHEDDING!  

REPENT OF FACE THE CONSEQUENCES OF WRONG CHOICES. 

GODS PEOPLE OBEY THEIR AUTHORITIES laws.....pay their taxes but do not meddle in political affairs!      

",5,"2018-04-14 20:15:53","2018-04-14 20:15:53",1,null
13622,Ugg5rNNrG2fl7XgCoAEC.8f1ahLmu3A88f1rMftrE_J,ufHApVWmrpw,"Mike Nianiouras",UCBC1TloXmNiKOm-HeHkvt3g,"Russia couldnt even lift its own Submarine The Kursk and let all the Sailors DIED. !!
RUSSIA LOSE WAR IN AFGHANISTAN AND AGAINST MUJAHEDEEN.. 
LMFAAAAOOOOOO !!!!!
RUSSIA IS FULL OF SHIT !!!","Russia couldnt even lift its own Submarine The Kursk and let all the Sailors DIED. !!
RUSSIA LOSE WAR IN AFGHANISTAN AND AGAINST MUJAHEDEEN.. 
LMFAAAAOOOOOO !!!!!
RUSSIA IS FULL OF SHIT !!!",0,"2018-04-14 22:41:28","2018-04-14 22:41:28",0,Ugg5rNNrG2fl7XgCoAEC
13623,UgzeV_5xChwUypr6_bB4AaABAg,ufHApVWmrpw,"Harrison and jevon",UCFGsw94cBife0FYSCOAINdg,"God bless Jesus Christ I bless for peace not humanity I bless for all peace to country’s god bless to make are voilent world happy and nice as it will I believe we have a chance hope for putin to stop because they are annoying I hope god bless I live and god bless others for the best by th3 name Jesus Christ #peace","God bless Jesus Christ I bless for peace not humanity I bless for all peace to country’s god bless to make are voilent world happy and nice as it will I believe we have a chance hope for putin to stop because they are annoying I hope god bless I live and god bless others for the best by th3 name Jesus Christ #peace",44,"2018-04-14 20:13:47","2018-04-14 20:13:47",16,null
13624,UgzeV_5xChwUypr6_bB4AaABAg.8f1aT-fhh4e8fBxpbwWtP6,ufHApVWmrpw,"mickel mccain",UCz7jmpx_Al-LKL-E11nzppw,"What ???","What ???",0,"2018-04-18 20:50:24","2018-04-18 20:50:24",0,UgzeV_5xChwUypr6_bB4AaABAg
13625,UgzeV_5xChwUypr6_bB4AaABAg.8f1aT-fhh4e8f7hcywLJ0r,ufHApVWmrpw,CoffeeShopTV,UCfmcciyuK03M5phq_UAwcFw,"YOU BETTER PRAY THEY DO......AND DONT BE EVIL....YOU...","YOU BETTER PRAY THEY DO......AND DONT BE EVIL....YOU...",0,"2018-04-17 05:11:54","2018-04-17 05:11:54",0,UgzeV_5xChwUypr6_bB4AaABAg
13626,UgzeV_5xChwUypr6_bB4AaABAg.8f1aT-fhh4e8f7AmbYEczs,ufHApVWmrpw,"Julie T",UCDCRF_Hp2tof3WiVg_L6-GQ,"Amen Omar were Going home Any time now","Amen Omar were Going home Any time now",1,"2018-04-17 00:16:07","2018-04-17 00:16:07",0,UgzeV_5xChwUypr6_bB4AaABAg
13627,UgzeV_5xChwUypr6_bB4AaABAg.8f1aT-fhh4e8f6QbgHy_yD,ufHApVWmrpw,"Jeffrey Diehl",UChs0VKeD-cgtZu7VG5opn_Q,"lights beam he already has","lights beam he already has",0,"2018-04-16 17:15:11","2018-04-16 17:15:11",0,UgzeV_5xChwUypr6_bB4AaABAg
13628,UgxX429LBr0yscSUXUd4AaABAg,ufHApVWmrpw,"bullshi Ward",UCYrmhlKgGFQlav9ec4z90Pg,"America will rule the world by 2099","America will rule the world by 2099",11,"2018-04-14 20:11:48","2018-04-14 20:11:48",24,null
13629,UgxX429LBr0yscSUXUd4AaABAg.8f1aEMJfe0B8fDnMQYT1dC,ufHApVWmrpw,"bullshi Ward",UCYrmhlKgGFQlav9ec4z90Pg,"Brian Deschanel keep dreaming Brain Boy! Your nation is poor and weak","Brian Deschanel keep dreaming Brain Boy! Your nation is poor and weak",0,"2018-04-19 13:57:22","2018-04-19 13:57:22",0,UgxX429LBr0yscSUXUd4AaABAg
13630,UgxX429LBr0yscSUXUd4AaABAg.8f1aEMJfe0B8fDnBd9OqGo,ufHApVWmrpw,"bullshi Ward",UCYrmhlKgGFQlav9ec4z90Pg,"poplew mibble east is evil and full of sin.look how yall living, worst then then the Mexicans Your government dont give a 2 shits about Yall.90% of y all illiterate cant read cant write and brain washed","poplew mibble east is evil and full of sin.look how yall living, worst then then the Mexicans Your government dont give a 2 shits about Yall.90% of y all illiterate cant read cant write and brain washed",0,"2018-04-19 13:55:54","2018-04-19 13:55:54",0,UgxX429LBr0yscSUXUd4AaABAg
13631,UgxX429LBr0yscSUXUd4AaABAg.8f1aEMJfe0B8fDmafwC2J_,ufHApVWmrpw,"bullshi Ward",UCYrmhlKgGFQlav9ec4z90Pg,"Rhonda clark Obama is not a Antichrist the devil is a liar TRUMP on the other head?","Rhonda clark Obama is not a Antichrist the devil is a liar TRUMP on the other head?",0,"2018-04-19 13:50:43","2018-04-19 13:50:43",0,UgxX429LBr0yscSUXUd4AaABAg
13632,UgxX429LBr0yscSUXUd4AaABAg.8f1aEMJfe0B8fDmQDxQKk_,ufHApVWmrpw,"bullshi Ward",UCYrmhlKgGFQlav9ec4z90Pg,"Tehani Worlds Your poor government kno whos Superior.The USA NATO India Japan South Korea is a force.tell me how in the world Russia China iran and Cuba can win that war. America will DUST all 4 alone","Tehani Worlds Your poor government kno whos Superior.The USA NATO India Japan South Korea is a force.tell me how in the world Russia China iran and Cuba can win that war. America will DUST all 4 alone",0,"2018-04-19 13:49:09","2018-04-19 13:49:09",0,UgxX429LBr0yscSUXUd4AaABAg
13633,UgxX429LBr0yscSUXUd4AaABAg.8f1aEMJfe0B8fDlpnAkNyz,ufHApVWmrpw,"bullshi Ward",UCYrmhlKgGFQlav9ec4z90Pg,"TERRAXX l Russia is the poor mans America but communist. They dont have the money or military power. Millions of Americans will be lost Butt America will rule the globe and Russia will be communist free.","TERRAXX l Russia is the poor mans America but communist. They dont have the money or military power. Millions of Americans will be lost Butt America will rule the globe and Russia will be communist free.",0,"2018-04-19 13:44:03","2018-04-19 13:44:03",0,UgxX429LBr0yscSUXUd4AaABAg
13634,UgxuCg9OzRhubIO5lZF4AaABAg,ufHApVWmrpw,"Harrison and jevon",UCFGsw94cBife0FYSCOAINdg,"Well fucking done Russia you are fucking dick head cunts putin if you read this then fuck you coward dick head I’m supporting England an£ are allies fuck you russia you dick head","Well fucking done Russia you are fucking dick head cunts putin if you read this then fuck you coward dick head I’m supporting England an£ are allies fuck you russia you dick head",0,"2018-04-14 20:08:04","2018-04-14 20:08:04",0,null
13635,UgzEi7rxtLOU2HATfx94AaABAg,ufHApVWmrpw,"joseph Albert",UCTp2emt3A5uZxPKR0TQhGBg,"The bible warns they gathered together at a place called Armageddon.the world leaders will gather together in Syria for ww3 and possibly nuclear bomb then they will ask for the head for puten.","The bible warns they gathered together at a place called Armageddon.the world leaders will gather together in Syria for ww3 and possibly nuclear bomb then they will ask for the head for puten.",1,"2018-04-14 19:35:08","2018-04-14 19:35:08",0,null
13636,Ugz7VRXpeHfZ6AoG6Sd4AaABAg,ufHApVWmrpw,"Lisa Kovacs",UCBiNMjJnbF2TKlmSWp4bOuw,"Hairdo against moron.","Hairdo against moron.",0,"2018-04-14 19:21:40","2018-04-14 19:21:40",0,null
13637,UgxvpzDhvAPk9RR_IDR4AaABAg,ufHApVWmrpw,chengstax,UC9VvTlvseDxf7RWfjM1eKQg,"Obviously you know this is staged, and a lie. WE are starting shit with Syria and russia.  WE are the bad guys.  Why the FUCK do we care about a few dozen people who gets chlorine poured on them? And yet dont we care about the hundreds of thousands of people starving in N. Korea, dying every day? Why the fuck do we attack a country that has chemicals, rather than N. Korea who HAS NUKES, and even SAYS THEY WILL NUKE US. something doesnt fucking add up.","Obviously you know this is staged, and a lie. WE are starting shit with Syria and russia.  WE are the bad guys.  Why the FUCK do we care about a few dozen people who gets chlorine poured on them? And yet dont we care about the hundreds of thousands of people starving in N. Korea, dying every day? Why the fuck do we attack a country that has chemicals, rather than N. Korea who HAS NUKES, and even SAYS THEY WILL NUKE US. something doesnt fucking add up.",0,"2018-04-14 18:26:12","2018-04-14 18:26:12",0,null
13638,UgzoUerqhh4l1agt2ud4AaABAg,ufHApVWmrpw,"friedrich nietzsche",UC3NGztu3dcUnRs7xxDu9gmw,"FUCK JESUS, ...!!!","FUCK JESUS, ...!!!",0,"2018-04-14 18:21:13","2018-04-14 18:21:13",0,null
13639,Ugxzx7GUZc_pnSI6JmZ4AaABAg,ufHApVWmrpw,esechucote52,UC_KX7WyaCN2SaZKXA89kmDg,"usa has only won their own civil war! fight one on one nations?!","usa has only won their own civil war! fight one on one nations?!",1,"2018-04-14 18:08:51","2018-04-14 18:08:51",1,null
13640,Ugxzx7GUZc_pnSI6JmZ4AaABAg.8f1N9x66jQ-8f44sWih2kg,ufHApVWmrpw,"King Fisher Maan",UCeYURkQrwo5xdLXWOzFp9hQ,"esechucote52 yeah like britain in WW2 even though the US came in a bit later","esechucote52 yeah like britain in WW2 even though the US came in a bit later",0,"2018-04-15 19:26:46","2018-04-15 19:26:46",0,Ugxzx7GUZc_pnSI6JmZ4AaABAg
13641,Ugyf6vL_To8G1nky9DV4AaABAg,ufHApVWmrpw,"Darren Hayes",UCkrMdHhzKN1mLM6Jp4q3AtA,"LADY YOU ARE AN IDIOT.IF THIS IS ALL TRUE OR FAKE.SHUT YOUR TRAP!","LADY YOU ARE AN IDIOT.IF THIS IS ALL TRUE OR FAKE.SHUT YOUR TRAP!",0,"2018-04-14 17:43:44","2018-04-14 17:43:44",0,null
13642,Ugyv5KiQNYUYcFYQ0lt4AaABAg,ufHApVWmrpw,"Krus Vas",UCl3yyt_Aur8-3XFZC-P9OGg,"WW3 was planned 200 years ago by Albert Pike","WW3 was planned 200 years ago by Albert Pike",17,"2018-04-14 17:19:32","2018-04-14 17:19:32",16,null
13643,Ugyv5KiQNYUYcFYQ0lt4AaABAg.8f1HWfY7Qyd8fDdIUCbsT8,ufHApVWmrpw,"Rhonda clark",UCqPeG8fExPGif4jYRMg77Dw,"dog of war    ????☪️PLAUGES WARNING YOUTUBE. UH UH LOOK WHAT IS HAPPENING AT THE MEXICO BORDER. ADD. 10 zombie virus. Read my post it Emergency ?","dog of war    ????☪️PLAUGES WARNING YOUTUBE. UH UH LOOK WHAT IS HAPPENING AT THE MEXICO BORDER. ADD. 10 zombie virus. Read my post it Emergency ?",0,"2018-04-19 12:29:27","2018-04-19 12:29:27",0,Ugyv5KiQNYUYcFYQ0lt4AaABAg
13644,Ugyv5KiQNYUYcFYQ0lt4AaABAg.8f1HWfY7Qyd8f569CTHQnz,ufHApVWmrpw,"A Guy",UCfwRoI4rCbgqTvqBKOGyzHg,"+dog of war They will find a safe place in the bush","+dog of war They will find a safe place in the bush",0,"2018-04-16 04:57:10","2018-04-16 04:57:10",0,Ugyv5KiQNYUYcFYQ0lt4AaABAg
13645,Ugyv5KiQNYUYcFYQ0lt4AaABAg.8f1HWfY7Qyd8f3bnDjCqmD,ufHApVWmrpw,Titaniumborn,UCcuHPHHHBK7_eEOs_qF22vQ,"Communism started by Jews fact","Communism started by Jews fact",1,"2018-04-15 15:03:54","2018-04-15 15:03:54",0,Ugyv5KiQNYUYcFYQ0lt4AaABAg
13646,Ugyv5KiQNYUYcFYQ0lt4AaABAg.8f1HWfY7Qyd8f3X7K6MI0t,ufHApVWmrpw,"dog of war",UCFLxMCh6ul5yQUrwriIIrvg,"Nonya FknBusiness leftys like corbyn have destroyed this world. We will end up like Rome did a complete restart back to the stone age!! You better brush up on your bush craft skills. ?","Nonya FknBusiness leftys like corbyn have destroyed this world. We will end up like Rome did a complete restart back to the stone age!! You better brush up on your bush craft skills. ?",0,"2018-04-15 14:14:21","2018-04-15 14:14:21",0,Ugyv5KiQNYUYcFYQ0lt4AaABAg
13647,Ugyv5KiQNYUYcFYQ0lt4AaABAg.8f1HWfY7Qyd8f3WV_AyR6_,ufHApVWmrpw,"Nonya FknBusiness",UCqb6SdDBCr5VxXf4EssgJQg,"You have to look at the who what when where and why...  The wars are about killing off the male vote so that the female can run society.  As the female has ran society our sons have become like woman and our daughters like men. This has all happened before and it will end the same way.  Woman will wish they never betrayed man.","You have to look at the who what when where and why...  The wars are about killing off the male vote so that the female can run society.  As the female has ran society our sons have become like woman and our daughters like men. This has all happened before and it will end the same way.  Woman will wish they never betrayed man.",1,"2018-04-15 14:08:56","2018-04-15 14:08:56",0,Ugyv5KiQNYUYcFYQ0lt4AaABAg
13648,Ugwvc317VSJXlzB6kyd4AaABAg,ufHApVWmrpw,"Gullible S",UC07i9wZY28fPD3eGXw3jVnw,"Putins warning is Obamas redline drawn on water :)","Putins warning is Obamas redline drawn on water :)",0,"2018-04-14 17:03:42","2018-04-14 17:03:42",0,null
13649,Ugyu4RPbqAa3g3td2nV4AaABAg,ufHApVWmrpw,"Bonnie Wilson",UCz07YZcRSzvhYCEUW0SPTdg,"Some how i think muller is involved in this and democrates  for new world order..","Some how i think muller is involved in this and democrates  for new world order..",1,"2018-04-14 15:57:41","2018-04-14 15:57:41",0,null
13650,UgwQ2cbIZRA2_VLpXFp4AaABAg,ufHApVWmrpw,"SRC t",UCuwznUoz0AHJogOky1hzyHA,"You think Im special thank you.☺","You think Im special thank you.☺",0,"2018-04-14 15:57:16","2018-04-14 15:57:16",0,null
